COD FISCAL,COD SIIIR,COD SIIIR SUP,COD SIRUES,SIRUTA LOC SUP,SIRUTA LOCALITATE,cod,judet,lat,lon,nr,nume,nume_ascii,oras,str,wikidata,
,362105309,361103655,,14272,14290,362105309,ARGEŞ,,,,ŞCOALA PRIMARĂ BĂJESTI,SCOALA PRIMARA BAJESTI,BĂJEŞTI,,,
,362100937,361104145,,14726,14744,362100937,ARGEŞ,,,1,GRĂDINIȚA CU PROGRAM NORMAL MOȘTENI GRECI,GRADINITA CU PROGRAM NORMAL MOSTENI GRECI,MOŞTENI-GRECI,PRINCIPALĂ,,
4121935,361100236,,966190,13301,13310,361100236,ARGEŞ,,,1,"""GRĂDINIȚA CU PROGRAM PRELUNGIT """"TIC-PITIC"""" MIOVENI""",GRADINITA CU PROGRAM PRELUNGIT TIC PITIC MIOVENI,MIOVENI,ALEEA CAMINULUI,,
,362105883,361103845,,15741,15796,362105883,ARGEŞ,,,,GRĂDINIŢA CU PROGRAM NORMAL OEŞTI,GRADINITA CU PROGRAM NORMAL OESTI,OEŞTII UNGURENI,,,
15626402,361103578,,334859,20048,18224,361103578,ARGEŞ,,,112,"""ȘCOALA GIMNAZIALĂ """"ILIE STĂNCULESCU"""" RÂCA""",SCOALA GIMNAZIALA ILIE STANCULESCU RACA,RÂCA,PRINCIPALĂ,,
4793138,361103682,,300659,13490,13506,361103682,ARGEŞ,,,185,LICEUL CU PROGRAM SPORTIV CÂMPULUNG,LICEUL CU PROGRAM SPORTIV CAMPULUNG,CÂMPULUNG,NEGRU VODĂ,,
,362105467,361100082,,13490,13506,362105467,ARGEŞ,,,,GRĂDINIŢA CU PROGRAM NORMAL NR.2 C-LUNG,GRADINITA CU PROGRAM NORMAL NR 2 C LUNG,CÂMPULUNG,,,
,362101305,361104249,,13999,14003,362101305,ARGEŞ,,,1,GRĂDINIȚA CU PROGRAM NORMAL ANINOASA,GRADINITA CU PROGRAM NORMAL ANINOASA,ANINOASA,PRINCIPALĂ,,
,362102161,361104484,,19249,19294,362102161,ARGEŞ,,,,ŞCOALA GIMNAZIALĂ BÂRSEŞTI,SCOALA GIMNAZIALA BARSESTI,BÂRSEŞTII DE JOS,,,
5010064,361104742,,300582,13490,13506,361104742,ARGEŞ,,,15,"""COLEGIUL NAȚIONAL PEDAGOGIC """"CAROL I"""" CÂMPULUNG""",COLEGIUL NATIONAL PEDAGOGIC CAROL I CAMPULUNG,CÂMPULUNG,MĂRĂȘEȘTI,,
4793146,361100082,,331414,13490,13506,361100082,ARGEŞ,,,3,"""ȘCOALA GIMNAZIALĂ """"C.D. ARICESCU"""" CÂMPULUNG""",SCOALA GIMNAZIALA C D ARICESCU CAMPULUNG,CÂMPULUNG,REPUBLICII,,
,362101115,361104181,,14165,14218,362101115,ARGEŞ,,,1,ȘCOALA PRIMARĂ MĂNICEȘTI,SCOALA PRIMARA MANICESTI,MĂNICEŞTI,PRINCIPALĂ,,
,362102948,361104674,,17254,17281,362102948,ARGEŞ,,,,ŞCOALA PRIMARĂ FURNICOŞI,SCOALA PRIMARA FURNICOSI,FURNICOŞI,COMUNAL,,
,362103171,361104258,,16659,16711,362103171,ARGEŞ,,,,ŞCOALA PRIMARĂ LUCIENI,SCOALA PRIMARA LUCIENI,LUCIENI,,,
335060,361103967,,335060,18475,18518,361103967,ARGEŞ,,,161,ȘCOALA GIMNAZIALĂ ȘERBĂNEȘTI-ROCIU,SCOALA GIMNAZIALA SERBANESTI ROCIU,ŞERBĂNEŞTI,PRINCIPAL,,
29348896,361103741,,331817,13935,13944,361103741,ARGEŞ,,,396,"""ȘCOALA GIMNAZIALĂ """"SANDA MOVILĂ"""" ALBOTA""",SCOALA GIMNAZIALA SANDA MOVILA ALBOTA,ALBOTA,PRINCIPALĂ,,
4971871,361104534,,1180400,13169,13178,361104534,ARGEŞ,,,6,"""LICEUL TEORETIC """"ION BARBU"""" PITEȘTI""",LICEUL TEORETIC ION BARBU PITESTI,PITEŞTI,TRANSILVANIEI,,
4318270,361104249,,331843,13999,14003,361104249,ARGEŞ,,,124,ȘCOALA GIMNAZIALĂ BROȘTENI-ANINOASA,SCOALA GIMNAZIALA BROSTENI ANINOASA,ANINOASA,PRINCIPALĂ,,
,362105327,361103673,,13891,13917,362105327,ARGEŞ,,,,GRĂDINIŢA CU PROGRAM NORMAL ALBEŞTI DE MUSCEL,GRADINITA CU PROGRAM NORMAL ALBESTI DE MUSCEL,ALBEŞTI,,,
,352104615,371100182,330981,13668,13677,352104615,ARGEŞ,,,17,CLUBUL COPIILOR COSTEŞTI,CLUBUL COPIILOR COSTESTI,COSTEŞTI,Ștrandului nr 17,,
5138960,361105119,,300102,17575,17584,361105119,ARGEŞ,,,1,"""LICEUL TEHNOLOGIC """"LIVIU REBREANU"""" MOZĂCENI""",LICEUL TEHNOLOGIC LIVIU REBREANU MOZACENI,MOZĂCENI,PRINCIPALĂ,,
,362100919,361100037,,14851,14879,362100919,ARGEŞ,,,1,ȘCOALA PRIMARĂ BUDEASA MICĂ,SCOALA PRIMARA BUDEASA MICA,BUDEASA MICĂ,PRINCIPALĂ,,
,362100661,361104059,,15108,15126,362100661,ARGEŞ,,,1,ȘCOALA GIMNAZIALĂ RÂNCĂCIOV,SCOALA GIMNAZIALA RANCACIOV,CĂLINEŞTI,PRINCIPALĂ,,
,362101133,361104181,,14165,14263,362101133,ARGEŞ,,,315,ȘCOALA PRIMARĂ ZIGONENI,SCOALA PRIMARA ZIGONENI,ZIGONENI,PRINCIPALĂ,,
4469434,361103515,,333752,16739,16748,361103515,ARGEŞ,,,753,"""ȘCOALA GIMNAZIALĂ """"ELENA DAVILA PERTICARI"""" IZVORU""",SCOALA GIMNAZIALA ELENA DAVILA PERTICARI IZVORU,IZVORU,PRINCIPALĂ,,
,362102369,361103596,,18778,18812,362102369,ARGEŞ,,,,GRĂDINIŢA CU PROGRAM NORMAL OGREZEA,GRADINITA CU PROGRAM NORMAL OGREZEA,OGREZEA,,,
,362105404,361104095,,17824,17833,362105404,ARGEŞ,,,,GRĂDINIŢA CU PROGRAM NORMAL OARJA SAT,GRADINITA CU PROGRAM NORMAL OARJA SAT,OARJA,,,
,362101983,361104371,,19793,19962,362101983,ARGEŞ,,,1,GRĂDINIȚA CU PROGRAM NORMAL VAȚA,GRADINITA CU PROGRAM NORMAL VATA,VAŢA,PRINCIPALĂ,,
29497103,361104181,,331946,14165,14174,361104181,ARGEŞ,,,29,ȘCOALA GIMNAZIALĂ BĂICULEȘTI,SCOALA GIMNAZIALA BAICULESTI,BĂICULEŞTI,PRINCIPALĂ,,
,362102188,361103438,,19212,19221,362102188,ARGEŞ,,,,GRADINITA CU PROGRAM NORMAL NR. 1 TEIU,GRADINITA CU PROGRAM NORMAL NR 1 TEIU,TEIU,,,
4122272,361104769,,1180451,13169,13178,361104769,ARGEŞ,,,2,"""LICEUL TEHNOLOGIC """"CONSTANTIN BRÂNCUȘI"""" PITEȘTI""",LICEUL TEHNOLOGIC CONSTANTIN BRANCUSI PITESTI,PITEŞTI,PĂTRAŞCU VODĂ,,
,362102984,361104674,,17254,17272,362102984,ARGEŞ,,,,ŞCOALA GIMNAZIALĂ DRĂGHICI,SCOALA GIMNAZIALA DRAGHICI,DRĂGHICI,COMUNAL,,
,362100584,361103913,,15233,15304,362100584,ARGEŞ,,,,ȘCOALA PRIMARĂ SILIȘTEA,SCOALA PRIMARA SILISTEA,SILIŞTEA,PRINCIPALĂ,,
23472843,361106468,,,13169,13178,361106468,ARGEŞ,,,12,Grădiniţa Maria Pro Day,GRADINITA MARIA PRO DAY,PITEŞTI,Eremia Grigorescu,,
32163014,361206326,,33210046,13169,13178,361206326,ARGEŞ,,,16,"""GRADINITA """"KINDER STRUMFF""""""",GRADINITA KINDER STRUMFF,PITEŞTI,EGALITATII,,
29386571,361104977,,331011,13169,13178,361104977,ARGEŞ,,,50,"""ȘCOALA GIMNAZIALĂ """"NICOLAE SIMONIDE"""" PITEȘTI""",SCOALA GIMNAZIALA NICOLAE SIMONIDE PITESTI,PITEŞTI,09.mai,,
,362103117,361104077,301092,16908,16935,362103117,ARGEŞ,,,,GRADINITA CU PROGRAM NORMAL VOINEŞTI,GRADINITA CU PROGRAM NORMAL VOINESTI,VOINEŞTI,,,
4121935,361103723,,3300336,13301,13310,361103723,ARGEŞ,,,1,"""GRĂDINIȚA CU PROGRAM NORMAL """"CAMPIONII"""" MIOVENI""",GRADINITA CU PROGRAM NORMAL CAMPIONII MIOVENI,MIOVENI,PĂRĂȘTI,,
,362105363,361104778,,13668,13677,362105363,ARGEŞ,,,,GRĂDINIŢA CU PROGRAM NORMAL ZORILE,GRADINITA CU PROGRAM NORMAL ZORILE,COSTEŞTI,,,
,362105612,361103465,,14922,14931,362105612,ARGEŞ,,,,GRĂDINIŢA CU PROGRAM NORMAL POIENANDRE,GRADINITA CU PROGRAM NORMAL POIENANDRE,BUGHEA DE JOS,,,
,362105345,361104846,,13819,13837,362105345,ARGEŞ,,,,GRĂDINIŢA CU PROGRAM NORMAL UNGURENI,GRADINITA CU PROGRAM NORMAL UNGURENI,ALBEŞTII UNGURENI,,,
,362102645,361103881,,18028,18082,362102645,ARGEŞ,,,,GRĂDINIŢA CU PROGRAM NORMAL DINCULEŞTI,GRADINITA CU PROGRAM NORMAL DINCULESTI,DINCULEŞTI,,,
4122574,361104516,,300243,13392,13409,361104516,ARGEŞ,,,42,"""ȘCOALA GIMNAZIALĂ """"VINTILĂ BRĂTIANU"""" ȘTEFĂNEȘTI""",SCOALA GIMNAZIALA VINTILA BRATIANU STEFANESTI,ŞTEFĂNEŞTI,CÂMPULUI,,
,362101513,361103759,,13301,13310,362101513,ARGEŞ,,,1,GRĂDINIȚA CU PROGRAM NORMAL COLIBAȘI,GRADINITA CU PROGRAM NORMAL COLIBASI,MIOVENI,COLIBAȘI,,
,362100643,361104059,,15108,15199,362100643,ARGEŞ,,,1,GRĂDINIȚA CU PROGRAM NORMAL UDENI,GRADINITA CU PROGRAM NORMAL UDENI,UDENI-ZĂVOI,PRINCIPALĂ,,
22161474,361203522,,321773910,13757,13766,361203522,ARGEŞ,,,,GRĂDINIŢA LICURICII,GRADINITA LICURICII,TOPOLOVENI,,,
5172600,361103533,,336181,13276,13285,361103533,ARGEŞ,,,360,"""ȘCOALA GIMNAZIALĂ """"MIHAI EMINESCU"""" BRADU""",SCOALA GIMNAZIALA MIHAI EMINESCU BRADU,BRADU,PRINCIPALĂ,,
,362105422,361104389,,17968,17977,362105422,ARGEŞ,,,,GRĂDINIŢA C U PROGRAM NORMAL NR.3 VALEA ITULUI,GRADINITA C U PROGRAM NORMAL NR 3 VALEA ITULUI,POIENARI,,,
,362102437,361104403,,18554,18572,362102437,ARGEŞ,,,,ŞCOALA PRIMARĂ NR.1,SCOALA PRIMARA NR 1,VĂLENI,JUD TIGVENI SALATRUCU,,
4469248,361103397,,326265,13169,13178,361103397,ARGEŞ,,,2,"""GRĂDINIȚA CU PROGRAM PRELUNGIT """"RAZĂ DE SOARE"""" PITEȘTI""",GRADINITA CU PROGRAM PRELUNGIT RAZA DE SOARE PITESTI,PITEŞTI,Călugăreni,,
4469450,361104706,,334601,17851,17860,361104706,ARGEŞ,,,1,ȘCOALA GIMNAZIALĂ NR. 1 PIETROȘANI,SCOALA GIMNAZIALA NR 1 PIETROSANI,PIETROŞANI,PRINCIPALĂ,,
,362105286,361103795,,14352,14370,362105286,ARGEŞ,,,,GRĂDINIŢA CU PROGRAM NORMAL BELEŢI,GRADINITA CU PROGRAM NORMAL BELETI,NEGREŞTI,,,
,362101703,361105015,,13169,13178,362101703,ARGEŞ,,,1,GRĂDINIȚA CU PROGRAM NORMAL NR. 14 PITEȘTI,GRADINITA CU PROGRAM NORMAL NR 14 PITESTI,PITEŞTI,Traian,,
32154148,361206344,,32722614,13169,13178,361206344,ARGEŞ,,,226,"""COLEGIUL ECOLOGIC """"Prof. Univ.Dr.ALEXANDRU IONESCU""""""",COLEGIUL ECOLOGIC PROF UNIV DR ALEXANDRU IONESCU,PITEŞTI,B-dul repunlicii,,
,362103284,361103628,,17619,17682,362103284,ARGEŞ,,,,ŞCOALA GIMNAZIALĂ STROEŞTI,SCOALA GIMNAZIALA STROESTI,STROEŞTI,,,
4122531,361104959,,327609,16285,16294,361104959,ARGEŞ,,,1,ȘCOALA GIMNAZIALĂ DAVIDEȘTI,SCOALA GIMNAZIALA DAVIDESTI,DAVIDEŞTI,PRINCIPALĂ,,
,362102084,361103827,,19560,19622,362102084,ARGEŞ,,,,GRADINITA CU PROGRAM NORMAL SATU NOU,GRADINITA CU PROGRAM NORMAL SATU NOU,SATU NOU,,,
,362103135,361104077,,16908,16935,362103135,ARGEŞ,,,,ŞCOALA GIMNAZIALĂ VOINEŞTI,SCOALA GIMNAZIALA VOINESTI,VOINEŞTI,,,
,362102889,361100132,,17423,17478,362102889,ARGEŞ,,,,ŞCOALA PRIMARĂ MĂNCIOIU,SCOALA PRIMARA MANCIOIU,MĂNCIOIU,COMUNAL,,
,362102663,361104389,,17968,17986,362102663,ARGEŞ,,,,GRĂDINIŢA CU PROGRAM NORMAL NR.2,GRADINITA CU PROGRAM NORMAL NR 2,GROŞANI,PRINCIPALĂ,,
29484693,361104579,,331047,13169,13178,361104579,ARGEŞ,,,35,"""ȘCOALA GIMNAZIALĂ """"TRAIAN"""" PITEȘTI""",SCOALA GIMNAZIALA TRAIAN PITESTI,PITEŞTI,TRAIAN,,
12717166,361103705,,335112,13301,13310,361103705,ARGEŞ,,,26,"""ȘCOALA GIMNAZIALĂ """"GEORGE TOPÎRCEANU"""" MIOVENI""",SCOALA GIMNAZIALA GEORGE TOPIRCEANU MIOVENI,MIOVENI,PARASTI,,
,362101282,361104846,,13819,13864,362101282,ARGEŞ,,,1,ȘCOALA PRIMARĂ DOBROTU,SCOALA PRIMARA DOBROTU,DOBROTU,PRINCIPALĂ,,
,362101065,361103664,,14405,14432,362101065,ARGEŞ,,,1,ȘCOALA PRIMARĂ GĂMĂCEȘTI,SCOALA PRIMARA GAMACESTI,GĂMĂCEŞTI,PRINCIPALĂ,,
4318008,361104398,,1180499,13169,13178,361104398,ARGEŞ,,,1,"""COLEGIUL NAȚIONAL """"ALEXANDRU ODOBESCU"""" PITEȘTI""",COLEGIUL NATIONAL ALEXANDRU ODOBESCU PITESTI,PITEŞTI,Vasile Parvan,,
4654784,361103872,,300114,13365,13374,361103872,ARGEŞ,,,464,LICEUL TEHNOLOGIC NR. 1 MĂRĂCINENI,LICEUL TEHNOLOGIC NR 1 MARACINENI,MĂRĂCINENI,PRINCIPALĂ,,
,362100625,361104059,,15108,15126,362100625,ARGEŞ,,,1,GRĂDINIȚA CU PROGRAM NORMAL DRĂGHICEȘTI,GRADINITA CU PROGRAM NORMAL DRAGHICESTI,CĂLINEŞTI,PRINCIPALĂ,,
29412735,361105078,,966176,13169,13178,361105078,ARGEŞ,,,11,"""GRĂDINIȚA CU PROGRAM PRELUNGIT """"ALBĂ CA ZĂPADA"""" PITEȘTI""",GRADINITA CU PROGRAM PRELUNGIT ALBA CA ZAPADA PITESTI,PITEŞTI,Stejarului,,
,362102419,361100019,,18670,18732,362102419,ARGEŞ,,,,GRĂDINIŢA CU PROGRAM NORMAL NR.1,GRADINITA CU PROGRAM NORMAL NR 1,VALEA PECHII,ULITA BISERICII,,
5103430,361104145,,332338,14726,14735,361104145,ARGEŞ,,,287,ȘCOALA GIMNAZIALĂ BOȚEȘTI,SCOALA GIMNAZIALA BOTESTI,BOŢEŞTI,PRINCIPALĂ,,
4121986,361104493,,335841,19695,19702,361104493,ARGEŞ,,,1,ȘCOALA GIMNAZIALĂ NR. 1 VALEA IAȘULUI,SCOALA GIMNAZIALA NR 1 VALEA IASULUI,VALEA IAŞULUI,PRINCIPALĂ,,
29466980,361104724,,1138341,13169,13178,361104724,ARGEŞ,,,1,"""ȘCOALA GIMNAZIALĂ """"TUDOR MUȘATESCU"""" PITEȘTI""",SCOALA GIMNAZIALA TUDOR MUSATESCU PITESTI,PITEŞTI,PESCARILOR,,
4122116,361100132,,334297,17423,17432,361100132,ARGEŞ,,,1,ȘCOALA GIMNAZIALĂ MORĂREȘTI,SCOALA GIMNAZIALA MORARESTI,MORĂREŞTI,E81,,
,362101721,361103542,,13169,13178,362101721,ARGEŞ,,,1,GRĂDINIȚA CU PROGRAM NORMAL NR. 12 PITEȘTI,GRADINITA CU PROGRAM NORMAL NR 12 PITESTI,PITEŞTI,PETROCHIMISTILOR,,
32871169,361206362,,32038219,13392,13409,361206362,ARGEŞ,,,158,"""GRADINITA """"RAY KINDERGARTEN"""" ŞTEFANESTI""",GRADINITA RAY KINDERGARTEN STEFANESTI,ŞTEFĂNEŞTI,Soseaua Bucuresti Pitesti,,
,362102066,361103352,,19631,19686,362102066,ARGEŞ,,,,ŞCOALA PRIMARĂ NR.1,SCOALA PRIMARA NR 1,VERNEŞTI,,,
,362106382,361104344,,13169,13178,362106382,ARGEŞ,,,8,SCOALA GIMNAZIALA NR.2,SCOALA GIMNAZIALA NR 2,PITEŞTI,PETROCHIMISTILOR,,
,362102609,361103881,,18028,18153,362102609,ARGEŞ,,,,ŞCOALA GIMNAZIALĂ SĂMARA,SCOALA GIMNAZIALA SAMARA,SĂMARA,,,
,362101002,361103619,,14450,14539,362101002,ARGEŞ,,,1,ȘCOALA GIMNAZIALĂ MOZĂCENI VALE,SCOALA GIMNAZIALA MOZACENI VALE,MOZĂCENII-VALE,PITESTI-ROSIORI DE VEDE,,
4793146,361103854,,999799,13490,13506,361103854,ARGEŞ,,,22C,"""LICEUL TEORETIC """"DAN BARBILIAN"""" CÂMPULUNG""",LICEUL TEORETIC DAN BARBILIAN CAMPULUNG,CÂMPULUNG,MAIOR GÂLDĂU,,
,362100358,361104041,,15901,15956,362100358,ARGEŞ,,,1,ȘCOALA PRIMARĂ PĂCIOIU,SCOALA PRIMARA PACIOIU,PĂCIOIU,PRINCIPALĂ,,
33610021,361204609,,32053752,13169,13178,361204609,ARGEŞ,,,,"""GRĂDINIŢA CU PROGRAM PRELUNGIT """"PITICOT BARBĂ-COT""""""",GRADINITA CU PROGRAM PRELUNGIT PITICOT BARBA COT,PITEŞTI,,,
,362100607,361103913,,15233,15260,362100607,ARGEŞ,,,1,ȘCOALA GIMNAZIALĂ CIREȘU,SCOALA GIMNAZIALA CIRESU,CIREŞU,PRINCIPALĂ,,
,362101567,361104778,,13668,13677,362101567,ARGEŞ,,,1,GRĂDINIȚA CU PROGRAM NORMAL BROȘTENI,GRADINITA CU PROGRAM NORMAL BROSTENI,COSTEŞTI,MORII,,
,362105802,361100263,,16944,17003,362105802,ARGEŞ,,,,GRĂDINIŢA CU PROGRAM NORMAL MÂRGHIA,GRADINITA CU PROGRAM NORMAL MARGHIA,LUNCA CORBULUI,,,
,362103076,361103958,,17101,17192,362103076,ARGEŞ,,,DJ74H,ȘCOALA GIMNAZIALĂ VÂLCELE,SCOALA GIMNAZIALA VALCELE,VÂLCELELE,MERIŞANI - VÂLCELE - C.DE AG,,
,362102473,361103967,,18475,18493,362102473,ARGEŞ,,,,GRĂDINIŢA CU PROGRAM NORMAL GLIGANU DE JOS,GRADINITA CU PROGRAM NORMAL GLIGANU DE JOS,GLIGANU DE JOS,"""ŞCOLII"," NR. 1 B""",
5206185,361104127,,30336095,13757,13766,361104127,ARGEŞ,,,131,"""LICEUL TEORETIC """"ION MIHALACHE"""" TOPOLOVENI""",LICEUL TEORETIC ION MIHALACHE TOPOLOVENI,TOPOLOVENI,CALEA BUCUREŞTI,,
,362102292,361103551,,18938,18974,362102292,ARGEŞ,,,,ŞCOALA PRIMARĂ FÂLFANI,SCOALA PRIMARA FALFANI,FÂLFANI,,,
,362101929,361103483,,20055,16720,362101929,ARGEŞ,,,1,GRĂDINIȚA CU PROGRAM NORMAL MÂZGANA,GRADINITA CU PROGRAM NORMAL MAZGANA,VULTUREŞTI,PRINCIPALĂ,,
11301165,331100108,,31066465,13169,13178,331100108,ARGEŞ,,,45,CASA CORPULUI DIDACTIC ARGEȘ,CASA CORPULUI DIDACTIC ARGES,PITEŞTI,Str. I.C.Bratianu,,
4121935,361100114,,326802,13301,13310,361100114,ARGEŞ,,,1,"""GRĂDINIȚA CU PROGRAM NORMAL """"FLORILE SOARELUI"""" MIOVENI""",GRADINITA CU PROGRAM NORMAL FLORILE SOARELUI MIOVENI,MIOVENI,MIORITEI,,
,362101748,361100046,,13169,13178,362101748,ARGEŞ,,,20,GRĂDINIȚA CU PROGRAM PRELUNGIT NR. 1 PITEȘTI,GRADINITA CU PROGRAM PRELUNGIT NR 1 PITESTI,PITEŞTI,Lazăr Gheorghe,,
,362100299,361104032,,16132,16212,362100299,ARGEŞ,,,1,ȘCOALA PRIMARĂ MĂCĂI,SCOALA PRIMARA MACAI,MĂCĂI,PRINCIPALĂ,,
4122442,361104914,,333557,16472,16481,361104914,ARGEŞ,,,226,"""ȘCOALA GIMNAZIALĂ """"IOSIF CATRINESCU"""" DRAGOSLAVELE""",SCOALA GIMNAZIALA IOSIF CATRINESCU DRAGOSLAVELE,DRAGOSLAVELE,PRINCIPALĂ,,
,362103248,361104294,,16427,16445,362103248,ARGEŞ,,,,GRĂDINIŢA CU PROGRAM NORMAL FUREŞTI,GRADINITA CU PROGRAM NORMAL FURESTI,FUREŞTI,,,
,362102595,361103881,,18028,18126,362102595,ARGEŞ,,,,ŞCOALA PRIMARĂ METOF,SCOALA PRIMARA METOF,METOFU,,,
,362102048,361104493,,19695,19757,362102048,ARGEŞ,,,,ŞCOALA PRIMARĂ MUSTĂŢEŞTI,SCOALA PRIMARA MUSTATESTI,MUSTĂŢEŞTI,,,
,362101246,361103741,,13935,13953,362101246,ARGEŞ,,,1,ȘCOALA PRIMARĂ CERBU,SCOALA PRIMARA CERBU,CERBU,PRINCIPALĂ,,
,362102627,361103881,,18028,18135,362102627,ARGEŞ,,,,GRĂDINIŢA CU PROGRAM NORMAL PĂDUROIU DEAL,GRADINITA CU PROGRAM NORMAL PADUROIU DEAL,PĂDUROIU DIN DEAL,PITESTI-DRAGASANI DN 67 B,,
,352104999,371100182,300608,13301,13310,352104999,ARGEŞ,,,,CLUBUL COPIILOR MIOVENI,CLUBUL COPIILOR MIOVENI,MIOVENI,Mioveni,,
,362103058,361103958,,17101,17129,362103058,ARGEŞ,,,0,GRĂDINIȚA CU PROGRAM NORMAL BORLEȘTI,GRADINITA CU PROGRAM NORMAL BORLESTI,BORLEŞTI,PITEŞTI - CURTEA DE ARGEŞ,,
,362106025,361104683,,13301,13356,362106025,ARGEŞ,,,,GRĂDINIŢA CU PROGRAM NORMAL RACOVIŢA DE JOS,GRADINITA CU PROGRAM NORMAL RACOVITA DE JOS,MIOVENI,,,
27341778,361203902,,32483933,13169,13178,361203902,ARGEŞ,,,,"""GRĂDINIŢA CU PROGRAM NORMAL ŞI PRELUNGIT """"MOTANUL ÎNCĂLŢAT""""""",GRADINITA CU PROGRAM NORMAL SI PRELUNGIT MOTANUL INCALTAT,PITEŞTI,,,
,362102455,361103967,,18475,18484,362102455,ARGEŞ,,,,GPN ROCIU,GPN ROCIU,ROCIU,"""ŞCOLII"," NR. 1 D""",
29361275,361104457,,331138,13169,13178,361104457,ARGEŞ,,,3,"""ȘCOALA GIMNAZIALĂ """"MIRCEA CEL BĂTRÂN"""" PITEȘTI""",SCOALA GIMNAZIALA MIRCEA CEL BATRAN PITESTI,PITEŞTI,ZIMBRULUI,,
22495335,361103334,,333176,15830,15849,361103334,ARGEŞ,,,240,"""ȘCOALA GIMNAZIALĂ """"NAUM RÂMNICEANU"""" CORBI""",SCOALA GIMNAZIALA NAUM RAMNICEANU CORBI,CORBI,VOICU CORVIN,,
333749,361103483,,333749,20055,16720,361103483,ARGEŞ,,,77,ȘCOALA GIMNAZIALĂ NR. 1 VULTUREȘTI,SCOALA GIMNAZIALA NR 1 VULTURESTI,VULTUREŞTI,PRINCIPALĂ,,
,362105223,361104597,,16365,16392,362105223,ARGEŞ,,,,ŞCOALA PRIMARA PISCANI,SCOALA PRIMARA PISCANI,DÂRMĂNEŞTI,,,
,362105598,361105033,,14940,15037,362105598,ARGEŞ,,,,ŞCOALA GIMNAZIALĂ SERBOIENI,SCOALA GIMNAZIALA SERBOIENI,ŞERBOENI,,,
,362101902,361103483,,20055,16720,362101902,ARGEŞ,,,1,ȘCOALA PRIMARĂ VULTUREȘTI,SCOALA PRIMARA VULTURESTI,VULTUREŞTI,,,
8517844,361204238,,3130181,13490,13506,361204238,ARGEŞ,,,,SCOALA SF. IACOB CAMPULUNG,SCOALA SF IACOB CAMPULUNG,CÂMPULUNG,,,
26118264,361204107,,32407393,13169,13178,361204107,ARGEŞ,,,,"""GRĂDINIŢA """"CASA CU PITICI""""""",GRADINITA CASA CU PITICI,PITEŞTI,ANTIM IVIREANU NR.10 PITEŞTI,,
5010064,361104986,,300673,13490,13506,361104986,ARGEŞ,,,15,ȘCOALA DE MUZICĂ CÂMPULUNG,SCOALA DE MUZICA CAMPULUNG,CÂMPULUNG,MĂRĂȘEȘTI,,
,362100991,361104796,,14584,14664,362100991,ARGEŞ,,,1,ȘCOALA GIMNAZIALĂ SUSENI,SCOALA GIMNAZIALA SUSENI,SUSENI,PRINCIPALĂ,,
29467714,361100177,,331023,13169,13178,361100177,ARGEŞ,,,206,"""ȘCOALA GIMNAZIALĂ """"ION MINULESCU"""" PITEȘTI""",SCOALA GIMNAZIALA ION MINULESCU PITESTI,PITEŞTI,EXERCIŢIU,,
,362101766,361104837,,13169,13178,362101766,ARGEŞ,,,5,GRĂDINIȚA CU PROGRAM NORMAL NR. 5 PITEȘTI,GRADINITA CU PROGRAM NORMAL NR 5 PITESTI,PITEŞTI,Negoiul,,
,362100417,361103334,,15830,15858,362100417,ARGEŞ,,,58,ȘCOALA PRIMARĂ CORBȘORI,SCOALA PRIMARA CORBSORI,CORBŞORI,NEGRU VODĂ,,
,362103266,361104597,,16365,16409,362103266,ARGEŞ,,,,ŞCOALA PRIMARĂ VALEA NANDREI,SCOALA PRIMARA VALEA NANDREI,VALEA NANDRII,DRUM COMUNAL,,
,362103198,361103447,,16613,16622,362103198,ARGEŞ,,,,GRĂDINIŢA CU PROGRAM NORMAL HÂRSEŞTI,GRADINITA CU PROGRAM NORMAL HARSESTI,HÂRSEŞTI,,,
,362102021,361104439,,13524,13579,362102021,ARGEŞ,,,,ŞCOALA PRIMARĂ GURA PRAVĂŢ,SCOALA PRIMARA GURA PRAVAT,GURA PRAVĂŢ,,,
,362101228,361104249,,13999,14021,362101228,ARGEŞ,,,1,ȘCOALA GIMNAZIALĂ SLĂNIC,SCOALA GIMNAZIALA SLANIC,SLĂNIC,PRINCIPALĂ,,
,362106251,361104181,,14165,14236,362106251,ARGEŞ,,,1,GRADINITA CU PROGRAM NORMAL TUTANA,GRADINITA CU PROGRAM NORMAL TUTANA,TUTANA,FFFFF,,
,362105693,361104656,,17049,17058,362105693,ARGEŞ,,,,ŞCOALA PRIMARA MĂLURENI,SCOALA PRIMARA MALURENI,MĂLURENI,,,
,362101594,361104778,,13668,13677,362101594,ARGEŞ,,,1,ȘCOALA PRIMARĂ PÂRVU ROȘU,SCOALA PRIMARA PARVU ROSU,COSTEŞTI,PÂRVU ROȘU,,
5050565,361103818,,335175,18581,18607,361103818,ARGEŞ,,,131,"""ȘCOALA GIMNAZIALĂ """"DUMITRU UDRESCU"""" SĂPATA""",SCOALA GIMNAZIALA DUMITRU UDRESCU SAPATA,BĂNĂREŞTI,,,
29405185,361104665,,334131,17209,17218,361104665,ARGEŞ,,,1,ȘCOALA GIMNAZIALĂ NR. 1 MICEȘTI,SCOALA GIMNAZIALA NR 1 MICESTI,MICEŞTI,PRINCIPALĂ,,
,362100313,361104032,,16132,16178,362100313,ARGEŞ,,,1,ȘCOALA PRIMARÎ CÎRCEȘTI,SCOALA PRIMARI CIRCESTI,CÂRCEŞTI,PRINCIPALĂ,,
,362105847,361104751,,16757,16846,362105847,ARGEŞ,,,,GRĂDINIŢA COTU MALULUI -LEORDENI,GRADINITA COTU MALULUI LEORDENI,LEORDENI,,,
4318326,361104891,,332365,14753,14806,361104891,ARGEŞ,,,1,ȘCOALA GIMNAZIALĂ GALEȘU-BRĂDULEȚ,SCOALA GIMNAZIALA GALESU BRADULET,GALEŞU,PRINCIPALĂ,,
,362103031,361104665,,17209,17218,362103031,ARGEŞ,,,,ŞCOALA PRIMARĂ NR.1,SCOALA PRIMARA NR 1,MICEŞTI,DRUM,,
4121960,361104475,,332886,15448,15457,361104475,ARGEŞ,,,1,ȘCOALA GIMNAZIALĂ CICĂNEȘTI,SCOALA GIMNAZIALA CICANESTI,CICĂNEŞTI,PRINCIPALĂ,,
5206185,361103316,,300685,13757,13766,361103316,ARGEŞ,,,74,"""GRĂDINIȚA CU PROGRAM NORMAL """"LUMEA COPIILOR"""" TOPOLOVENI""",GRADINITA CU PROGRAM NORMAL LUMEA COPIILOR TOPOLOVENI,TOPOLOVENI,CALEA BUCUREŞTI,,
,362102921,361104154,334259,17334,17370,362102921,ARGEŞ,,,,ŞCOALA PRIMARĂ COCENEŞTI,SCOALA PRIMARA COCENESTI,COCENEŞTI,,,
,362101965,361104371,,19793,19908,362101965,ARGEŞ,,,1,GPN IZVORU DEE SUS,GPN IZVORU DEE SUS,IZVORU DE JOS,PRINCIPALA,,
5010110,361104787,,1180436,13622,13631,361104787,ARGEŞ,,,10,"""LICEUL TEHNOLOGIC """"FERDINAND I"""" CURTEA DE ARGEȘ""",LICEUL TEHNOLOGIC FERDINAND I CURTEA DE ARGES,CURTEA DE ARGEŞ,ALBEŞTI,,
,362100783,361104163,,13187,13196,362100783,ARGEŞ,,,1,GRĂDINIȚA CU PROGRAM NORMAL NR. 1 BASCOV,GRADINITA CU PROGRAM NORMAL NR 1 BASCOV,BASCOV,PRINCIPALĂ,,
,362106224,361104484,,19249,19294,362106224,ARGEŞ,,,3,GRADINITA CU PROGRAM NORMAL BARSESTI,GRADINITA CU PROGRAM NORMAL BARSESTI,BÂRSEŞTII DE JOS,VV,,
,362103203,361103447,,16613,16631,362103203,ARGEŞ,,,,GRĂDINIŢA CU PROGRAM NORMAL CIOBANI,GRADINITA CU PROGRAM NORMAL CIOBANI,CIOBANI,,,
,362102003,361104439,,13524,13604,362102003,ARGEŞ,,,,GRĂDINIŢA CU PROGRAM NORMAL ŞELARI,GRADINITA CU PROGRAM NORMAL SELARI,ŞELARI,,,
,362102559,361104525,,18242,18251,362102559,ARGEŞ,,,,GRĂDINIŢA CU PROGRAM NORMAL ALBOTELE,GRADINITA CU PROGRAM NORMAL ALBOTELE,PRIBOIENI,,,
,362101201,361104222,,15064,15082,362101201,ARGEŞ,,,1,ȘCOALA PRIMARĂ INV. CONSTANTIN MIHALCEA BURDEA,SCOALA PRIMARA INV CONSTANTIN MIHALCEA BURDEA,BURDEA,PRINCIPALĂ,,
,362106278,361103334,,15830,15858,362106278,ARGEŞ,,,X,GRADINITA CU PROGRAM NORMAL CORBSORI,GRADINITA CU PROGRAM NORMAL CORBSORI,CORBŞORI,X,,
5010030,361104647,,1180383,13490,13506,361104647,ARGEŞ,,,108,LICEUL TEHNOLOGIC AUTO CÂMPULUNG,LICEUL TEHNOLOGIC AUTO CAMPULUNG,CÂMPULUNG,NAȚIONALĂ,,
4121943,361104317,,332926,15493,15509,361104317,ARGEŞ,,,1,ȘCOALA GIMNAZIALĂ NR. 1 CIOFRÂNGENI,SCOALA GIMNAZIALA NR 1 CIOFRANGENI,CIOFRÂNGENI,PRINCIPALĂ,,
,362100159,361104005,,13169,13178,362100159,ARGEŞ,,,20,LICEUL TEHNOLOGIC MIHAI VITEAZUL PITEȘTI,LICEUL TEHNOLOGIC MIHAI VITEAZUL PITESTI,PITEŞTI,Dobrin Nicolae,,
,362100842,361105033,,14940,15000,362100842,ARGEŞ,,,1,GRĂDINIȚA CU PROGRAM NORMAL IONEȘTI,GRADINITA CU PROGRAM NORMAL IONESTI,IONEŞTI,PRINCIPALĂ,,
,362100331,361104041,,15901,15910,362100331,ARGEŞ,,,1,ȘCOALA GIMNAZIALĂ COȘEȘTI,SCOALA GIMNAZIALA COSESTI,COŞEŞTI,PRINCIPALĂ,,
,362105865,361104873,,16551,16560,362105865,ARGEŞ,,,,GRĂDINIŢA CU PROGRAM NORMAL GODENI,GRADINITA CU PROGRAM NORMAL GODENI,GODENI,,,
33086564,361206403,,,13169,13178,361206403,ARGEŞ,,,54,SCOALA POSTLICEALA PROF.DR.NANU MUSCEL,SCOALA POSTLICEALA PROF DR NANU MUSCEL,PITEŞTI,ICBRATIANU,,
,362103013,361104665,,17209,17218,362103013,ARGEŞ,,,,GPN BĂDULEŞTI,GPN BADULESTI,MICEŞTI,DRUM,,
,362106061,361100028,336076,13622,13631,362106061,ARGEŞ,,,2,Gradinita cu program normal Valea Sasului,GRADINITA CU PROGRAM NORMAL VALEA SASULUI,CURTEA DE ARGEŞ,p,,
,362105268,361104796,,14584,14593,362105268,ARGEŞ,,,,GRĂDINIŢA CU PROGRAM NORMAL BOGAŢI,GRADINITA CU PROGRAM NORMAL BOGATI,BOGAŢI,,,
12771467,361103379,,301235,13169,13178,361103379,ARGEŞ,,,35,"""LICEUL PENTICOSTAL TEOLOGIC """"ELIM"""" PITEȘTI""",LICEUL PENTICOSTAL TEOLOGIC ELIM PITESTI,PITEŞTI,RĂZBOIENI,,
4971910,361104412,,849769,13490,13506,361104412,ARGEŞ,,,87,"""CENTRUL ȘCOLAR DE EDUCAȚIE INCLUZIVĂ """"SFÂNTUL NICOLAE"""" CÂMPULUNG""",CENTRUL SCOLAR DE EDUCATIE INCLUZIVA SFANTUL NICOLAE CAMPULUNG,CÂMPULUNG,NEGRU VODĂ,,
29459797,361103994,,326462,13490,13506,361103994,ARGEŞ,,,8,"""GRĂDINIȚA CU PROGRAM PRELUNGIT """"SFÂNTA MARINA"""" CÂMPULUNG""",GRADINITA CU PROGRAM PRELUNGIT SFANTA MARINA CAMPULUNG,CÂMPULUNG,GEORGE TOPÂRCEANU,,
,362100453,361100254,,15652,15732,362100453,ARGEŞ,,,46,ȘCOALA PRIMARĂ RICHIȚELE DE SUS,SCOALA PRIMARA RICHITELE DE SUS,RĂCHIŢELE DE SUS,PRINCIPALĂ,,
,362103221,361104914,,16472,16490,362103221,ARGEŞ,,,,ŞCOALA PRIMARĂ VALEA HOTARULUI,SCOALA PRIMARA VALEA HOTARULUI,VALEA HOTARULUI,,,
,362102577,361104638,,18162,18233,362102577,ARGEŞ,,,,GRĂDINIŢA CU PROGRAM NORMAL SLOBOZIA-POPEŞTI,GRADINITA CU PROGRAM NORMAL SLOBOZIA POPESTI,SLOBOZIA,,,
,362101888,361103863,,19999,20000,362101888,ARGEŞ,,,885,GRĂDINIȚA CU PROGRAM NORMAL VALEA URSULUI,GRADINITA CU PROGRAM NORMAL VALEA URSULUI,VLĂDEŞTI,,,
,362106215,361103388,,18741,18750,362106215,ARGEŞ,,,C,SCOALA PRIMARA NR.2,SCOALA PRIMARA NR 2,SLOBOZIA,DD,,
,362102681,361104706,,17851,17879,362102681,ARGEŞ,,,,ŞCOALA GIMNAZIALĂ BĂDEŞTI,SCOALA GIMNAZIALA BADESTI,BĂDEŞTI,,,
5050557,361104335,,335539,19141,19150,361104335,ARGEŞ,,,1,"""ȘCOALA GIMNAZIALĂ """"TOMA BRĂTIANU"""" ȘUICI""",SCOALA GIMNAZIALA TOMA BRATIANU SUICI,ŞUICI,PRINCIPALĂ,,
4122264,361104629,,300610,13169,13178,361104629,ARGEŞ,,,31A,"""LICEUL CU PROGRAM SPORTIV """"VIITORUL"""" PITEȘTI""",LICEUL CU PROGRAM SPORTIV VIITORUL PITESTI,PITEŞTI,PETROCHIMIȘTILOR,,
,362101083,361103795,,14352,14389,362101083,ARGEŞ,,,14,ȘCOALA PRIMARĂ LENȚEA,SCOALA PRIMARA LENTEA,LENŢEA,PRINCIPALĂ,,
,362100869,361103411,,20063,13908,362100869,ARGEŞ,,,321,GRĂDINIȚA CU PROGRAM NORMAL GRUI-MĂLIN,GRADINITA CU PROGRAM NORMAL GRUI MALIN,BUGHEA DE SUS,,,
,362100688,361104059,,15108,15215,362100688,ARGEŞ,,,1,ȘCOALA PRIMARĂ VALEA CORBULUI,SCOALA PRIMARA VALEA CORBULUI,VALEA CORBULUI,PRINCIPALĂ,,
,362101626,361104801,,13490,13506,362101626,ARGEŞ,,,91,GRĂDINIȚA CU PROGRAM NORMAL NR. 9 CÂMPULUNG,GRADINITA CU PROGRAM NORMAL NR 9 CAMPULUNG,CÂMPULUNG,Carpați,,
