COD FISCAL,COD SIIIR,COD SIIIR SUP,COD SIRUES,SIRUTA LOC SUP,SIRUTA LOCALITATE,cod,judet,lat,lon,nr,nume,nume_ascii,oras,str,wikidata,
,362105214,361104294,,16427,16436,362105214,ARGEŞ,,,,ŞCOALA PRIMARĂ FUREŞTI,SCOALA PRIMARA FURESTI,DOBREŞTI,,,
,362101911,361103483,,20055,16677,362101911,ARGEŞ,,,1,ȘCOALA PRIMARĂ BÂRZEȘTI,SCOALA PRIMARA BARZESTI,BÂRZEŞTI,PRINCIPALĂ,,
,362100792,361103533,,13276,13294,362100792,ARGEŞ,,,1,ȘCOALA PRIMARĂ ION STĂNCIULESCU GEAMĂNA,SCOALA PRIMARA ION STANCIULESCU GEAMANA,GEAMĂNA,PRINCIPALĂ,,
,362100426,361103334,,15830,15894,362100426,ARGEŞ,,,82,ȘCOALA GIMNAZIALĂ STĂNEȘTI,SCOALA GIMNAZIALA STANESTI,STĂNEŞTI,RADU CEL MARE,,
,362103212,361104285,,16506,16542,362103212,ARGEŞ,,,,ŞCOALA PRIMARĂ PRISLOPU MARE,SCOALA PRIMARA PRISLOPU MARE,PRISLOPU MARE,PITEŞTI+RÎMNICU VÎLCEA,,
,362106486,361104059,,15108,15153,362106486,ARGEŞ,,,0,GPN GLODU,GPN GLODU,GLODU,SAT GLODU,,
,362102039,361104439,,13524,13542,362102039,ARGEŞ,,,,GRĂDINIŢA CU PROGRAM NORMAL BILCEŞTI,GRADINITA CU PROGRAM NORMAL BILCESTI,BILCEŞTI,,,
,362101219,361104222,,15064,15091,362101219,ARGEŞ,,,1,GRĂDINIȚA CU PROGRAM NORMAL ACAD.PROF. ION ANGELESCU STRÂMBENI,GRADINITA CU PROGRAM NORMAL ACAD PROF ION ANGELESCU STRAMBENI,STRÂMBENI,PRINCIPALĂ,,
,362106269,361103334,,15830,15894,362106269,ARGEŞ,,,XX,GRADINITA CU PROGRAM NORMAL STANESTI,GRADINITA CU PROGRAM NORMAL STANESTI,STĂNEŞTI,GG,,
,362105684,361103596,,18778,18787,362105684,ARGEŞ,,,,GRĂDINIŢA CU PROGRAM PRELUNGIT STÂLPENI,GRADINITA CU PROGRAM PRELUNGIT STALPENI,STÂLPENI,,,
4122086,361104656,,334040,17049,17058,361104656,ARGEŞ,,,128,"""ȘCOALA GIMANZIALĂ """"PETRE TUDOSE"""" MĂLURENI""",SCOALA GIMANZIALA PETRE TUDOSE MALURENI,MĂLURENI,PRINCIPALĂ,,
,362105874,361103845,,15741,15796,362105874,ARGEŞ,,,,ŞCOALA GIMNAZIALĂ PROF.DR. VASILE VASILESCU,SCOALA GIMNAZIALA PROF DR VASILE VASILESCU,CORBENI,,,
24024783,361206475,,,17496,17539,361206475,ARGEŞ,,,665,Grădiniţa ALTINA,GRADINITA ALTINA,DEALU VIILOR,SAT SMEURA,,
4122043,361104882,,332795,15313,15322,361104882,ARGEŞ,,,179,"""ȘCOALA GIMNAZIALĂ """"NICOLAE VELEA"""" CEPARI""",SCOALA GIMNAZIALA NICOLAE VELEA CEPARI,CEPARII PĂMÂNTENI,PRINCIPALĂ,,
,362103022,361104665,,17209,17245,362103022,ARGEŞ,,,,ŞCOALA GIMNAZIALĂ PURCĂRENI,SCOALA GIMNAZIALA PURCARENI,PURCĂRENI,DRUM,,
,362102957,361104674,,17254,17325,362102957,ARGEŞ,,,,ŞCOALA PRIMARĂ VĂCAREA,SCOALA PRIMARA VACAREA,VĂCAREA,COMUNAL,,
,362102776,361104543,,17726,17762,362102776,ARGEŞ,,,,GRĂDINIŢA CU PROGRAM NORMAL MOZACU,GRADINITA CU PROGRAM NORMAL MOZACU,MOZACU,,,
4122302,361103307,,300622,13169,13178,361103307,ARGEŞ,,,44,"""COLEGIUL TEHNIC """"ARMAND CĂLINESCU"""" PITEȘTI""",COLEGIUL TEHNIC ARMAND CALINESCU PITESTI,PITEŞTI,I.C. BRĂTIANU,,
29437365,361104466,,1138536,13668,13677,361104466,ARGEŞ,,,18,"""GRĂDINIȚA CU PROGRAM PRELUNGIT """"FANTEZIA"""" COSTEȘTI""",GRADINITA CU PROGRAM PRELUNGIT FANTEZIA COSTESTI,COSTEŞTI,STRANDULUI,,
4971987,361104796,,332247,14584,14593,361104796,ARGEŞ,,,1,ȘCOALA GIMNAZIALĂ RADU CEL MARE BOGAȚI,SCOALA GIMNAZIALA RADU CEL MARE BOGATI,BOGAŢI,PRINCIPALĂ,,
,362105336,361104846,,13819,13864,362105336,ARGEŞ,,,,GRĂDINIŢA CU PROGRAM NORMAL DOBROTU,GRADINITA CU PROGRAM NORMAL DOBROTU,DOBROTU,,,
,362100444,361100254,,15652,15698,362100444,ARGEŞ,,,151,ȘCOALA PRIMARĂ CRUCIȘOARA,SCOALA PRIMARA CRUCISOARA,CRUCIŞOARA,PRINCIPALĂ,,
2444736,361203766,,33100643,13169,13178,361203766,ARGEŞ,,,,"""ŞCOALA SANITARĂ POSTLICEALĂ """"CAROL DAVILA"""" PITEŞTI""",SCOALA SANITARA POSTLICEALA CAROL DAVILA PITESTI,PITEŞTI,,,
,362103239,361104914,,16472,16481,362103239,ARGEŞ,,,,GRADINIŢA CU PROGRAM NORMAL DRAGOSLAVELE,GRADINITA CU PROGRAM NORMAL DRAGOSLAVELE,DRAGOSLAVELE,,,
,362102541,361104525,,18242,18251,362102541,ARGEŞ,,,,GRADINITA CU PROGRAM NORMAL PARASCHIVESTI,GRADINITA CU PROGRAM NORMAL PARASCHIVESTI,PRIBOIENI,,,
5010064,361105101,,331402,13490,13506,361105101,ARGEŞ,,,1,"""ȘCOALA GIMNAZIALĂ """"OPREA IORGULESCU"""" CÂMPULUNG""",SCOALA GIMNAZIALA OPREA IORGULESCU CAMPULUNG,CÂMPULUNG,GENERAL POȘOIU,,
,362101897,361103863,,19999,20000,362101897,ARGEŞ,,,497G,GRĂDINIȚA CU PROGRAM NORMAL VALEA LACULUI,GRADINITA CU PROGRAM NORMAL VALEA LACULUI,VLĂDEŞTI,Valea Lacului,,
,362106206,361103388,,18741,18750,362106206,ARGEŞ,,,C,GRADINITA CU PROGRAM NORMAL NR.2,GRADINITA CU PROGRAM NORMAL NR 2,SLOBOZIA,BB,,
29373769,361104326,,1066853,13169,13178,361104326,ARGEŞ,,,4,"""ȘCOALA GIMNAZIALĂ """"I.L. CARAGIALE"""" PITEȘTI""",SCOALA GIMNAZIALA I L CARAGIALE PITESTI,PITEŞTI,PETRACHE POENARU,,
4469418,361104638,,334897,18162,18171,361104638,ARGEŞ,,,121,"""ȘCOALA GIMNAZIALĂ """"VICTOR ȚÂRCOVNICUL"""" POPEȘTI""",SCOALA GIMNAZIALA VICTOR TARCOVNICUL POPESTI,POPEŞTI,PRINCIPALĂ,,
,362101092,361103655,,14272,14316,362101092,ARGEŞ,,,1,ȘCOALA GIMNAZIALĂ POIENIȚA,SCOALA GIMNAZIALA POIENITA,POIENIŢA,PRINCIPALĂ,,
,362100851,361105033,,14940,14986,362100851,ARGEŞ,,,1,ȘCOALA PRIMARĂ CORNĂȚEL,SCOALA PRIMARA CORNATEL,CORNĂŢEL,PRINCIPALĂ,,
,362101635,361103994,,13490,13506,362101635,ARGEŞ,,,57,GRĂDINIȚA CU PROGRAM PRELUNGIT NR. 1 CÂMPULUNG,GRADINITA CU PROGRAM PRELUNGIT NR 1 CAMPULUNG,CÂMPULUNG,,,
32033014,361206412,,32719174,13622,13631,361206412,ARGEŞ,,,10,GRADINITA CU PROGRAM PRELUNGIT SF.NICOLAE,GRADINITA CU PROGRAM PRELUNGIT SF NICOLAE,CURTEA DE ARGEŞ,EROILOR NR.,,
,362101056,361103619,,14450,14520,362101056,ARGEŞ,,,1,ȘCOALA GIMNAZIALĂ MÂNDRA,SCOALA GIMNAZIALA MANDRA,MÂNDRA,COMUNAL BARLA,,
,362105146,361104525,,18242,18251,362105146,ARGEŞ,,,,GRADINITA CU PROGRAM NORMAL SĂMĂILA,GRADINITA CU PROGRAM NORMAL SAMAILA,PRIBOIENI,,,
,362103004,361104665,,17209,17236,362103004,ARGEŞ,,,,ŞCOALA PRIMARĂ NR.2,SCOALA PRIMARA NR 2,PĂULEASCA,,,
,362102758,361104267,,17771,17780,362102758,ARGEŞ,,,,ŞCOALA PRIMARĂ PETRE CHELU,SCOALA PRIMARA PETRE CHELU,NUCŞOARA,,,
,362102975,361104674,,17254,17316,362102975,ARGEŞ,,,,ŞCOALA GIMNAZIALĂ VALEA POPII,SCOALA GIMNAZIALA VALEA POPII,VALEA POPII,,,
,362105259,361103388,,18741,18750,362105259,ARGEŞ,,,,GRĂDINIŢA CU PROGRAM NORMAL NR.1,GRADINITA CU PROGRAM NORMAL NR 1,SLOBOZIA,,,
,362101956,361104371,,19793,19980,362101956,ARGEŞ,,,,GRĂDINIŢA CU PROGRAM NORMAL VÂRSEȘTI,GRADINITA CU PROGRAM NORMAL VARSESTI,VÂRŞEŞTI,PRINCIPALĂ,,
4122574,361103361,,331322,13392,13409,361103361,ARGEŞ,,,1,"""ȘCOALA GIMNAZIALĂ """"CONSTANTIN BRÂNCOVEANU"""" ȘTEFĂNEȘTI""",SCOALA GIMNAZIALA CONSTANTIN BRANCOVEANU STEFANESTI,ŞTEFĂNEŞTI,CAVALERULUI,,
28638247,361104403,,335136,18554,18563,361104403,ARGEŞ,,,73,"""ȘCOALA GIMNAZIALĂ """"RADU ȘERBAN"""" SĂLĂTRUCU""",SCOALA GIMNAZIALA RADU SERBAN SALATRUCU,SĂLĂTRUCU,RADU ȘERBAN,,
,362101409,361105101,,13490,13506,362101409,ARGEŞ,,,72A,GRĂDINIȚA CU PROGRAM NORMAL NR. 4 DRĂCEȘTI,GRADINITA CU PROGRAM NORMAL NR 4 DRACESTI,CÂMPULUNG,DRĂCEŞTI,,
4971944,361103985,,335671,19338,19347,361103985,ARGEŞ,,,1,"""ȘCOALA GIMNAZIALĂ """"I.C. LĂZĂRESCU"""" ȚIȚEȘTI""",SCOALA GIMNAZIALA I C LAZARESCU TITESTI,ŢIŢEŞTI,PRINCIPALĂ,,
,362100462,361104317,,15493,15527,362100462,ARGEŞ,,,1,ȚCOALA PRIMARĂ NR. 1 LACURILE,TCOALA PRIMARA NR 1 LACURILE,LACURILE,PRINCIPALĂ,,
,362106192,361104136,,18411,18448,362106192,ARGEŞ,,,GG,SCOALA GIMNAZIALA DEAGURILE,SCOALA GIMNAZIALA DEAGURILE,DEAGU DE SUS,FF,,
,362106441,341104551,,13169,13178,362106441,ARGEŞ,,,15,CENTRUL LOGOPEDIC,CENTRUL LOGOPEDIC,PITEŞTI,PITESTI,,
,362102568,361103578,,20048,18224,362102568,ARGEŞ,,,,GRĂDINIŢA CU PROGRAM NORMAL RÂCA,GRADINITA CU PROGRAM NORMAL RACA,RÂCA,,,
,362102699,361104706,,17851,17888,362102699,ARGEŞ,,,,ŞCOALA PRIMARĂ GĂNEŞTI,SCOALA PRIMARA GANESTI,GĂNEŞTI,DJ 731,,
29373652,361104344,,336197,13169,13178,361104344,ARGEŞ,,,3,"""ȘCOALA GIMNAZIALĂ """"TUDOR VLADIMIRESCU"""" PITEȘTI""",SCOALA GIMNAZIALA TUDOR VLADIMIRESCU PITESTI,PITEŞTI,Călugăreni,,
4469469,361104041,,333228,15901,15947,361104041,ARGEŞ,,,1,"""ȘCOALA GIMNAZIALĂ """"IORDACHE PĂCESCU"""" COȘEȘTI""",SCOALA GIMNAZIALA IORDACHE PACESCU COSESTI,LEICEŞTI,PRINCIPALĂ,,
,362105752,361103872,,13365,13374,362105752,ARGEŞ,,,,GRĂDINIŢA CIU PROGRAM NORMAL LOTAŞI- MĂRĂCINENI,GRADINITA CIU PROGRAM NORMAL LOTASI MARACINENI,MĂRĂCINENI,,,
,362100697,361104059,,15108,15224,362100697,ARGEŞ,,,1,ȘCOALA GIMNAZIALĂ VĂLENI-PODGORIA,SCOALA GIMNAZIALA VALENI PODGORIA,VĂLENI-PODGORIA,PRINCIPALĂ,,
31735975,361204699,,32712255,13169,13178,361204699,ARGEŞ,,,5,GRĂDINIŢA AŞCHIUŢĂ,GRADINITA ASCHIUTA,PITEŞTI,ion balaceanu,,
,362100878,361103411,,20063,13908,362100878,ARGEŞ,,,222,ȘCOALA PRIMARĂ BUGHIȚA,SCOALA PRIMARA BUGHITA,BUGHEA DE SUS,PRINCIPALĂ,,
29412751,361100046,,326370,13169,13178,361100046,ARGEŞ,,,84,"""GRĂDINIȚA CU PROGRAM PRELUNGIT """"PRIMII PAȘI"""" PITEȘTI""",GRADINITA CU PROGRAM PRELUNGIT PRIMII PASI PITESTI,PITEŞTI,REPUBLICII,,
,362101617,361104801,,13490,13506,362101617,ARGEŞ,,,97,GRĂDINIȚA CU PROGRAM NORMAL NR. 7 CÂMPULUNG,GRADINITA CU PROGRAM NORMAL NR 7 CAMPULUNG,CÂMPULUNG,Negru Vodă,,
29836170,361206439,,32565315,13169,13178,361206439,ARGEŞ,,,29,GRADINITA CU PROGRAM PRELUNGIT INGERASII,GRADINITA CU PROGRAM PRELUNGIT INGERASII,PITEŞTI,DIRZULUI,,
29414558,361103795,,332078,14352,14398,361103795,ARGEŞ,,,44,ȘCOALA GIMNAZIALĂ BELEȚI-NEGREȘTI,SCOALA GIMNAZIALA BELETI NEGRESTI,NEGREŞTI,PRINCIPALĂ,,
,362102731,361104095,,17824,17833,362102731,ARGEŞ,,,,ŞCOALA PRIMARĂ OARJA,SCOALA PRIMARA OARJA,OARJA,,,
,362105508,361104837,,13169,13178,362105508,ARGEŞ,,,,GRĂDINIŢA CU PROGRAM NORMAL NR.6 PITEŞTI,GRADINITA CU PROGRAM NORMAL NR 6 PITESTI,PITEŞTI,,,
,362102229,361104335,,19141,19150,362102229,ARGEŞ,,,,ŞCOALA PRIMARĂ NR.1,SCOALA PRIMARA NR 1,ŞUICI,,,
29487940,361103343,,331035,13169,13178,361103343,ARGEŞ,,,6,"""ȘCOALA GIMNAZIALĂ """"ION PILLAT"""" PITEȘTI""",SCOALA GIMNAZIALA ION PILLAT PITESTI,PITEŞTI,RAHOVEI,,
4469531,361103438,,335578,19212,19221,361103438,ARGEŞ,,,502,"""ȘCOALA GIMNAZIALĂ """"VLADIMIR STREINU"""" TEIU""",SCOALA GIMNAZIALA VLADIMIR STREINU TEIU,TEIU,PRINCIPALĂ,,
4543956,361104285,,333581,16506,16515,361104285,ARGEŞ,,,74,"""ȘCOALA GIMNAZIALĂ """"GEORGE MARINESCU"""" DRĂGANU""",SCOALA GIMNAZIALA GEORGE MARINESCU DRAGANU,DRĂGANU-OLTENI,PRINCIPALĂ,,
,362100489,361104475,,15448,15457,362100489,ARGEŞ,,,1,ȘCOALA PRIMARĂ NICOLEȘTI,SCOALA PRIMARA NICOLESTI,CICĂNEŞTI,PRINCIPALĂ,,
5010064,361104308,,331426,13490,13506,361104308,ARGEŞ,,,27,"""ȘCOALA GIMNAZIALĂ """"NANU MUSCEL"""" CÂMPULUNG""",SCOALA GIMNAZIALA NANU MUSCEL CAMPULUNG,CÂMPULUNG,FRAŢII GOLEŞTI,,
,362102505,361100272,,18331,18340,362102505,ARGEŞ,,,,GRĂDINIŢA CU PROGRAM NORMAL TIGVENI,GRADINITA CU PROGRAM NORMAL TIGVENI,RĂTEŞTI,,,
4122418,361103881,,334743,18028,18037,361103881,ARGEŞ,,,558,ȘCOALA GIMNAZIALĂ NR. 1 POIANA LACULUI,SCOALA GIMNAZIALA NR 1 POIANA LACULUI,POIANA LACULUI,PRINCIPALĂ,,
29382260,361104362,,332862,15402,15411,361104362,ARGEŞ,,,112,ȘCOALA GIMNAZIALĂ NR. 1 CETĂȚENI,SCOALA GIMNAZIALA NR 1 CETATENI,CETĂŢENI,NEGRU VODĂ,,
29428251,361103664,,966164,14405,14414,361103664,ARGEŞ,,,480,ŞCOALA GIMNAZIALĂ MIHAI TICAN RUMANO BEREVOEȘTI,SCOALA GIMNAZIALA MIHAI TICAN RUMANO BEREVOESTI,BEREVOEŞTI,PRINCIPALĂ,,
,362105191,361103515,,16739,16748,362105191,ARGEŞ,,,1145,GRĂDINIȚA CU PROGRAM NORMAL NR. 2 IZVORU,GRADINITA CU PROGRAM NORMAL NR 2 IZVORU,IZVORU,PRINCIPALĂ,,
,362101852,361103388,,18741,18769,362101852,ARGEŞ,,,1,ȘCOALA PRIMARĂ NIGRIȘOARA,SCOALA PRIMARA NIGRISOARA,NIGRIŞOARA,P RINCIPALĂ,,
,362100815,361105033,,14940,15046,362100815,ARGEŞ,,,1,GRĂDINIȚA CU PROGRAM NORMAL TOMȘANCA,GRADINITA CU PROGRAM NORMAL TOMSANCA,TOMŞANCA,PRINCIPALĂ,,
4317908,361105015,,326577,13169,13178,361105015,ARGEŞ,,,2,"""GRĂDINIȚA CU PROGRAM NORMAL """"ISTEȚEL"""" PITEȘTI""",GRADINITA CU PROGRAM NORMAL ISTETEL PITESTI,PITEŞTI,Xenopol Alexandru,,
4469329,361100064,,1180487,13169,13178,361100064,ARGEŞ,,,1,"""LICEUL TEORETIC """"ION CANTACUZINO"""" PITEȘTI""",LICEUL TEORETIC ION CANTACUZINO PITESTI,PITEŞTI,CAROL DAVILA,,
,362101671,361105024,,13622,13631,362101671,ARGEŞ,,,1,GRĂDINIȚA CU PROGRAM PRELUNGIT NR. 1 CURTEA DE ARGEȘ,GRADINITA CU PROGRAM PRELUNGIT NR 1 CURTEA DE ARGES,CURTEA DE ARGEŞ,ALBEŞTI,,
,362105431,361104466,,13668,13677,362105431,ARGEŞ,,,,GRĂDINIŢA CU PROGRAM NORMAL NR.1,GRADINITA CU PROGRAM NORMAL NR 1,COSTEŞTI,,,
,362100304,361104032,,16132,16203,362100304,ARGEŞ,,,1,ȘCOALA PRIMARĂ LĂUNELE,SCOALA PRIMARA LAUNELE,LĂUNELE DE SUS,PRINCIPALĂ,,
,362102247,361104086,,19114,19132,362102247,ARGEŞ,,,,ŞCOALA PRIMARĂ GLAVACIOC,SCOALA PRIMARA GLAVACIOC,GLAVACIOC,,,
,362102713,361104706,,17851,17904,362102713,ARGEŞ,,,,GRĂDINIŢA CU PROGRAM NORMAL VĂRZĂROAIA,GRADINITA CU PROGRAM NORMAL VARZAROAIA,VĂRZĂROAIA,,,
,362101445,361104516,,13392,13436,362101445,ARGEŞ,,,1,GRĂDINIȚA CU PROGRAM NORMAL IZVORANI,GRADINITA CU PROGRAM NORMAL IZVORANI,IZVORANI,IZVORANI,,
,362105381,361104706,,17851,17879,362105381,ARGEŞ,,,,GRĂDINIŢA CU PROGRAM NORMAL BĂDEŞTI,GRADINITA CU PROGRAM NORMAL BADESTI,PIETROŞANI,,,
4122469,361100019,,335215,18670,18689,361100019,ARGEŞ,,,34,ȘCOALA GIMNAZIALĂ NR. 1 SCHITU GOLEȘTI,SCOALA GIMNAZIALA NR 1 SCHITU GOLESTI,SCHITU GOLEŞTI,SOSEA NATIONALA,,
,362106156,361103732,,17398,17405,362106156,ARGEŞ,,,k,GRADINITA CU PROGRAM NORMAL NR.1 MIROSI,GRADINITA CU PROGRAM NORMAL NR 1 MIROSI,MIROŞI,XC,,
4972044,361103596,,300268,18778,18787,361103596,ARGEŞ,,,1,"""LICEUL TEHNOLOGIC """"I.C. PETRESCU"""" STÂLPENI""",LICEUL TEHNOLOGIC I C PETRESCU STALPENI,STÂLPENI,PRINCIPALA,,
29334580,361103601,,331126,13169,13178,361103601,ARGEŞ,,,13,"""ȘCOALA GIMNAZIALĂ """"NEGRU VODĂ"""" PITEȘTI""",SCOALA GIMNAZIALA NEGRU VODA PITESTI,PITEŞTI,BRADULUI,,
,362102387,361100019,,18670,18689,362102387,ARGEŞ,,,,ŞCOALA PRIMARĂ RUDĂRIE,SCOALA PRIMARA RUDARIE,SCHITU GOLEŞTI,,,
,362101879,361103863,,19999,20000,362101879,ARGEŞ,,,255,ȘCOALA PRIMARĂ VLĂDEȘTII DE SUS,SCOALA PRIMARA VLADESTII DE SUS,VLĂDEŞTI,,,
4122400,361100263,,333919,16944,16953,361100263,ARGEŞ,,,297,"""ȘCOALA GIMNAZIALĂ """"GENERAL C-TIN CRISTESCU"""" LUNCA CORBULUI""",SCOALA GIMNAZIALA GENERAL C TIN CRISTESCU LUNCA CORBULUI,LUNCA CORBULUI,PRINCIPALĂ,,
,362105716,361104656,,17049,17058,362105716,ARGEŞ,,,,ŞCOALA PRIMARA TUFANU,SCOALA PRIMARA TUFANU,MĂLURENI,,,
4318288,361105033,,332509,14940,14959,361105033,ARGEŞ,,,82,ȘCOALA GIMNAZIALĂ VULPEȘTI-BUZOIEȘTI,SCOALA GIMNAZIALA VULPESTI BUZOIESTI,VULPEŞTI,GHEORGHE VULPESCU,,
,362101653,361100082,,13490,13506,362101653,ARGEŞ,,,111,ȘCOALA PRIMARĂ GRĂDIȘTE,SCOALA PRIMARA GRADISTE,CÂMPULUNG,MAREŞAL ION ANTONESCU,,
,362101124,361104181,,14165,14254,362101124,ARGEŞ,,,1,ȘCOALA GIMNAZIALĂ VALEA LUI ENACHE,SCOALA GIMNAZIALA VALEA LUI ENACHE,VALEA LUI ENACHE,PRINCIPALĂ,,
,362100385,361104041,,15901,15929,362100385,ARGEŞ,,,1,ȘCOALA PRIMARĂ JUPÂNEȘTI,SCOALA PRIMARA JUPANESTI,JUPÂNEŞTI,PRINCIPALĂ,,
29413196,361104801,,316480,13490,13506,361104801,ARGEŞ,,,139,"""GRĂDINIȚA CU PROGRAM PRELUNGIT """"SFÂNTUL NICOLAE"""" CÂMPULUNG""",GRADINITA CU PROGRAM PRELUNGIT SFANTUL NICOLAE CAMPULUNG,CÂMPULUNG,NEGRU VODĂ,,
,362105924,361103913,,15233,15297,362105924,ARGEŞ,,,,GRĂDINIŢA CU PROGRAM NORMAL RECEA-CĂTEASCA,GRADINITA CU PROGRAM NORMAL RECEA CATEASCA,GRUIU,,,
4318377,361103474,,333279,15983,15992,361103474,ARGEŞ,,,248,ȘCOALA GIMNAZIALĂ COTMEANA,SCOALA GIMNAZIALA COTMEANA,COTMEANA,PRINCIPALĂ,,
,362102265,361103922,,19007,19034,362102265,ARGEŞ,,,,ŞCOALA PRIMARĂ IOAN RIZESCU,SCOALA PRIMARA IOAN RIZESCU,CERŞANI,,,
,362101463,361104516,,13392,13409,362101463,ARGEŞ,,,1,ȘCOALA GIMNAZIALĂ NR. 1 ȘTEFĂNEȘTI,SCOALA GIMNAZIALA NR 1 STEFANESTI,ŞTEFĂNEŞTI,NAŢIONALĂ BUCUREŞTI,,
4469248,361104023,,326409,13169,13178,361104023,ARGEŞ,,,125,"""GRĂDINIȚA CU PROGRAM PRELUNGIT """"FLOARE DE COLȚ"""" PITEȘTI""",GRADINITA CU PROGRAM PRELUNGIT FLOARE DE COLT PITESTI,PITEŞTI,CRAIOVEI,,
,362100738,361104959,,16285,16294,362100738,ARGEŞ,,,1,ȘCOALA PRIMARĂ OLTEANCA,SCOALA PRIMARA OLTEANCA,DAVIDEŞTI,PRINCIPALĂ,,
,362102107,361103827,,19560,19588,362102107,ARGEŞ,,,,GRADINITA CU PROGRAM NORMAL COLTU,GRADINITA CU PROGRAM NORMAL COLTU,COLŢU,,,
5009990,361104588,,336037,13169,13178,361104588,ARGEŞ,,,34,"""COLEGIUL NAȚIONAL """"ZINCA GOLESCU"""" PITEȘTI""",COLEGIUL NATIONAL ZINCA GOLESCU PITESTI,PITEŞTI,EGALITĂȚII,,
,362106174,361100272,,18331,18368,362106174,ARGEŞ,,,D,SCOALA PRIMARA FURDUIESTI,SCOALA PRIMARA FURDUIESTI,FURDUEŞTI,DD,,
,362105485,361105078,,13169,13178,362105485,ARGEŞ,,,,GRĂDINIŢA CU PROGRAM NORMAL NR.11 PITEŞTI,GRADINITA CU PROGRAM NORMAL NR 11 PITESTI,PITEŞTI,,,
,362101816,361104276,,13169,13178,362101816,ARGEŞ,,,,ȘCOALA GIMNAZIALĂ NR. 1 PITEȘTI,SCOALA GIMNAZIALA NR 1 PITESTI,PITEŞTI,NICOLAE BALCESCU NR.29,,
,362106287,361103587,,17496,17548,362106287,ARGEŞ,,,D,GRADINITA CU PROGRAM NORMAL HINTESTI,GRADINITA CU PROGRAM NORMAL HINTESTI,HINŢEŞTI,GGG,,
,362105734,361104656,,17049,17094,362105734,ARGEŞ,,,,ŞCOALA GIMNAZIALĂ ZARNESTI MĂLURENI,SCOALA GIMNAZIALA ZARNESTI MALURENI,MĂLURENI,,,
5010056,361100245,,1180424,13490,13506,361100245,ARGEŞ,,,1,COLEGIUL TEHNIC CÂMPULUNG,COLEGIUL TEHNIC CAMPULUNG,CÂMPULUNG,BRAȘOVULUI,,
4318318,361103628,,334443,17619,17655,361103628,ARGEŞ,,,38,ȘCOALA GIMNAZIALĂ MUȘĂTEȘTI,SCOALA GIMNAZIALA MUSATESTI,MUSĂŢEŞTI,PRINCIPALĂ,,
5010072,361100028,,336076,13622,13631,361100028,ARGEŞ,,,131,"""COLEGIUL NAȚIONAL """"VLAICU VODĂ"""" CURTEA DE ARGEȘ""",COLEGIUL NATIONAL VLAICU VODA CURTEA DE ARGES,CURTEA DE ARGEŞ,NEGRU VODĂ,,
4317908,361105051,,331050,13169,13178,361105051,ARGEŞ,,,5,"""ȘCOALA GIMNAZIALĂ """"NICOLAE IORGA"""" PITEȘTI""",SCOALA GIMNAZIALA NICOLAE IORGA PITESTI,PITEŞTI,RÂURILOR,,
,362101106,361103655, ,14272,14307,362101106,ARGEŞ,,,1,ȘCOALA PRIMARĂ PRIBOAIA-GOLEȘTI,SCOALA PRIMARA PRIBOAIA GOLESTI,GOLEŞTI,PRINCIPALĂ,,
32055229,361206353,,32055229,13169,13178,361206353,ARGEŞ,,,5,"""ŞCOALA PRIMARA """"CASTELUL PIRATILOR""""""",SCOALA PRIMARA CASTELUL PIRATILOR,PITEŞTI,"""Pitesti", cartier Gavana III," Str. Petre Ispirescu nr."""
4121935,361104828,,1142406,13301,13310,361104828,ARGEŞ,,,01.mar,LICEUL TEHNOLOGIC CONSTRUCȚII DE MAȘINI MIOVENI,LICEUL TEHNOLOGIC CONSTRUCTII DE MASINI MIOVENI,MIOVENI,UZINEI,,
,362100503,361104475,,15448,15466,362100503,ARGEŞ,,,1,GRĂDINIȚA CU PROGRAM NORMAL BĂRĂȘTI,GRADINITA CU PROGRAM NORMAL BARASTI,BĂRĂŞTI,PRINCIPALĂ,,
,362100729,361104959,,16285,16310,362100729,ARGEŞ,,,1,GRĂDINIȚA CU PROGRAM NORMAL VOROVENI,GRADINITA CU PROGRAM NORMAL VOROVENI,VOROVENI,PRINCIPALĂ,,
,362105906,361103845,,15741,15787,362105906,ARGEŞ,,,,ŞCOALA PRIMARĂ OESTI PĂMANTENI,SCOALA PRIMARA OESTI PAMANTENI,CORBENI,,,
,362103085,361104656,,17049,17067,362103085,ARGEŞ,,,,ŞCOALA PRIMARĂ BUNEŞTI,SCOALA PRIMARA BUNESTI,BUNEŞTI,,,
4318105,361103456,,1101827,13169,13178,361103456,ARGEŞ,,,35,"""COLEGIUL TEHNIC """"DIMITRIE DIMA"""" PITEȘTI""",COLEGIUL TEHNIC DIMITRIE DIMA PITESTI,PITEŞTI,RĂZBOIENI,,
,362105277,361103795,,14352,14398,362105277,ARGEŞ,,,,GRĂDINIŢA CU PROGRAM NORMAL NEGREŞTI,GRADINITA CU PROGRAM NORMAL NEGRESTI,NEGREŞTI,,,
29387089,361104222,,332550,15064,15073,361104222,ARGEŞ,,,1,"""ȘCOALA GIMNAZIALĂ """"PROF. UNIV. DR. ION STOIA"""" CĂLDĂRARU""",SCOALA GIMNAZIALA PROF UNIV DR ION STOIA CALDARARU,CĂLDĂRARU,PRINCIPALĂ,,
,362102826,361105119,,17575,17593,362102826,ARGEŞ,,,,ŞCOALA GIMNAZIALĂ BABAROAGA,SCOALA GIMNAZIALA BABAROAGA,BABAROAGA,,,
,362100756,361104163,,13187,13267,362100756,ARGEŞ,,,12,ȘCOALA GIMNAZIALĂ VALEA URSULUI,SCOALA GIMNAZIALA VALEA URSULUI,VALEA URSULUI,Valea Ursului,,
,362100973,361104796,,14584,14655,362100973,ARGEŞ,,,1,GRĂDINIȚA CU PROGRAM NORMAL GLÂMBOCELU VALE,GRADINITA CU PROGRAM NORMAL GLAMBOCELU VALE,GLÂMBOCELU,PRINCIPALĂ,,
,362106111,361104362,,15402,15439,362106111,ARGEŞ,,,1,SCOALA PRIMARA NR.2 Valea Cetăţuii,SCOALA PRIMARA NR 2 VALEA CETATUII,CETĂŢENI,P,,
,362101834,361103388,,18741,18750,362101834,ARGEŞ,,,13,GRĂDINIȚA CU PROGRAM NORMAL NR. 3 SLOBOZIA,GRADINITA CU PROGRAM NORMAL NR 3 SLOBOZIA,SLOBOZIA,GĂEȘTI,,
,362102125,361104213,,19392,19409,362102125,ARGEŞ,,,,ŞCOALA PRIMARĂ GOVORA,SCOALA PRIMARA GOVORA,UDA,,,
5010072,361100227,,331543,13622,13631,361100227,ARGEŞ,,,3,"""ȘCOALA GIMNAZIALĂ """"MIRCEA CEL BĂTRÂN"""" CURTEA DE ARGEȘ""",SCOALA GIMNAZIALA MIRCEA CEL BATRAN CURTEA DE ARGES,CURTEA DE ARGEŞ,BANU MĂRĂCINE,,
,362101341,361104014,,13622,13631,362101341,ARGEŞ,,,141,ŞCOALA GIMNAZIALĂ SF.APOSTOL ANDREI,SCOALA GIMNAZIALA SF APOSTOL ANDREI,CURTEA DE ARGEŞ,RÎMNICU VÎLCEA,,
,362101698,361104864,,13622,13631,362101698,ARGEŞ,,,60,GRĂDINIȚA CU PROGRAM NORMAL NR. 1 CURTEA DE ARGEȘ,GRADINITA CU PROGRAM NORMAL NR 1 CURTEA DE ARGES,CURTEA DE ARGEŞ,BASARABILOR,,
,362101169,361104181,,14165,14245,362101169,ARGEŞ,,,1,ȘCOALA GIMNAZIALĂ VALEA BRAZILOR,SCOALA GIMNAZIALA VALEA BRAZILOR,VALEA BRAZILOR,PRINCIPALĂ,,
29497430,361104846,,300556,13819,13828,361104846,ARGEŞ,,,1,ȘCOALA GIMNAZIALĂ ALBEȘTII DE ARGEȘ,SCOALA GIMNAZIALA ALBESTII DE ARGES,ALBEŞTII PAMÂNTENI,PRINCIPALĂ,,
,362100566,361103913,,15233,15242,362100566,ARGEŞ,,,1,ȘCOALA PRIMARĂ RECEA,SCOALA PRIMARA RECEA,CĂTEASCA,PRINCIPALĂ,,
,362102342,361103596,,18778,18849,362102342,ARGEŞ,,,,ŞCOALA GIMNAZIALĂ RĂDEŞTI,SCOALA GIMNAZIALA RADESTI,RĂDEŞTI,NATIONAL PITESTI-CAMPULUNG,,
,352103935,371100182,330955,13490,13506,352103935,ARGEŞ,,,,CLUBUL COPIILOR CÂMPULUNG,CLUBUL COPIILOR CAMPULUNG,CÂMPULUNG,Calea Brasovului,,
4469523,361103922,,332274,19007,19016,361103922,ARGEŞ,,,280,"""ȘCOALA GIMNAZIALĂ """"MARIN BRANIȘTE"""" SUSENI""",SCOALA GIMNAZIALA MARIN BRANISTE SUSENI,SUSENI,PRINCIPALĂ,,
5010200,361104204,,333476,16329,16356,361104204,ARGEŞ,,,298,ŞCOALA GIMNAZIALĂ PODU DÂMBOVIŢEI DÂMBOVICIOARA,SCOALA GIMNAZIALA PODU DAMBOVITEI DAMBOVICIOARA,PODU DÂMBOVIŢEI,ȘCOLII,,
4317908,361104068,,336025,13169,13178,361104068,ARGEŞ,,,14,"""COLEGIUL NAȚIONAL """"ION C. BRĂTIANU"""" PITEȘTI""",COLEGIUL NATIONAL ION C BRATIANU PITESTI,PITEŞTI,ARMAND CĂLINESCU,,
,362105675,361104968,,14673,14682,362105675,ARGEŞ,,,,GRĂDINIŢA CU PROGRAM PRELUNGIT NR.1,GRADINITA CU PROGRAM PRELUNGIT NR 1,BOTENI,,,
29446290,361104163,,331140,13187,13196,361104163,ARGEŞ,,,126,"""ȘCOALA GIMNAZIALĂ """"VIRGIL CALOTESCU"""" BASCOV""",SCOALA GIMNAZIALA VIRGIL CALOTESCU BASCOV,BASCOV,PĂIȘEȘTI,,
,362100774,361104163,,13187,13249,362100774,ARGEŞ,,,181A,GRĂDINIȚA CU PROGRAM NORMAL SCHEAU,GRADINITA CU PROGRAM NORMAL SCHEAU,SCHIAU,PRINCIPALĂ,,
,362100955,361104796,,14584,14619,362100955,ARGEŞ,,,1,GRADINIȚA CU PROGRAM NORMAL BUJOI,GRADINITA CU PROGRAM NORMAL BUJOI,BUJOI,PRINCIPALĂ,,
,362101576,361104778,,13668,13677,362101576,ARGEŞ,,,92,ȘCOALA PRIMARĂ ZORILE,SCOALA PRIMARA ZORILE,COSTEŞTI,ZORILE,,
,362106138,361104077,,16908,16917,362106138,ARGEŞ,,,C,GRADINITA CU PROGRAM NORMAL LERESTI,GRADINITA CU PROGRAM NORMAL LERESTI,LEREŞTI,P,,
,362102324,361100168,,18858,18885,362102324,ARGEŞ,,,,ŞCOALA GIMNAZIALĂ COTENEŞTI,SCOALA GIMNAZIALA COTENESTI,COTENEŞTI,DRUM NAŢIONAL,,
,362105449,361100082,,13490,13506,362105449,ARGEŞ,,,,GRADINITA CU PROGRAM NORMAL NR.1 CAMPULUNG,GRADINITA CU PROGRAM NORMAL NR 1 CAMPULUNG,CÂMPULUNG,,,
300310,361103551,,300310,18938,18947,361103551,ARGEŞ,,,160,"""ȘCOALA GIMNAZIALĂ """"CONSTANTIN BĂLĂCEANU"""" STOLNICI""",SCOALA GIMNAZIALA CONSTANTIN BALACEANU STOLNICI,STOLNICI,PRINCIPALĂ,,
,362102143,361103985,,19338,19374,362102143,ARGEŞ,,,,ŞCOALA PRIMARĂ NR.1,SCOALA PRIMARA NR 1,VALEA MĂNĂSTIRII,,,
29347866,361100209,,1066656,13169,13178,361100209,ARGEŞ,,,20,"""GRĂDINIȚA CU PROGRAM PRELUNGIT """"MICUL PRINȚ"""" PITEȘTI""",GRADINITA CU PROGRAM PRELUNGIT MICUL PRINT PITESTI,PITEŞTI,CÂMPULUI,,
,362101368,361100028,,13622,13631,362101368,ARGEŞ,,,76,GRĂDINIȚA CU PROGRAM NORMAL SFÂNTA ANA CURTEA DE ARGEȘ,GRADINITA CU PROGRAM NORMAL SFANTA ANA CURTEA DE ARGES,CURTEA DE ARGEŞ,Negru Vodă,,
,362101142,361104181,,14165,14236,362101142,ARGEŞ,,,190,ȘCOALA GIMNAZIALĂ TUTANA,SCOALA GIMNAZIALA TUTANA,TUTANA,PRINCIPALĂ,,
,362100896,361100037,,14851,14904,362100896,ARGEŞ,,,1,GRĂDINIȚA CU PROGRAM NORMAL ROGOJINA,GRADINITA CU PROGRAM NORMAL ROGOJINA,ROGOJINA,PRINCIPALĂ,,
5172589,361104864,,326514,13622,13631,361104864,ARGEŞ,,,5,"""GRĂDINIȚA CU PROGRAM PRELUNGIT """"O LUME MINUNATĂ"""" CURTEA DE ARGEȘ""",GRADINITA CU PROGRAM PRELUNGIT O LUME MINUNATA CURTEA DE ARGES,CURTEA DE ARGEŞ,EPISCOP NICHITA,,
,362100548,361104882,,15313,15340,362100548,ARGEŞ,,,40,ȘCOALA PRIMARĂ NR. 2 UNGURENI,SCOALA PRIMARA NR 2 UNGURENI,CEPARII UNGURENI,PRINCIPALĂ,,
4122515,361104389,,300789,17968,17977,361104389,ARGEŞ,,,479A,ȘCOALA GIMNAZIALĂ NR. 1 POIENARII DE MUSCEL,SCOALA GIMNAZIALA NR 1 POIENARII DE MUSCEL,POIENARI,PRINCIPALĂ,,
,362103153,361104873,,16551,16604,362103153,ARGEŞ,,,,GRĂDINIŢA CU PROGRAM NORMAL MALU,GRADINITA CU PROGRAM NORMAL MALU,MALU,STRADA PRINCIPALA,,
,362102794,361100168,,18858,18876,362102794,ARGEŞ,,,,ŞCOALA GIMNAZIALĂ BĂDENI,SCOALA GIMNAZIALA BADENI,BĂDENI,DRUMUL BISERICII,,
4122094,361103949,,332977,15554,15581,361103949,ARGEŞ,,,1,ȘCOALA GIMNAZIALĂ BRATIA-CIOMĂGEȘTI,SCOALA GIMNAZIALA BRATIA CIOMAGESTI,BRATIA,PRINCIPALĂ,,
4469442,361104267,,334559,17771,17780,361104267,ARGEŞ,,,39,"""ȘCOALA GIMNAZIALĂ """"TOMA ARNĂUȚOIU"""" NUCȘOARA""",SCOALA GIMNAZIALA TOMA ARNAUTOIU NUCSOARA,NUCŞOARA,ELISABETA RIZEA,,
,362101585,361104778,,13668,13677,362101585,ARGEŞ,,,1,GRĂDINIȚA CU PROGRAM NORMAL PODU BROȘTENI,GRADINITA CU PROGRAM NORMAL PODU BROSTENI,COSTEŞTI,PRINCIPALĂ,,
4318393,361104086,,335515,19114,19123,361104086,ARGEŞ,,,351,ȘCOALA GIMNAZIALĂ ȘTEFAN CEL MARE,SCOALA GIMNAZIALA STEFAN CEL MARE,ŞTEFAN CEL MARE,ALEXANDRU IOAN CUZA,,
