COD FISCAL,COD SIIIR,COD SIIIR SUP,COD SIRUES,SIRUTA LOC SUP,SIRUTA LOCALITATE,cod,judet,lat,lon,nr,nume,nume_ascii,oras,str,wikidata
,662101974,661100878,374700,33435,33462,662101974,BISTRIŢA-NĂSĂUD,,,210,ȘCOALA PRIMARĂ CHIRALEȘ,SCOALA PRIMARA CHIRALES,CHIRALEŞ,Principală,
,662102957,661103601,371722,32483,32492,662102957,BISTRIŢA-NĂSĂUD,,,6,"""GRĂDINIȚA CU PROGRAM NORMAL """"1 IUNIE"""" BECLEAN""",GRADINITA CU PROGRAM NORMAL 1 IUNIE BECLEAN,BECLEAN,Șieului,
,662101757,661101504,373433,34770,34789,662101757,BISTRIŢA-NĂSĂUD,,,192,GRĂDINIȚA CU PROGRAM NORMAL ȘIEU-ODORHEI,GRADINITA CU PROGRAM NORMAL SIEU ODORHEI,ŞIEU-ODORHEI,Principală,
28180556,661101558,,374889,33729,33738,661101558,BISTRIŢA-NĂSĂUD,,,217,"""ȘCOALA GIMNAZIALĂ """"DARIU POP"""" MĂGURA ILVEI""",SCOALA GIMNAZIALA DARIU POP MAGURA ILVEI,MĂGURA ILVEI,Principală,
29885369,661100973,,371485,32394,32401,661100973,BISTRIŢA-NĂSĂUD,,,23,GRĂDINIȚA CU PROGRAM PRELUNGIT NR.2 BISTRIȚA,GRADINITA CU PROGRAM PRELUNGIT NR 2 BISTRITA,BISTRIŢA,Rodnei,
,662103533,661101228,375742,34850,34878,662103533,BISTRIŢA-NĂSĂUD,,,42,ȘCOALA PRIMARĂ LUNCA,SCOALA PRIMARA LUNCA,LUNCA,Principală,
,662102229,661100842,374920,179720,33756,662102229,BISTRIŢA-NĂSĂUD,,,,GRĂDINIȚA CU PROGRAM NORMAL TUNEL POIANA ILVEI,GRADINITA CU PROGRAM NORMAL TUNEL POIANA ILVEI,POIANA ILVEI,Tunel,
,662103284,661100937,375780,34690,34716,662103284,BISTRIŢA-NĂSĂUD,,,72,ȘCOALA GIMNAZIALĂ ARCALIA,SCOALA GIMNAZIALA ARCALIA,ARCALIA,Principală,
,662100168,661101359,374853,33603,33612,662100168,BISTRIŢA-NĂSĂUD,,,27,ȘCOALA PRIMARĂ NR.2 LUNCA ILVEI,SCOALA PRIMARA NR 2 LUNCA ILVEI,LUNCA ILVEI,Grănicerilor,
28219133,661101038,,371564,32599,32606,661101038,BISTRIŢA-NĂSĂUD,,,1,GRĂDINIȚA CU PROGRAM PRELUNGIT SÎNGEORZ BĂI,GRADINITA CU PROGRAM PRELUNGIT SINGEORZ BAI,SÂNGEORZ-BĂI,Teilor,
,662102039,661101255,373483,34903,34912,662102039,BISTRIŢA-NĂSĂUD,,,31,GRĂDINIȚA CU PROGRAM NORMAL ȘINTEREAG,GRADINITA CU PROGRAM NORMAL SINTEREAG,ŞINTEREAG,Principală,
,662103076,661101472,376253,35090,35143,662103076,BISTRIŢA-NĂSĂUD,,,485B,SCOALA PRIMARĂ NR.2 TUREAC,SCOALA PRIMARA NR 2 TUREAC,TUREAC,Principală,
,662101911,661100738,374023,32768,32795,662101911,BISTRIŢA-NĂSĂUD,,,212A,ȘCOALA PRIMARĂ ȚAGU,SCOALA PRIMARA TAGU,ŢAGU,Principală,
,662102939,661101011,372269,33202,33211,662102939,BISTRIŢA-NĂSĂUD,,,268,GRĂDINIȚA CU PROGRAM NORMAL DUMITRA,GRADINITA CU PROGRAM NORMAL DUMITRA,DUMITRA,Principală,
,662100209,661100955,375704,34645,34663,662100209,BISTRIŢA-NĂSĂUD,,,115,ȘCOALA GIMNAZIALĂ ARDAN,SCOALA GIMNAZIALA ARDAN,ARDAN,Principală,
28197159,661100991,,374956,33658,33667,661100991,BISTRIŢA-NĂSĂUD,,,91,ȘCOALA GIMNAZIALĂ MATEI,SCOALA GIMNAZIALA MATEI,MATEI,Principală,
,662103515,661101463,373720,35054,35063,662103515,BISTRIŢA-NĂSĂUD,,,296,GRĂDINIȚA CU PROGRAM NORMAL NR.2 TELCIU,GRADINITA CU PROGRAM NORMAL NR 2 TELCIU,TELCIU,Principală,
,662102202,661101418,374164,32955,32982,662102202,BISTRIŢA-NĂSĂUD,,,227,ȘCOALA PRIMARĂ DUMBRĂVENI,SCOALA PRIMARA DUMBRAVENI,DUMBRĂVENI,Principală,
31699333,661201565,,62071302,32394,32401,661201565,BISTRIŢA-NĂSĂUD,,,8,"""ȘCOALA POSTLICEALA """"HENRI COANDĂ"""" BISTRIȚA""",SCOALA POSTLICEALA HENRI COANDA BISTRITA,BISTRIŢA,Alba Iulia,
29158280,661100765,,374463,33248,33266,661100765,BISTRIŢA-NĂSĂUD,,,174,"""ȘCOALA GIMNAZIALĂ """"GAVRIL ISTRATE"""" NEPOS""",SCOALA GIMNAZIALA GAVRIL ISTRATE NEPOS,NEPOS,Principală,
,662102057,661101255,373524,34903,34921,662102057,BISTRIŢA-NĂSĂUD,,,89,GRĂDINIȚA CU PROGRAM NORMAL BLĂJENII DE JOS,GRADINITA CU PROGRAM NORMAL BLAJENII DE JOS,BLĂJENII DE JOS,Principală,
,662103899,661101504,375857,34770,34798,662103899,BISTRIŢA-NĂSĂUD,,,86,GRĂDINIȚA CU PROGRAM NORMAL AGRIȘU DE JOS,GRADINITA CU PROGRAM NORMAL AGRISU DE JOS,AGRIŞU DE JOS,Principală,
,662103094,661101332,1253733,35090,35125,662103094,BISTRIŢA-NĂSĂUD,,,141,GRĂDINIȚA CU PROGRAM NORMAL NR.2 MUREȘENII BÎRGĂULUI,GRADINITA CU PROGRAM NORMAL NR 2 MURESENII BIRGAULUI,MUREŞENII BÂRGĂULUI,Principală,
,662102912,661101011,374437,33202,33220,662102912,BISTRIŢA-NĂSĂUD,,,73,ȘCOALA GIMNAZIALĂ CEPARI,SCOALA GIMNAZIALA CEPARI,CEPARI,Principală,
,662100227,661100729,372520,33435,33505,662100227,BISTRIŢA-NĂSĂUD,,,195,GRĂDINIȚA CU PROGRAM NORMAL VERMEȘ,GRADINITA CU PROGRAM NORMAL VERMES,VERMEŞ,Valea Viilor,
,662101793,661101038,371784,32599,32624,662101793,BISTRIŢA-NĂSĂUD,,,89,GRĂDINIȚA CU PROGRAM NORMAL NR.6 SÎNGEORZ-BĂI,GRADINITA CU PROGRAM NORMAL NR 6 SINGEORZ BAI,VALEA BORCUTULUI,Valea Borcutului,
,662102419,661103818,1243477,32394,32401,662102419,BISTRIŢA-NĂSĂUD,,,9,GRĂDINIȚA CU PROGRAM NORMAL NR.15 BISTRIȚA,GRADINITA CU PROGRAM NORMAL NR 15 BISTRITA,BISTRIŢA,Zimbrului,
,662102265,661101368,375170,33952,33970,662102265,BISTRIŢA-NĂSĂUD,,,100,"""ȘCOALA PRIMARĂ """"EMIL PĂCURAR"""" GLEDIN""",SCOALA PRIMARA EMIL PACURAR GLEDIN,GLEDIN,Principală,
,662103135,661101332,376265,35090,35134,662103135,BISTRIŢA-NĂSĂUD,,,108B,ȘCOALA GIMNAZIALĂ PIATRA FÎNTÎNELE,SCOALA GIMNAZIALA PIATRA FINTINELE,PIATRA FÂNTÂNELE,Principală,
8049492,661101291,,3043273,32394,32401,661101291,BISTRIŢA-NĂSĂUD,,,264,"""CENTRUL ȘCOLAR DE EDUCAȚIE INCLUZIVĂ """"LACRIMA"""" UNIREA""",CENTRUL SCOLAR DE EDUCATIE INCLUZIVA LACRIMA UNIREA,BISTRIŢA,Cartier Unirea,
18134781,661100747,,3061093,32483,32492,661100747,BISTRIŢA-NĂSĂUD,,,83,"""LICEUL TEHNOLOGIC """"HENRI COANDĂ"""" BECLEAN""",LICEUL TEHNOLOGIC HENRI COANDA BECLEAN,BECLEAN,Obor,
4730601,661101436,,377142,34985,34994,661101436,BISTRIŢA-NĂSĂUD,,,604,"""LICEUL TEORETIC """"CONSTANTIN ROMANU VIVU"""" TEACA""",LICEUL TEORETIC CONSTANTIN ROMANU VIVU TEACA,TEACA,Ion Creangă,
,662102075,661101255,375936,34903,34958,662102075,BISTRIŢA-NĂSĂUD,,,20,ȘCOALA GIMNAZIALĂ COCIU,SCOALA GIMNAZIALA COCIU,COCIU,Principală,
,662103307,661100937,375792,34690,34725,662103307,BISTRIŢA-NĂSĂUD,,,163,GRĂDINIȚA CU PROGRAM NORMAL CHINTELNIC,GRADINITA CU PROGRAM NORMAL CHINTELNIC,CHINTELNIC,Principală,
,662100245,661100729,372518,33435,33471,662100245,BISTRIŢA-NĂSĂUD,,,156,GRĂDINIȚA CU PROGRAM NORMAL SÎNGEORZU NOU,GRADINITA CU PROGRAM NORMAL SINGEORZU NOU,SÂNGEORZU NOU,Principală,
,662102794,661103596,374322,33015,33088,662102794,BISTRIŢA-NĂSĂUD,,,95,ȘCOALA PRIMARĂ MANIC,SCOALA PRIMARA MANIC,MANIC,Principală,
,662102247,661100919,1295028,32544,32553,662102247,BISTRIŢA-NĂSĂUD,,,184,ȘCOALA GIMNAZIALĂ VALEA SPINULUI,SCOALA GIMNAZIALA VALEA SPINULUI,NĂSĂUD,Geoge Coșbuc,
,662102532,661101169,990126,32394,32429,662102532,BISTRIŢA-NĂSĂUD,,,107,GRĂDINIȚA CU PROGRAM NORMAL SĂRATA,GRADINITA CU PROGRAM NORMAL SARATA,SĂRATA,Cartier Sărata,
,662103117,661101332,376227,35090,35125,662103117,BISTRIŢA-NĂSĂUD,,,400B,ȘCOALA GIMNAZIALĂ MUREȘENII BÎRGĂULUI,SCOALA GIMNAZIALA MURESENII BIRGAULUI,MUREŞENII BÂRGĂULUI,Principală,
28713101,661103714,,961010,34422,34431,661103714,BISTRIŢA-NĂSĂUD,,,100,ȘCOALA GIMNAZIALĂ SILIVAȘU DE CÎMPIE,SCOALA GIMNAZIALA SILIVASU DE CIMPIE,SILIVAŞU DE CÂMPIE,Principală,
,662100498,661100037,1119640,35152,35214,662100498,BISTRIŢA-NĂSĂUD,,,2,GRĂDINIȚA CU PROGRAM NORMAL NR.2 IZVOR LUNCA SĂTEASCĂ,GRADINITA CU PROGRAM NORMAL NR 2 IZVOR LUNCA SATEASCA,LUNCA SĂTEASCA,Principală,
28255314,661100729,,374712,33435,33505,661100729,BISTRIŢA-NĂSĂUD,,,20,ȘCOALA GIMNAZIALĂ VERMEȘ,SCOALA GIMNAZIALA VERMES,VERMEŞ,Principală,
28506262,661100896,,375649,179944,34413,661100896,BISTRIŢA-NĂSĂUD,,,409,"""ȘCOALA GIMNAZIALĂ """"IOAN S.PAVELEA"""" RUNCU SALVEI""",SCOALA GIMNAZIALA IOAN S PAVELEA RUNCU SALVEI,RUNCU SALVEI,Aluniș,
31422269,661200098,,62071297,32394,32401,661200098,BISTRIŢA-NĂSĂUD,,,26,"""LICEUL CREȘTIN """"LOGOS"""" BISTRIȚA""",LICEUL CRESTIN LOGOS BISTRITA,BISTRIŢA,Romană,
28278911,661101418,,374164,32955,32964,661101418,BISTRIŢA-NĂSĂUD,,,287B,ȘCOALA GIMNAZIALĂ CICEU-GIURGEȘTI,SCOALA GIMNAZIALA CICEU GIURGESTI,CICEU-GIURGEŞTI,Principală,
,662103325,661101436,373603,34985,34994,662103325,BISTRIŢA-NĂSĂUD,,,164,GRĂDINIȚA CU PROGRAM NORMAL TEACA,GRADINITA CU PROGRAM NORMAL TEACA,TEACA,Principală,
31996547,661203757,,62071338,32394,32401,661203757,BISTRIŢA-NĂSĂUD,,,17,"""GRĂDINIȚA CU PROGRAM PRELUNGIT """"PRICHINDEII"""" BISTRIȚA""",GRADINITA CU PROGRAM PRELUNGIT PRICHINDEII BISTRITA,BISTRIŢA,Valea Rusului,
,662101861,661100869,382599,32394,32401,662101861,BISTRIŢA-NĂSĂUD,,,2,GRĂDINIȚA CU PROGRAM NORMAL NR.17 BISTRIȚA,GRADINITA CU PROGRAM NORMAL NR 17 BISTRITA,BISTRIŢA,Castanului,
,662102514,661100991,374994,33658,33710,662102514,BISTRIŢA-NĂSĂUD,,,65,ȘCOALA PRIMARĂ MORUȚ,SCOALA PRIMARA MORUT,MORUŢ,Principală,
,662103171,661100711,375558,34280,34324,662103171,BISTRIŢA-NĂSĂUD,,,52,ȘCOALA PRIMARĂ PODEREI,SCOALA PRIMARA PODEREI,PODEREI,Principală,
4426867,661103732,,1068774,32394,32401,661103732,BISTRIŢA-NĂSĂUD,,,2BIS,CENTRUL ȘCOLAR DE EDUCAȚIE INCLUZIVĂ NR.2 BISTRIȚA,CENTRUL SCOLAR DE EDUCATIE INCLUZIVA NR 2 BISTRITA,BISTRIŢA,Toamnei,
,662103524,661101463,373732,35054,35063,662103524,BISTRIŢA-NĂSĂUD,,,818A,GRĂDINIȚA CU PROGRAM NORMAL ȘI PRELUNGIT NR.1 TELCIU,GRADINITA CU PROGRAM NORMAL SI PRELUNGIT NR 1 TELCIU,TELCIU,Principală,
,662101938,661101056,375027,33765,33836,662101938,BISTRIŢA-NĂSĂUD,,,149,ȘCOALA PRIMARĂ SÎNTIOANA,SCOALA PRIMARA SINTIOANA,SÂNTIOANA,Principală,
4426808,661100702,,1180728,32394,32401,661100702,BISTRIŢA-NĂSĂUD,,,18-20,LICEUL TEORETIC SANITAR BISTRIȚA,LICEUL TEORETIC SANITAR BISTRITA,BISTRIŢA,Republicii,
19091352,661100878,,374695,33435,33444,661100878,BISTRIŢA-NĂSĂUD,,,221,LICEUL TEHNOLOGIC LECHINȚA,LICEUL TEHNOLOGIC LECHINTA,LECHINŢA,Poștei,
28278881,661101472,,376239,35090,35143,661101472,BISTRIŢA-NĂSĂUD,,,724A,ȘCOALA GIMNAZIALĂ TUREAC,SCOALA GIMNAZIALA TUREAC,TUREAC,Principală,
,662102161,661101074,990578,33248,33257,662102161,BISTRIŢA-NĂSĂUD,,,466,GRĂDINIȚA CU PROGRAM NORMAL NR.6 FELDRU,GRADINITA CU PROGRAM NORMAL NR 6 FELDRU,FELDRU,Principală,
,662101879,661103664,372673,33621,33630,662101879,BISTRIŢA-NĂSĂUD,,,180,GRĂDINIȚA CU PROGRAM NORMAL NR.1 MAIERU,GRADINITA CU PROGRAM NORMAL NR 1 MAIERU,MAIERU,Principală,
,662103343,661101436,376156,34985,35027,662103343,BISTRIŢA-NĂSĂUD,,,324,ȘCOALA GIMNAZIALĂ OCNIȚA,SCOALA GIMNAZIALA OCNITA,OCNIŢA,Principală,
4347313,661103691,,377128,32544,32553,661103691,BISTRIŢA-NĂSĂUD,,,2A,COLEGIUL ECONOMIC NĂSĂUD,COLEGIUL ECONOMIC NASAUD,NĂSĂUD,Grănicerilor,
,662100281,661101377,372544,33514,33532,662100281,BISTRIŢA-NĂSĂUD,,,272,GRĂDINIȚA CU PROGRAM NORMAL LUNCA LEȘULUI,GRADINITA CU PROGRAM NORMAL LUNCA LESULUI,LUNCA LEŞULUI,Principală,
,662101888,661103664,372697,33621,33630,662101888,BISTRIŢA-NĂSĂUD,,,280,GRĂDINIȚA CU PROGRAM NORMAL NR.2 MAIERU,GRADINITA CU PROGRAM NORMAL NR 2 MAIERU,MAIERU,Principală,
,662102758,661101002,375417,34173,34191,662102758,BISTRIŢA-NĂSĂUD,,,208,ȘCOALA PRIMARĂ BAȚA,SCOALA PRIMARA BATA,BAŢA,Principală,
,662102577,661100982,373902,32633,32651,662102577,BISTRIŢA-NĂSĂUD,,,49,ȘCOALA GIMNAZIALĂ COLIBIȚA,SCOALA GIMNAZIALA COLIBITA,COLIBIŢA,Colibița,
,662103483,661101463,372257,35054,33195,662103483,BISTRIŢA-NĂSĂUD,,,117A,GRĂDINIȚA CU PROGRAM NORMAL BICHIGIU,GRADINITA CU PROGRAM NORMAL BICHIGIU,BICHIGIU,Principală,
,662102283,661103646,371966,32811,32839,662102283,BISTRIŢA-NĂSĂUD,,,,GRĂDINIȚA CU PROGRAM NORMAL CĂIANU MARE,GRADINITA CU PROGRAM NORMAL CAIANU MARE,CĂIANU MARE,Principală,
,662103153,661103795,371514,32394,32401,662103153,BISTRIŢA-NĂSĂUD,,,15,GRĂDINIȚA CU PROGRAM NORMAL NR 5 BISTRIȚA,GRADINITA CU PROGRAM NORMAL NR 5 BISTRITA,BISTRIŢA,Mesteacănului,
4347682,671100015,,376887,32394,32401,671100015,BISTRIŢA-NĂSĂUD,,,3-5,PALATUL COPIILOR BISTRIȚA,PALATUL COPIILOR BISTRITA,BISTRIŢA,Florilor,
,682103005,661101133,63134979,32394,32401,682103005,BISTRIŢA-NĂSĂUD,,,18,CLUBUL ȘCOLAR SPORTIV BISTRIȚA,CLUBUL SCOLAR SPORTIV BISTRITA,BISTRIŢA,Calea Moldovei,
29297350,661101187,,374798,33541,33550,661101187,BISTRIŢA-NĂSĂUD,,,525,ȘCOALA GIMNAZIALĂ LIVEZILE,SCOALA GIMNAZIALA LIVEZILE,LIVEZILE,Calea Moldovei,
,662100548,661103723,374097,34547,32866,662100548,BISTRIŢA-NĂSĂUD,,,116,ȘCOALA PRIMARĂ DOBRICEL,SCOALA PRIMARA DOBRICEL,DOBRICEL,Principală,
4548830,661101323,,1130357,32483,32492,661101323,BISTRIŢA-NĂSĂUD,,,83,"""COLEGIUL NAȚIONAL """"PETRU RAREȘ"""" BECLEAN""",COLEGIUL NATIONAL PETRU RARES BECLEAN,BECLEAN,Obor,
4426794,631100135,,1119523,32394,32401,631100135,BISTRIŢA-NĂSĂUD,,,24,CASA CORPULUI DIDACTIC A JUDEȚULUI BISTRIȚA-NĂSĂUD,CASA CORPULUI DIDACTIC A JUDETULUI BISTRITA NASAUD,BISTRIŢA,Independenţei,
,662102776,661101002,373081,34173,34182,662102776,BISTRIŢA-NĂSĂUD,,,489,GRĂDINIȚA CU PROGRAM NORMAL RETEAG,GRADINITA CU PROGRAM NORMAL RETEAG,RETEAG,Principală,
,662101608,661101305,372350,33275,33284,662101608,BISTRIŢA-NĂSĂUD,,,,GRĂDINIȚA CU PROGRAM NORMAL GALAȚII BISTRIȚEI,GRADINITA CU PROGRAM NORMAL GALATII BISTRITEI,GALAŢII BISTRIŢEI,Principală,
,662102808,661103596,374255,33015,33079,662102808,BISTRIŢA-NĂSĂUD,,,77,ȘCOALA PRIMARĂ JIMBOR,SCOALA PRIMARA JIMBOR,JIMBOR,Principală,
,662102559,661101169,376813,32394,32429,662102559,BISTRIŢA-NĂSĂUD,,,104,ȘCOALA PRIMARĂ SĂRATA,SCOALA PRIMARA SARATA,SĂRATA,Cartier Sărata,
22163220,661103777,,376746,32394,32401,661103777,BISTRIŢA-NĂSĂUD,,,46,ȘCOALA GIMNAZIALĂ NR.1 BISTRIȚA,SCOALA GIMNAZIALA NR 1 BISTRITA,BISTRIŢA,Independenţei,
,662100385,661100928,1253604,33337,33346,662100385,BISTRIŢA-NĂSĂUD,,,468B,GRĂDINIȚA CU PROGRAM NORMAL NR.2 ILVA MARE,GRADINITA CU PROGRAM NORMAL NR 2 ILVA MARE,ILVA MARE,Principală,
29871150,661100833,,981400,32394,32401,661100833,BISTRIŢA-NĂSĂUD,,,1A,GRĂDINIȚA CU PROGRAM PRELUNGIT NR.13 BISTRIȚA,GRADINITA CU PROGRAM PRELUNGIT NR 13 BISTRITA,BISTRIŢA,Basmului,
,662100566,661100123,375479,34262,34271,662100566,BISTRIŢA-NĂSĂUD,,,606,ȘCOALA PRIMARĂ NR.2 REBRA,SCOALA PRIMARA NR 2 REBRA,REBRA,Principală,
,662102143,661101074,372295,33248,33257,662102143,BISTRIŢA-NĂSĂUD,,,782,GRĂDINIȚA CU PROGRAM NORMAL NR.1 FELDRU,GRADINITA CU PROGRAM NORMAL NR 1 FELDRU,FELDRU,Principală,
28331411,661101305,,374528,33275,33284,661101305,BISTRIŢA-NĂSĂUD,,,234,"""ȘCOALA GIMNAZIALĂ """"GRIGORE HERINEAN"""" GALAȚII BISTRIȚEI""",SCOALA GIMNAZIALA GRIGORE HERINEAN GALATII BISTRITEI,GALAŢII BISTRIŢEI,Principală,
,662102125,661101074,119573,33248,33257,662102125,BISTRIŢA-NĂSĂUD,,,1028,GRĂDINIȚA CU PROGRAM NORMAL NR.7 FELDRU,GRADINITA CU PROGRAM NORMAL NR 7 FELDRU,FELDRU,Principală,
4426816,621100148,,371461,32394,32401,621100148,BISTRIŢA-NĂSĂUD,,,5,INSPECTORATUL ȘCOLAR JUDEȚEAN BISTRIȚA-NĂSĂUD,INSPECTORATUL SCOLAR JUDETEAN BISTRITA NASAUD,BISTRIŢA,01.dec,
,662101594,661101305,372362,33275,33300,662101594,BISTRIŢA-NĂSĂUD,,,232,GRĂDINIȚA CU PROGRAM NORMAL DIPȘA,GRADINITA CU PROGRAM NORMAL DIPSA,DIPŞA,Principală,
,662102713,661101187,372568,33541,33578,662102713,BISTRIŢA-NĂSĂUD,,,41,GRĂDINIȚA CU PROGRAM NORMAL DOROLEA,GRADINITA CU PROGRAM NORMAL DOROLEA,DOROLEA,Principală,
,662103447,661101201,372207,33122,33131,662103447,BISTRIŢA-NĂSĂUD,,,257A,GRĂDINIȚA CU PROGRAM NORMAL CHIUZA,GRADINITA CU PROGRAM NORMAL CHIUZA,CHIUZA,Principală,
,662102826,661103596,374308,33015,33060,662102826,BISTRIŢA-NĂSĂUD,,,27,ȘCOALA PRIMARĂ CHEȚIU,SCOALA PRIMARA CHETIU,CHEŢIU,Principală,
,662103198,661100711,375508,34280,34299,662103198,BISTRIŢA-NĂSĂUD,,,521,ȘCOALA PRIMARĂ NR.2 REBRIȘOARA,SCOALA PRIMARA NR 2 REBRISOARA,REBRIŞOARA,Grui,
,662100367,661100928,372398,33337,33346,662100367,BISTRIŢA-NĂSĂUD,,,280,GRĂDINIȚA CU PROGRAM NORMAL NR.1 ILVA MARE,GRADINITA CU PROGRAM NORMAL NR 1 ILVA MARE,ILVA MARE,Principală,
28794602,661101142,,991352,32884,32937,661101142,BISTRIŢA-NĂSĂUD,,,216,ȘCOALA GIMNAZIALĂ PETRIȘ,SCOALA GIMNAZIALA PETRIS,PETRIŞ,Principală,
4426913,661100815,,844585,32394,32401,661100815,BISTRIŢA-NĂSĂUD,,,21,LICEUL TEHNOLOGIC AGRICOL BISTRIȚA,LICEUL TEHNOLOGIC AGRICOL BISTRITA,BISTRIŢA,Tărpiului,
,662100503,661101029,3005489,179686,32900,662100503,BISTRIŢA-NĂSĂUD,,,425,GRĂDINIȚA CU PROGRAM NORMAL NR.1 BUDACU DE SUS,GRADINITA CU PROGRAM NORMAL NR 1 BUDACU DE SUS,BUDACU DE SUS,Principală,
4548848,661101499,,831851,32483,32492,661101499,BISTRIŢA-NĂSĂUD,,,2,LICEUL TEHNOLOGIC AGRICOL BECLEAN,LICEUL TEHNOLOGIC AGRICOL BECLEAN,BECLEAN,P-ța Libertății,
28419336,661101368,,375168,33952,33961,661101368,BISTRIŢA-NĂSĂUD,,,416,"""ȘCOALA GIMNAZIALĂ """"PAUL TANCO"""" MONOR""",SCOALA GIMNAZIALA PAUL TANCO MONOR,MONOR,Principală,
,662103854,661103601,991338,32483,32492,662103854,BISTRIŢA-NĂSĂUD,,,10,GRĂDINIȚA CU PROGRAM NORMAL VALEA VIILOR BECLEAN,GRADINITA CU PROGRAM NORMAL VALEA VIILOR BECLEAN,BECLEAN,Valea Viilor,
5352210,661201194,,62898633,32394,32401,661201194,BISTRIŢA-NĂSĂUD,,,3,"""ȘCOALA SANITARĂ POSTLICEALĂ """"CAROL DAVILA"""" BISTRIȚA""",SCOALA SANITARA POSTLICEALA CAROL DAVILA BISTRITA,BISTRIŢA,Odobescu Alexandru,
,662100195,661100955,375716,34645,34672,662100195,BISTRIŢA-NĂSĂUD,,,129,ȘCOALA PRIMARĂ POSMUȘ,SCOALA PRIMARA POSMUS,POSMUŞ,Principală,
,662101825,661101038,1190254,32599,32606,662101825,BISTRIŢA-NĂSĂUD,,,2,GRĂDINIȚA CU PROGRAM NORMAL NR.5 SÎNGEORZ-BĂI,GRADINITA CU PROGRAM NORMAL NR 5 SINGEORZ BAI,SÂNGEORZ-BĂI,Sălciilor,
,662102731,661101187,374803,33541,33578,662102731,BISTRIŢA-NĂSĂUD,,,42,ȘCOALA GIMNAZIALĂ DOROLEA,SCOALA GIMNAZIALA DOROLEA,DOROLEA,Principală,
,662103465,661101201,374372,33122,33168,662103465,BISTRIŢA-NĂSĂUD,,,37,GRĂDINIȚA CU PROGRAM NORMAL SĂSARM,GRADINITA CU PROGRAM NORMAL SASARM,SĂSARM,Principală,
,662101644,661100756,374633,33382,33426,662101644,BISTRIŢA-NĂSĂUD,,,70,ȘCOALA PRIMARĂ STRÎMBA,SCOALA PRIMARA STRIMBA,STRÂMBA,Principală,
,662102595,661101065,990815,34360,34379,662102595,BISTRIŢA-NĂSĂUD,,,258A,GRĂDINIȚA CU PROGRAM NORMAL NR.3 ROMULI,GRADINITA CU PROGRAM NORMAL NR 3 ROMULI,ROMULI,Principală,
,662100349,661103628,376693,35429,35456,662100349,BISTRIŢA-NĂSĂUD,,,84,ȘCOALA GIMNAZIALĂ PERIȘOR,SCOALA GIMNAZIALA PERISOR,PERIŞOR,Principală,
28320870,651103781,,376966,32599,32606,651103781,BISTRIŢA-NĂSĂUD,,,9,CLUBUL COPIILOR SÎNGEORZ-BĂI,CLUBUL COPIILOR SINGEORZ BAI,SÂNGEORZ-BĂI,Lalelelor,
29885385,661101169,,376849,32394,32401,661101169,BISTRIŢA-NĂSĂUD,,,37,ȘCOALA GIMNAZIALĂ NR.7,SCOALA GIMNAZIALA NR 7,BISTRIŢA,Cartier Viisoara,
,662100521,661103723,374102,34547,32875,662100521,BISTRIŢA-NĂSĂUD,,,211,"""ȘCOALA GIMNAZIALĂ """"TEODOR COTUȚIU"""" DUMBRĂVIȚA""",SCOALA GIMNAZIALA TEODOR COTUTIU DUMBRAVITA,DUMBRĂVIŢA,Principală,
,662102699,661101187,374815,33541,33569,662102699,BISTRIŢA-NĂSĂUD,,,42,ȘCOALA PRIMARĂ CUȘMA,SCOALA PRIMARA CUSMA,CUŞMA,Principală,
28854267,661101341,,375118,33881,33890,661101341,BISTRIŢA-NĂSĂUD,,,212,ȘCOALA GIMNAZIALĂ MILAȘ,SCOALA GIMNAZIALA MILAS,MILAŞ,Principală,
,662102473,661101549,376617,35312,35394,662102473,BISTRIŢA-NĂSĂUD,,,102,ȘCOALA PRIMARĂ ȘOPTERIU,SCOALA PRIMARA SOPTERIU,ŞOPTERIU,Principală,
,662103872,661101481,374073,32811,32848,662103872,BISTRIŢA-NĂSĂUD,,,218,GRĂDINIȚA CU PROGRAM NORMAL CICEU-POIENI,GRADINITA CU PROGRAM NORMAL CICEU POIENI,CICEU-POIENI,Principală,
,662103257,661103596,372192,33015,33042,662103257,BISTRIŢA-NĂSĂUD,,,164,GRĂDINIȚA CU PROGRAM NORMAL BOZIEȘ,GRADINITA CU PROGRAM NORMAL BOZIES,BOZIEŞ,Principală,
28278997,661103619,,374176,179659,32991,661103619,BISTRIŢA-NĂSĂUD,,,503,ȘCOALA GIMNAZIALĂ NEGRILEȘTI,SCOALA GIMNAZIALA NEGRILESTI,NEGRILEŞTI,Principală,
,662101807,661101038,371825,32599,32606,662101807,BISTRIŢA-NĂSĂUD,,,107,GRĂDINIȚA CU PROGRAM NORMAL NR.2 SÎNGEORZ-BĂI,GRADINITA CU PROGRAM NORMAL NR 2 SINGEORZ BAI,SÂNGEORZ-BĂI,Republicii,
,662101662,661100756,372453,33382,33408,662101662,BISTRIŢA-NĂSĂUD,,,77,GRĂDINIȚA CU PROGRAM NORMAL MIJLOCENII BÎRGĂULUI,GRADINITA CU PROGRAM NORMAL MIJLOCENII BIRGAULUI,MIJLOCENII BÂRGĂULUI,Principală,
,662102862,661101386,9907,34333,34342,662102862,BISTRIŢA-NĂSĂUD,,,208,GRĂDINIȚA CU PROGRAM NORMAL NR.3 RODNA,GRADINITA CU PROGRAM NORMAL NR 3 RODNA,RODNA,Măgurii,
,662103402,661103741,376576,35269,35296,662103402,BISTRIŢA-NĂSĂUD,,,148,ȘCOALA PRIMARĂ HĂȘMAȘU-CICEULUI,SCOALA PRIMARA HASMASU CICEULUI,HĂŞMAŞU CICEULUI,Principală,
,662102315,661101427,373976,32704,32722,662102315,BISTRIŢA-NĂSĂUD,,,198,GRĂDINIȚA CU PROGRAM NORMAL BUDUȘ,GRADINITA CU PROGRAM NORMAL BUDUS,BUDUŞ,Principală,
28180521,661101011,,374425,33202,33211,661101011,BISTRIŢA-NĂSĂUD,,,5,ȘCOALA GIMNAZIALĂ DUMITRA,SCOALA GIMNAZIALA DUMITRA,DUMITRA,Bisericii,
,662100322,661103628,375651,35429,35447,662100322,BISTRIŢA-NĂSĂUD,,,63,ȘCOALA PRIMARĂ ALUNIȘUL,SCOALA PRIMARA ALUNISUL,ALUNIŞUL,Principală,
27909801,661101106,,373938,32660,32688,661101106,BISTRIŢA-NĂSĂUD,,,17,ȘCOALA GIMNAZIALĂ CIREȘOAIA,SCOALA GIMNAZIALA CIRESOAIA,CIREŞOAIA,Principală,
,662102672,661100105,372958,33989,33998,662102672,BISTRIŢA-NĂSĂUD,,,5,GRĂDINIȚA CU PROGRAM NORMAL NIMIGEA DE JOS,GRADINITA CU PROGRAM NORMAL NIMIGEA DE JOS,NIMIGEA DE JOS,Principală,
,662103239,661100937,373378,34690,34707,662103239,BISTRIŢA-NĂSĂUD,,,255,GRĂDINIȚA CU PROGRAM NORMAL ȘIEU-MĂGHERUȘ,GRADINITA CU PROGRAM NORMAL SIEU MAGHERUS,ŞIEU-MĂGHERUŞ,Principală,
,662101689,661100756,374683,33382,33408,662101689,BISTRIŢA-NĂSĂUD,,,421,ȘCOALA PRIMARĂ MIJLOCENII BÎRGĂULUI,SCOALA PRIMARA MIJLOCENII BIRGAULUI,MIJLOCENII BÂRGĂULUI,Principală,
,662102889,661101386,990798,34333,34342,662102889,BISTRIŢA-NĂSĂUD,,,1307,GRĂDINIȚA CU PROGRAM NORMAL NR.2 RODNA,GRADINITA CU PROGRAM NORMAL NR 2 RODNA,RODNA,Crișan,
28944939,661100064,,375065,33845,33854,661100064,BISTRIŢA-NĂSĂUD,,,14-17,ȘCOALA GIMNAZIALĂ MICEȘTII DE CÎMPIE,SCOALA GIMNAZIALA MICESTII DE CIMPIE,MICEŞTII DE CÂMPIE,Principală,
,662103429,661103741,373782,35269,35278,662103429,BISTRIŢA-NĂSĂUD,,,316,GRĂDINIȚA CU PROGRAM NORMAL URIU,GRADINITA CU PROGRAM NORMAL URIU,URIU,Principală,
,662102333,661101427,387718,32704,32740,662102333,BISTRIŢA-NĂSĂUD,,,148,GRĂDINIȚA CU PROGRAM NORMAL MONARIU,GRADINITA CU PROGRAM NORMAL MONARIU,MONARIU,Principală,
,662100304,661100833,371605,32394,32401,662100304,BISTRIŢA-NĂSĂUD,,,4,GRĂDINIȚA CU PROGRAM NORMAL NR.9 BISTRIȚA,GRADINITA CU PROGRAM NORMAL NR 9 BISTRITA,BISTRIŢA,Crinilor,
4347828,661101133,,990956,32394,32401,661101133,BISTRIŢA-NĂSĂUD,,,18,LICEUL CU PROGRAM SPORTIV BISTRIȚA,LICEUL CU PROGRAM SPORTIV BISTRITA,BISTRIŢA,Calea Moldovei,
29870791,661101124,,981395,32394,32401,661101124,BISTRIŢA-NĂSĂUD,,,44A,GRĂDINIȚA CU PROGRAM PRELUNGIT NR.12 BISTRIȚA,GRADINITA CU PROGRAM PRELUNGIT NR 12 BISTRITA,BISTRIŢA,Mureşanu Andrei,
,662102654,661100105,375235,33989,34048,662102654,BISTRIŢA-NĂSĂUD,,,37,ȘCOALA PRIMARĂ MOGOȘENI,SCOALA PRIMARA MOGOSENI,MOGOŞENI,Principală,
24167937,661101386,,375364,34333,34342,661101386,BISTRIŢA-NĂSĂUD,,,1190,"""ȘCOALA GIMNAZIALĂ """"FLORIAN PORCIUS"""" RODNA""",SCOALA GIMNAZIALA FLORIAN PORCIUS RODNA,RODNA,Principală,
,662102437,661100792,376851,32394,32447,662102437,BISTRIŢA-NĂSĂUD,,,42,"""ȘCOALA PRIMARĂ """"DIMITRIE COJOCARU"""" SLĂTINIȚA""",SCOALA PRIMARA DIMITRIE COJOCARU SLATINITA,SLĂTINIŢA,Principală,
,662101843,661101038,371813,32599,32606,662101843,BISTRIŢA-NĂSĂUD,,,226,GRĂDINIȚA CU PROGRAM NORMAL NR.3 SÎNGEORZ-BĂI,GRADINITA CU PROGRAM NORMAL NR 3 SINGEORZ BAI,SÂNGEORZ-BĂI,Valea Borcutului,
,662100462,661100037,376382,35152,35170,662100462,BISTRIŢA-NĂSĂUD,,,43,ȘCOALA GIMNAZIALĂ AGRIEȘ,SCOALA GIMNAZIALA AGRIES,AGRIEŞ,Principală,
22766620,661101246,,1253719,32394,32401,661101246,BISTRIŢA-NĂSĂUD,,,8,"""ȘCOALA GIMNAZIALĂ """"LUCIAN BLAGA"""" BISTRIȚA""",SCOALA GIMNAZIALA LUCIAN BLAGA BISTRITA,BISTRIŢA,Garoafei,
28723610,661100046,,375637,34397,34404,661100046,BISTRIŢA-NĂSĂUD,,,1,"""ȘCOALA GIMNAZIALĂ """"TIBERIU MORARIU"""" SALVA""",SCOALA GIMNAZIALA TIBERIU MORARIU SALVA,SALVA,Principală,
,662102351,661103827,1119597,33364,33373,662102351,BISTRIŢA-NĂSĂUD,,,589A,GRĂDINIȚA CU PROGRAM NORMAL NR.1 ILVA MICĂ,GRADINITA CU PROGRAM NORMAL NR 1 ILVA MICA,ILVA MICA,Principală,
28474527,661103827,,374619,33364,33373,661103827,BISTRIŢA-NĂSĂUD,,,589,ȘCOALA GIMNAZIALĂ NR.1 ILVA MICĂ,SCOALA GIMNAZIALA NR 1 ILVA MICA,ILVA MICA,Principală,
,662100584,661101409,600276,34155,34164,662100584,BISTRIŢA-NĂSĂUD,,,627,GRĂDINIȚA CU PROGRAM NORMAL PARVA IZVOR II,GRADINITA CU PROGRAM NORMAL PARVA IZVOR II,PARVA,Principală,
,662101983,661100878,372477,33435,33444,662101983,BISTRIŢA-NĂSĂUD,,,382,GRĂDINIȚA CU PROGRAM NORMAL LECHINȚA,GRADINITA CU PROGRAM NORMAL LECHINTA,LECHINŢA,Independenței,
,662102636,661100105,375259,33989,34066,662102636,BISTRIŢA-NĂSĂUD,,,199,ȘCOALA PRIMARĂ TĂURE,SCOALA PRIMARA TAURE,TĂURE,Principală,
,662103587,661101436,376162,34985,35036,662103587,BISTRIŢA-NĂSĂUD,,,123,ȘCOALA GIMNAZIALĂ PINTICU,SCOALA GIMNAZIALA PINTICU,PINTICU,Principală,
28431577,661101504,,375845,34770,34789,661101504,BISTRIŢA-NĂSĂUD,,,183,ȘCOALA GIMNAZIALĂ ȘIEU-ODORHEI,SCOALA GIMNAZIALA SIEU ODORHEI,ŞIEU-ODORHEI,Principală,
4347305,661100901,,377104,32544,32553,661100901,BISTRIŢA-NĂSĂUD,,,2,"""COLEGIUL NAȚIONAL """"GEORGE COȘBUC"""" NĂSĂUD""",COLEGIUL NATIONAL GEORGE COSBUC NASAUD,NĂSĂUD,Grănicerilor,
18444707,641101521,,2073893,32394,32401,641101521,BISTRIŢA-NĂSĂUD,,,24,CENTRUL JUDEȚEAN DE RESURSE ȘI ASISTENȚĂ EDUCAȚIONALĂ BISTRIȚA-NĂSĂUD,CENTRUL JUDETEAN DE RESURSE SI ASISTENTA EDUCATIONALA BISTRITA NASAUD,BISTRIŢA,Independenţei,
