COD FISCAL,COD SIIIR,COD SIIIR SUP,COD SIRUES,SIRUTA LOC SUP,SIRUTA LOCALITATE,cod,judet,lat,lon,nr,nume,nume_ascii,oras,str,wikidata
,662102663,661100105,375223,33989,34002,662102663,BISTRIŢA-NĂSĂUD,,,27,ȘCOALA PRIMARĂ FLOREȘTI,SCOALA PRIMARA FLORESTI,FLOREŞTI,Principală,
,662102401,661103818,6371538,32394,32401,662102401,BISTRIŢA-NĂSĂUD,,,6,"""GRĂDINIȚA CU PROGRAM NORMAL """"CĂSUȚA CU POVEȘTI"""" BISTRIȚA""",GRADINITA CU PROGRAM NORMAL CASUTA CU POVESTI BISTRITA,BISTRIŢA,Subcetate,
,662103049,661100806,3154101,179686,32946,662103049,BISTRIŢA-NĂSĂUD,,,94,GRĂDINIȚA CU PROGRAM NORMAL RAGLA,GRADINITA CU PROGRAM NORMAL RAGLA,RAGLA,Principală,
14555281,661103664,,374932,33621,33630,661103664,BISTRIŢA-NĂSĂUD,,,201,"""LICEUL TEHNOLOGIC """"LIVIU REBREANU"""" MAIERU""",LICEUL TEHNOLOGIC LIVIU REBREANU MAIERU,MAIERU,Principală,
,662100263,661101377,374774,33514,33532,662100263,BISTRIŢA-NĂSĂUD,,,254A,ȘCOALA GIMNAZIALĂ NR.2 LUNCA LEȘULUI,SCOALA GIMNAZIALA NR 2 LUNCA LESULUI,LUNCA LEŞULUI,Principală,
28173125,661101255,,375912,34903,34912,661101255,BISTRIŢA-NĂSĂUD,,,209,ȘCOALA GIMNAZIALĂ ȘINTEREAG,SCOALA GIMNAZIALA SINTEREAG,ŞINTEREAG,Principală,
,662101698,661101124,382006,32394,32401,662101698,BISTRIŢA-NĂSĂUD,,,27,GRĂDINIȚA CU PROGRAM NORMAL NR.16 BISTRIȚA,GRADINITA CU PROGRAM NORMAL NR 16 BISTRITA,BISTRIŢA,Cerbului,
29871045,661100073,,371497,32394,32401,661100073,BISTRIŢA-NĂSĂUD,,,41,GRĂDINIȚA CU PROGRAM PRELUNGIT NR.3 BISTRIȚA,GRADINITA CU PROGRAM PRELUNGIT NR 3 BISTRITA,BISTRIŢA,Plăieşului,
,662103438,661103741,376588,35269,35303,662103438,BISTRIŢA-NĂSĂUD,,,37,ȘCOALA PRIMARĂ ILIȘUA,SCOALA PRIMARA ILISUA,ILIŞUA,Principală,
,662102342,661101083,376992,32599,32624,662102342,BISTRIŢA-NĂSĂUD,,,89,ȘCOALA PRIMARĂ VALEA BORCUTULUI,SCOALA PRIMARA VALEA BORCUTULUI,VALEA BORCUTULUI,Dupa Borcut,
,662100313,661103628,376710,35429,35474,662100313,BISTRIŢA-NĂSĂUD,,,74,ȘCOALA GIMNAZIALĂ SUPLAI,SCOALA GIMNAZIALA SUPLAI,SUPLAI,Principală,
,662101992,661100878,374750,33435,33480,662101992,BISTRIŢA-NĂSĂUD,,,95,ȘCOALA PRIMARĂ SÎNIACOB,SCOALA PRIMARA SINIACOB,SÂNIACOB,Principală,
,662102645,661100105,375211,33989,34020,662102645,BISTRIŢA-NĂSĂUD,,,56A,ȘCOALA GIMNAZIALĂ MITITEI,SCOALA GIMNAZIALA MITITEI,MITITEI,Principală,
,662101739,661101504,375869,34770,34832,662101739,BISTRIŢA-NĂSĂUD,,,126A,ȘCOALA PRIMARĂ CRISTUR-ȘIEU,SCOALA PRIMARA CRISTUR SIEU,CRISTUR-ŞIEU,Principală,
13726553,661100919,,376904,32544,32553,661100919,BISTRIŢA-NĂSĂUD,,,15,"""ȘCOALA GIMNAZIALĂ """"MIHAI EMINESCU"""" NĂSĂUD""",SCOALA GIMNAZIALA MIHAI EMINESCU NASAUD,NĂSĂUD,Gănicerilor,
,662102428,661101341,375132,33881,33943,662102428,BISTRIŢA-NĂSĂUD,,,117,ȘCOALA PRIMARĂ OROSFAIA,SCOALA PRIMARA OROSFAIA,OROSFAIA,PRINCIPALĂ,
13765102,661103646,,374059,32811,32820,661103646,BISTRIŢA-NĂSĂUD,,,241,"""LICEUL TEHNOLOGIC """"ION CĂIAN ROMÂNUL"""" CĂIANU MIC""",LICEUL TEHNOLOGIC ION CAIAN ROMANUL CAIANU MIC,CĂIANU MIC,Principală,
,662101852,661101038,371801,32599,32615,662101852,BISTRIŢA-NĂSĂUD,,,98,GRĂDINIȚA CU PROGRAM NORMAL NR.7 SÎNGEORZ-BĂI,GRADINITA CU PROGRAM NORMAL NR 7 SINGEORZ BAI,CORMAIA,Cormaia,
15128963,661101092,,371540,32544,32553,661101092,BISTRIŢA-NĂSĂUD,,,7,GRĂDINIȚA CU PROGRAM PRELUNGIT NR.1 NĂSĂUD,GRADINITA CU PROGRAM PRELUNGIT NR 1 NASAUD,NĂSĂUD,Grănicerilor,
,662100453,661100037,373756,35152,35161,662100453,BISTRIŢA-NĂSĂUD,,,220,GRĂDINIȚA CU PROGRAM NORMAL NR.1 TÎRLIȘUA,GRADINITA CU PROGRAM NORMAL NR 1 TIRLISUA,TÂRLIŞUA,Principală,
26927184,661101273,,375974,34477,34486,661101273,BISTRIŢA-NĂSĂUD,,,25,ȘCOALA GIMNAZIALĂ SÎNMIHAIU DE CÎMPIE,SCOALA GIMNAZIALA SINMIHAIU DE CIMPIE,SÂNMIHAIU DE CÂMPIE,Principală,
4427110,661100055,,377154,34235,34244,661100055,BISTRIŢA-NĂSĂUD,,,513,"""LICEUL """"RADU PETRESCU"""" PRUNDU BÎRGĂULUI""",LICEUL RADU PETRESCU PRUNDU BIRGAULUI,PRUNDU BÂRGĂULUI,Principală,
,662102369,661103827,125363,33364,33373,662102369,BISTRIŢA-NĂSĂUD,,,811,GRĂDINIȚA CU PROGRAM NORMAL DUPĂ SOMEȘ ILVA MICĂ,GRADINITA CU PROGRAM NORMAL DUPA SOMES ILVA MICA,ILVA MICA,După Someș,
,662103013,661100073,371588,32394,32401,662103013,BISTRIŢA-NĂSĂUD,,,35,GRĂDINIȚĂ CU PROGRAM NORMAL NR.7 BISTRIȚA,GRADINITA CU PROGRAM NORMAL NR 7 BISTRITA,BISTRIŢA,Roman Vivu Constantin,
,662100661,661101409,991390,34155,34164,662100661,BISTRIŢA-NĂSĂUD,,,599,ȘCOALA PRIMARĂ NR.2 IZVOR PARVA,SCOALA PRIMARA NR 2 IZVOR PARVA,PARVA,Principală,
,662102627,661100105,375247,33989,34057,662102627,BISTRIŢA-NĂSĂUD,,,179A,ȘCOALA PRIMARĂ NIMIGEA DE SUS,SCOALA PRIMARA NIMIGEA DE SUS,NIMIGEA DE SUS,Principală,
,662102993,661103601,371552,32483,32492,662102993,BISTRIŢA-NĂSĂUD,,,C12,"""GRĂDINIȚA CU PROGRAM PRELUNGIT """"ALBĂ CA ZĂPADA""""""",GRADINITA CU PROGRAM PRELUNGIT ALBA CA ZAPADA,BECLEAN,Aleea Zorilor,
,662103578,661101273,375998,34477,34538,662103578,BISTRIŢA-NĂSĂUD,,,99,ȘCOALA PRIMARĂ ZORENI,SCOALA PRIMARA ZORENI,ZORENI,Principală,
28054671,661101513,,373926,32660,32679,661101513,BISTRIŢA-NĂSĂUD,,,316,ȘCOALA GIMNAZIALĂ BRANIȘTEA,SCOALA GIMNAZIALA BRANISTEA,BRANIŞTEA,Bolog,
,662102197,661100055,373134,34235,34244,662102197,BISTRIŢA-NĂSĂUD,,,987,GRĂDINIȚA CU PROGRAM NORMAL PRUNDU BÎRGĂULUI,GRADINITA CU PROGRAM NORMAL PRUNDU BIRGAULUI,PRUNDU BÂRGĂULUI,Principală,
28193157,661100937,,375778,34690,34707,661100937,BISTRIŢA-NĂSĂUD,,,117,ȘCOALA GIMNAZIALĂ ȘIEU-MĂGHERUȘ,SCOALA GIMNAZIALA SIEU MAGHERUS,ŞIEU-MĂGHERUŞ,Principală,
,662102491,661101549,376667,35312,35367,662102491,BISTRIŢA-NĂSĂUD,,,43,ȘCOALA PRIMARĂ FÎNAȚE,SCOALA PRIMARA FINATE,FÂNAŢE,Principală,
13615199,661101074,,374451,33248,33257,661101074,BISTRIŢA-NĂSĂUD,,,939,LICEUL TEHNOLOGIC FELDRU,LICEUL TEHNOLOGIC FELDRU,FELDRU,Principală,
19227986,661100037,,376370,35152,35161,661100037,BISTRIŢA-NĂSĂUD,,,154,LICEUL TEHNOLOGIC TÎRLIȘUA,LICEUL TEHNOLOGIC TIRLISUA,TÂRLIŞUA,Principală,
,662102387,661103827,372427,33364,33373,662102387,BISTRIŢA-NĂSĂUD,,,72,GRĂDINIȚA CU PROGRAM NORMAL CFR ILVA MICĂ,GRADINITA CU PROGRAM NORMAL CFR ILVA MICA,ILVA MICA,Principală,
,662103388,661103741,376564,35269,35287,662103388,BISTRIŢA-NĂSĂUD,,,302,ȘCOALA GIMNAZIALĂ CRISTEȘTII CICEULUI,SCOALA GIMNAZIALA CRISTESTII CICEULUI,CRISTEŞTII CICEULUI,Principală,
,662103031,661100064,375089,33845,33872,662103031,BISTRIŢA-NĂSĂUD,,,74,ȘCOALA PRIMARĂ VISUIA,SCOALA PRIMARA VISUIA,VISUIA,Principală,
,662100607,661101409,991429,34155,34164,662100607,BISTRIŢA-NĂSĂUD,,,501,ȘCOALA PRIMARĂ CASE PARVA,SCOALA PRIMARA CASE PARVA,PARVA,Principală,
,662101956,661101092,371710,32544,32571,662101956,BISTRIŢA-NĂSĂUD,,,,GRĂDINIȚA CU PROGRAM NORMAL LUȘCA,GRADINITA CU PROGRAM NORMAL LUSCA,LUŞCA,Cartier Lușca,
28245884,661101359,,374841,33603,33612,661101359,BISTRIŢA-NĂSĂUD,,,238,ȘCOALA GIMNAZIALĂ NR.1 LUNCA ILVEI,SCOALA GIMNAZIALA NR 1 LUNCA ILVEI,LUNCA ILVEI,Grănicerilor,
,662102609,661100105,375209,33989,34011,662102609,BISTRIŢA-NĂSĂUD,,,56,ȘCOALA PRIMARĂ MINTIU,SCOALA PRIMARA MINTIU,MINTIU,Principală,
,662103551,661101228,375754,34850,34896,662103551,BISTRIŢA-NĂSĂUD,,,41,ȘCOALA GIMNAZIALĂ SEBIȘ,SCOALA GIMNAZIALA SEBIS,SEBIŞ,Principală,
,662101775,661100824,375302,34075,34119,662101775,BISTRIŢA-NĂSĂUD,,,163,ȘCOALA PRIMARĂ FELEAC,SCOALA PRIMARA FELEAC,FELEAC,Principală,
28356734,661100955,,375699,34645,34654,661100955,BISTRIŢA-NĂSĂUD,,,140A,ȘCOALA GIMNAZIALĂ ȘIEU,SCOALA GIMNAZIALA SIEU,ŞIEU,Principală,
29871509,661103795,,371502,32394,32401,661103795,BISTRIŢA-NĂSĂUD,,,12,"""GRĂDINIȚA CU PROGRAM PRELUNGIT """"RAZĂ DE SOARE"""" BISTRIȚA""",GRADINITA CU PROGRAM PRELUNGIT RAZA DE SOARE BISTRITA,BISTRIŢA,Bârgăului,
28402598,661101056,,375015,33765,33774,661101056,BISTRIŢA-NĂSĂUD,,,11,ȘCOALA GIMNAZIALĂ MĂRIȘELU,SCOALA GIMNAZIALA MARISELU,MĂRIŞELU,Principală,
,662100417,661101142,374138,32884,32928,662100417,BISTRIŢA-NĂSĂUD,,,29,ȘCOALA PRIMARĂ ORHEIU BISTRIȚEI,SCOALA PRIMARA ORHEIU BISTRITEI,ORHEIU BISTRIŢEI,Principală,
28195212,661103673,,374970,33658,33685,661103673,BISTRIŢA-NĂSĂUD,,,81,"""ȘCOALA GIMNAZIALĂ """"VASILE GRIGORE BORGOVAN"""" CORVINEȘTI""",SCOALA GIMNAZIALA VASILE GRIGORE BORGOVAN CORVINESTI,CORVINEŞTI,Principală,
4347780,661101237,,792110,32394,32401,661101237,BISTRIŢA-NĂSĂUD,,,1,LICEUL TEHNOLOGIC FORESTIER BISTRIȚA,LICEUL TEHNOLOGIC FORESTIER BISTRITA,BISTRIŢA,Zefirului,
,662102012,661101246,376825,32394,32438,662102012,BISTRIŢA-NĂSĂUD,,,111,ȘCOALA PRIMARĂ SIGMIR,SCOALA PRIMARA SIGMIR,SIGMIR,Cartier Sigmir,
,662103058,661101472,1253599,35090,35143,662103058,BISTRIŢA-NĂSĂUD,,,119,GRĂDINIȚA CU PROGRAM NORMAL NR.2 TUREAC (VALEA BICII),GRADINITA CU PROGRAM NORMAL NR 2 TUREAC (VALEA BICII),TUREAC,Principală,
,662100625,661101409,1193828,34155,34164,662100625,BISTRIŢA-NĂSĂUD,,,670,GRĂDINIȚA CU PROGRAM NORMAL NR.3 PARVA IZVOR I,GRADINITA CU PROGRAM NORMAL NR 3 PARVA IZVOR I,PARVA,Principală,
