COD FISCAL,COD SIIIR,COD SIIIR SUP,COD SIRUES,SIRUTA LOC SUP,SIRUTA LOCALITATE,cod,judet,lat,lon,nr,nume,nume_ascii,oras,str,wikidata
21453934,661101083,,376978,32599,32606,661101083,BISTRIŢA-NĂSĂUD,,,38,"""ȘCOALA GIMNAZIALĂ """"ARTEMIU PUBLIU ALEXI"""" SÎNGEORZ-BĂI""",SCOALA GIMNAZIALA ARTEMIU PUBLIU ALEXI SINGEORZ BAI,SÂNGEORZ-BĂI,Republicii,
,662100444,661100037,376435,35152,35232,662100444,BISTRIŢA-NĂSĂUD,,,5,ȘCOALA PRIMARĂ OARZINA,SCOALA PRIMARA OARZINA,OARZINA,Principală,
4347640,661101264,,377099,32394,32401,661101264,BISTRIŢA-NĂSĂUD,,,26,"""COLEGIUL NAȚIONAL """"ANDREI MUREȘANU"""" BISTRIȚA""",COLEGIUL NATIONAL ANDREI MURESANU BISTRITA,BISTRIŢA,Republicii,
28222279,661100028,,375675,34618,34627,661100028,BISTRIŢA-NĂSĂUD,,,878,"""ȘCOALA GIMNAZIALĂ """"ENEA GRAPINI"""" ȘANȚ""",SCOALA GIMNAZIALA ENEA GRAPINI SANT,ŞANŢ,Principală,
,662102378,661103827,374621,33364,33373,662102378,BISTRIŢA-NĂSĂUD,,,843,ȘCOALA GIMNAZIALĂ NR.2 ILVA MICĂ,SCOALA GIMNAZIALA NR 2 ILVA MICA,ILVA MICA,Principală,
,662103397,661103741,373794,35269,35287,662103397,BISTRIŢA-NĂSĂUD,,,11,GRĂDINIȚA CU PROGRAM NORMAL CRISTEȘTII CICEULUI,GRADINITA CU PROGRAM NORMAL CRISTESTII CICEULUI,CRISTEŞTII CICEULUI,Principală,
27895463,661103596,,374243,33015,33024,661103596,BISTRIŢA-NĂSĂUD,,,20,"""ȘCOALA GIMNAZIALĂ """"IULIU PRODAN"""" CHIOCHIȘ""",SCOALA GIMNAZIALA IULIU PRODAN CHIOCHIS,CHIOCHIŞ,Principală,
,662103022,661100064,375077,33845,33863,662103022,BISTRIŢA-NĂSĂUD,,,9,ȘCOALA PRIMARĂ FÎNTÎNIȚA,SCOALA PRIMARA FINTINITA,FÂNTÂNIŢA,Principală,
26985231,661101002,,375388,34173,34182,661101002,BISTRIŢA-NĂSĂUD,,,138,"""ȘCOALA GIMNAZIALĂ """"ION POP RETEGANUL"""" RETEAG""",SCOALA GIMNAZIALA ION POP RETEGANUL RETEAG,RETEAG,Gării,
,662100616,661101409,990683,34155,34164,662100616,BISTRIŢA-NĂSĂUD,,,300,GRĂDINIȚA CU PROGRAM NORMAL NR.2 PARVA DÎMBURI,GRADINITA CU PROGRAM NORMAL NR 2 PARVA DIMBURI,PARVA,Principală,
,662102966,661103601,377051,32483,32517,662102966,BISTRIŢA-NĂSĂUD,,,131,ȘCOALA PRIMARĂ FIGA,SCOALA PRIMARA FIGA,FIGA,Figa,
,662103569,661101273,376007,34477,34529,662103569,BISTRIŢA-NĂSĂUD,,,12,ȘCOALA PRIMARĂ STUPINI,SCOALA PRIMARA STUPINI,STUPINI,Principală,
28180548,661100928,,374578,33337,33346,661100928,BISTRIŢA-NĂSĂUD,,,358,ȘCOALA GIMNAZIALĂ ILVA MARE,SCOALA GIMNAZIALA ILVA MARE,ILVA MARE,Principală,
,662100679,661101409,1259282,34155,34164,662100679,BISTRIŢA-NĂSĂUD,,,514,GRĂDINIȚA CU PROGRAM NORMAL NR.6 PARVA LUNCI II,GRADINITA CU PROGRAM NORMAL NR 6 PARVA LUNCI II,PARVA,Principală,
33417609,661101065,,375613,34360,34379,661101065,BISTRIŢA-NĂSĂUD,,,88,ȘCOALA GIMNAZIALĂ ROMULI,SCOALA GIMNAZIALA ROMULI,ROMULI,Principală,
,662100426,661101142,372013,32884,32937,662100426,BISTRIŢA-NĂSĂUD,,,163,GRĂDINIȚA CU PROGRAM NORMAL PETRIȘ,GRADINITA CU PROGRAM NORMAL PETRIS,PETRIŞ,Principală,
,662102396,661103827,1253628,33364,33373,662102396,BISTRIŢA-NĂSĂUD,,,825,GRĂDINIȚA CU PROGRAM NORMAL CONSILIU ILVA MICĂ,GRADINITA CU PROGRAM NORMAL CONSILIU ILVA MICA,ILVA MICA,Principală,
,662101947,661101092,,32544,32553,662101947,BISTRIŢA-NĂSĂUD,,,,GRĂDINIȚA CU PROGRAM NORMAL NR.2 NĂSĂUD,GRADINITA CU PROGRAM NORMAL NR 2 NASAUD,NĂSĂUD,Lalelelor Bloc ANL,
,662102948,661103601,377049,32483,32508,662102948,BISTRIŢA-NĂSĂUD,,,145,ȘCOALA PRIMARĂ COLDĂU,SCOALA PRIMARA COLDAU,COLDĂU,Principală,
,662101766,661100824,375273,34075,34093,662101766,BISTRIŢA-NĂSĂUD,,,23,ȘCOALA PRIMARĂ BEUDIU,SCOALA PRIMARA BEUDIU,BEUDIU,Principală,
28312487,661101549,,376590,35312,35321,661101549,BISTRIŢA-NĂSĂUD,,,206,ȘCOALA GIMNAZIALĂ URMENIȘ,SCOALA GIMNAZIALA URMENIS,URMENIŞ,Principală,
29885342,661100946,,981412,32394,32401,661100946,BISTRIŢA-NĂSĂUD,,,3,"""GRĂDINIȚA CU PROGRAM PRELUNGIT """"TRENULEȚUL VESELIEI"""" BISTRIȚA""",GRADINITA CU PROGRAM PRELUNGIT TRENULETUL VESELIEI BISTRITA,BISTRIŢA,Rodnei,
,662103542,661101228,375766,34850,34887,662103542,BISTRIŢA-NĂSĂUD,,,136,ȘCOALA PRIMARĂ RUȘTIOR,SCOALA PRIMARA RUSTIOR,RUŞTIOR,Principală,
,662100159,661101282,372740,33621,33649,662100159,BISTRIŢA-NĂSĂUD,,,60,GRĂDINIȚA CU PROGRAM NORMAL ANIEȘ,GRADINITA CU PROGRAM NORMAL ANIES,ANIEŞ,Principală,
,662100408,661101142,374126,32884,32893,662100408,BISTRIŢA-NĂSĂUD,,,170,ȘCOALA PRIMARĂ SATU-NOU,SCOALA PRIMARA SATU NOU,SATU NOU,Principală,
28156418,661101047,,375390,179953,34217,661101047,BISTRIŢA-NĂSĂUD,,,131,"""ȘCOALA GIMNAZIALĂ """"PETRU RAREȘ"""" CICEU-MIHĂIEȘTI""",SCOALA GIMNAZIALA PETRU RARES CICEU MIHAIESTI,CICEU-MIHĂIEŞTI,Principală,
22366798,661100792,,1119755,32394,32401,661100792,BISTRIŢA-NĂSĂUD,,,3-5,ȘCOALA GIMNAZIALĂ NR.4 BISTRIȚA,SCOALA GIMNAZIALA NR 4 BISTRITA,BISTRIŢA,Florilor,
,662101576,661101305,374566,33275,33328,662101576,BISTRIŢA-NĂSĂUD,,,,ȘCOALA PRIMARĂ TONCIU,SCOALA PRIMARA TONCIU,TONCIU,Principală,
28977138,661101228,,375730,34850,34869,661101228,BISTRIŢA-NĂSĂUD,,,181,ȘCOALA GIMNAZIALĂ ȘIEUȚ,SCOALA GIMNAZIALA SIEUT,ŞIEUŢ,Curții,
,662102003,661100878,374736,33435,33499,662102003,BISTRIŢA-NĂSĂUD,,,37,ȘCOALA PRIMARĂ ȚIGĂU,SCOALA PRIMARA TIGAU,ŢIGĂU,Principală,
,662103067,661101472,376241,35090,35143,662103067,BISTRIŢA-NĂSĂUD,,,328B,GRĂDINIȚA CU PROGRAM NORMAL NR.1 TUREAC (BOZGANI),GRADINITA CU PROGRAM NORMAL NR 1 TUREAC (BOZGANI),TUREAC,Principală,
,662102188,661100055,375455,34235,34253,662102188,BISTRIŢA-NĂSĂUD,,,145,ȘCOALA PRIMARĂ SUSENII BÎRGĂULUI,SCOALA PRIMARA SUSENII BIRGAULUI,SUSENII BÂRGĂULUI,Principală,
,662101965,661100878,1190395,33435,33444,662101965,BISTRIŢA-NĂSĂUD,,,222,GRĂDINIȚA CU PROGRAM PRELUNGIT LECHINȚA,GRADINITA CU PROGRAM PRELUNGIT LECHINTA,LECHINŢA,Poștei,
,662102921,661101011,374449,33202,33239,662102921,BISTRIŢA-NĂSĂUD,,,270,ȘCOALA GIMNAZIALĂ TĂRPIU,SCOALA GIMNAZIALA TARPIU,TĂRPIU,Principală,
,662100218,661101558,374906,33729,33747,662100218,BISTRIŢA-NĂSĂUD,,,79A,ȘCOALA PRIMARĂ ARȘIȚA,SCOALA PRIMARA ARSITA,ARŞIŢA,Principală,
,662101748,661101504,373445,34770,34832,662101748,BISTRIŢA-NĂSĂUD,,,16,GRĂDINIȚA CU PROGRAM NORMAL CRISTUR-ȘIEU,GRADINITA CU PROGRAM NORMAL CRISTUR SIEU,CRISTUR-ŞIEU,Principală,
,662103293,661100937,373419,34690,34734,662103293,BISTRIŢA-NĂSĂUD,,,155,GRĂDINIȚA CU PROGRAM NORMAL CRAINIMĂT,GRADINITA CU PROGRAM NORMAL CRAINIMAT,CRAINIMĂT,Principală,
,662100177,661101359,374865,33603,33612,662100177,BISTRIŢA-NĂSĂUD,,,37,ȘCOALA PRIMARĂ NR.3 LUNCA ILVEI,SCOALA PRIMARA NR 3 LUNCA ILVEI,LUNCA ILVEI,Muncelului,
28189415,661101029,,374152,179686,32900,661101029,BISTRIŢA-NĂSĂUD,,,64,ȘCOALA GIMNAZIALĂ BUDACU DE SUS,SCOALA GIMNAZIALA BUDACU DE SUS,BUDACU DE SUS,Principală,
4548856,661100774,,1190412,32483,32492,661100774,BISTRIŢA-NĂSĂUD,,,5,CENTRUL ȘCOLAR DE EDUCAȚIE INCLUZIVĂ BECLEAN,CENTRUL SCOLAR DE EDUCATIE INCLUZIVA BECLEAN,BECLEAN,Grigore Silași,
,662103881,661101201,374360,33122,33159,662103881,BISTRIŢA-NĂSĂUD,,,142A,GRĂDINIȚA CU PROGRAM NORMAL PIATRA,GRADINITA CU PROGRAM NORMAL PIATRA,PIATRA,Principală,
,662101902,661100738,374035,32768,32802,662101902,BISTRIŢA-NĂSĂUD,,,103 A,ȘCOALA PRIMARĂ ȚĂGȘORU,SCOALA PRIMARA TAGSORU,ŢĂGŞORU,Principală,
,662102903,661101386,373213,34333,34342,662102903,BISTRIŢA-NĂSĂUD,,,886,ȘCOALA PRIMARĂ VALEA-POIENII RODNA,SCOALA PRIMARA VALEA POIENII RODNA,RODNA,Grănicerilor,
,662100236,661100729,374724,33435,33471,662100236,BISTRIŢA-NĂSĂUD,,,150,ȘCOALA GIMNAZIALĂ SÎNGEORZU NOU,SCOALA GIMNAZIALA SINGEORZU NOU,SÂNGEORZU NOU,Principală,
28284956,661100982,,373885,32633,32642,661100982,BISTRIŢA-NĂSĂUD,,,1327,ȘCOALA GIMNAZIALĂ NR.1 BISTRIȚA BÎRGĂULUI,SCOALA GIMNAZIALA NR 1 BISTRITA BIRGAULUI,BISTRIŢA BÂRGĂULUI,Principală,
,662103506,661101463,374401,35054,33195,662103506,BISTRIŢA-NĂSĂUD,,,117A,ȘCOALA GIMNAZIALĂ BICHIGIU,SCOALA GIMNAZIALA BICHIGIU,BICHIGIU,Principală,
,662102274,661103646,374061,32811,32839,662102274,BISTRIŢA-NĂSĂUD,,,253,ȘCOALA PRIMARĂ CĂIANU MARE,SCOALA PRIMARA CAIANU MARE,CĂIANU MARE,Principală,
31699732,661200962,,62071314,33248,33257,661200962,BISTRIŢA-NĂSĂUD,,,939,"""LICEUL TEORETIC """"HENRI COANDĂ"""" FELDRU""",LICEUL TEORETIC HENRI COANDA FELDRU,FELDRU,Principală,
28216196,661100756,,374657,33382,33391,661100756,BISTRIŢA-NĂSĂUD,,,155,ȘCOALA GIMNAZIALĂ JOSENII BÎRGĂULUI,SCOALA GIMNAZIALA JOSENII BIRGAULUI,JOSENII BÂRGĂULUI,Bisericii,
,662103316,661101436,376174,34985,35045,662103316,BISTRIŢA-NĂSĂUD,,,67,ȘCOALA GIMNAZIALĂ VIILE TECII,SCOALA GIMNAZIALA VIILE TECII,VIILE TECII,Principală,
,662101784,661100824,375285,34075,34128,662101784,BISTRIŢA-NĂSĂUD,,,133,GRĂDINIȚA CU PROGRAM NORMAL MALIN,GRADINITA CU PROGRAM NORMAL MALIN,MALIN,Principală,
,662101929,661101056,375039,33765,33792,662101929,BISTRIŢA-NĂSĂUD,,,162,ȘCOALA PRIMARĂ DOMNEȘTI,SCOALA PRIMARA DOMNESTI,DOMNEŞTI,Principală,
,662100254,661100896,375663,179944,34413,662100254,BISTRIŢA-NĂSĂUD,,,118,ȘCOALA PRIMARĂ VORIȘTI,SCOALA PRIMARA VORISTI,RUNCU SALVEI,Suseni,
,662102785,661103596,374281,33015,33033,662102785,BISTRIŢA-NĂSĂUD,,,47,ȘCOALA PRIMARĂ APATIU,SCOALA PRIMARA APATIU,APATIU,Principală,
,662102523,661100991,372764,33658,33667,662102523,BISTRIŢA-NĂSĂUD,,,89,GRĂDINIȚA CU PROGRAM NORMAL MATEI,GRADINITA CU PROGRAM NORMAL MATEI,MATEI,Principală,
,662102256,661100973,371617,32394,32401,662102256,BISTRIŢA-NĂSĂUD,,,57,GRĂDINIȚA CU PROGRAM NORMAL NR.10 BISTRIȚA,GRADINITA CU PROGRAM NORMAL NR 10 BISTRITA,BISTRIŢA,Independenţei,
28320862,651101458,,376954,32544,32553,651101458,BISTRIŢA-NĂSĂUD,,,9,CLUBUL COPIILOR NĂSĂUD,CLUBUL COPIILOR NASAUD,NĂSĂUD,Grănicerilor,
22379224,661103705,,376796,32394,32401,661103705,BISTRIŢA-NĂSĂUD,,,27-29,"""ȘCOALA GIMNAZIALĂ """"AVRAM IANCU"""" BISTRIȚA""",SCOALA GIMNAZIALA AVRAM IANCU BISTRITA,BISTRIŢA,01.dec,
28121274,661101282,,374944,33621,33649,661101282,BISTRIŢA-NĂSĂUD,,,60,"""ȘCOALA GIMNAZIALĂ """"IUSTIN ILIEȘIU"""" ANIEȘ""",SCOALA GIMNAZIALA IUSTIN ILIESIU ANIES,ANIEŞ,Principală,
28494354,661100738,,374009,32768,32777,661100738,BISTRIŢA-NĂSĂUD,,,252,ȘCOALA GIMNAZIALĂ BUDEȘTI,SCOALA GIMNAZIALA BUDESTI,BUDEŞTI,Principală,
29418363,661100887,,374396,33177,33186,661100887,BISTRIŢA-NĂSĂUD,,,243,"""ȘCOALA GIMNAZIALĂ """"GEORGE COȘBUC"""" COȘBUC""",SCOALA GIMNAZIALA GEORGE COSBUC COSBUC,COŞBUC,Principală,
28255306,661101427,,373952,32704,32713,661101427,BISTRIŢA-NĂSĂUD,,,27,ȘCOALA GIMNAZIALĂ BUDACU DE JOS,SCOALA GIMNAZIALA BUDACU DE JOS,BUDACU DE JOS,Principală,
,662102066,661101255,373500,34903,34967,662102066,BISTRIŢA-NĂSĂUD,,,121,GRĂDINIȚA CU PROGRAM NORMAL ȘIEU-SFÎNTU,GRADINITA CU PROGRAM NORMAL SIEU SFINTU,ŞIEU-SFÂNTU,Principală,
4512216,661100082,,792378,32544,32553,661100082,BISTRIŢA-NĂSĂUD,,,1,"""COLEGIUL SILVIC """"TRANSILVANIA"""" NĂSĂUD""",COLEGIUL SILVIC TRANSILVANIA NASAUD,NĂSĂUD,Gării,
,662103334,661101436,990865,34985,34994,662103334,BISTRIŢA-NĂSĂUD,,,580,GRĂDINIȚA CU PROGRAM PRELUNGIT TEACA,GRADINITA CU PROGRAM PRELUNGIT TEACA,TEACA,Viilor,
,662100272,661101377,372532,33514,33523,662100272,BISTRIŢA-NĂSĂUD,,,83,GRĂDINIȚA CU PROGRAM NORMAL NR.1 LEȘU (SAT),GRADINITA CU PROGRAM NORMAL NR 1 LESU (SAT),LEŞU,Principală,
31699724,661203766,,62071326,33248,33257,661203766,BISTRIŢA-NĂSĂUD,,,939,"""ȘCOALA POSTLICEALĂ """"HENRI COANDĂ"""" FELDRU""",SCOALA POSTLICEALA HENRI COANDA FELDRU,FELDRU,Principală,
,662102505,661100991,374982,33658,33701,662102505,BISTRIŢA-NĂSĂUD,,,85,ȘCOALA PRIMARĂ FÎNTÎNELE,SCOALA PRIMARA FINTINELE,FÂNTÂNELE,Școlii,
,662103108,661101332,373665,35090,35107,662103108,BISTRIŢA-NĂSĂUD,,,404B,GRĂDINITA CU PROGRAM NORMAL NR.1 TIHA BÎRGĂULUI,GRADINITA CU PROGRAM NORMAL NR 1 TIHA BIRGAULUI,TIHA BÂRGĂULUI,Principală,
28172740,661103723,,376083,34547,34556,661103723,BISTRIŢA-NĂSĂUD,,,272,ȘCOALA GIMNAZIALĂ SPERMEZEU,SCOALA GIMNAZIALA SPERMEZEU,SPERMEZEU,Principală,
,662100489,661100037,376394,35152,35198,662100489,BISTRIŢA-NĂSĂUD,,,68,ȘCOALA PRIMARĂ BORLEASA,SCOALA PRIMARA BORLEASA,BORLEASA,Principală,
27035990,661100711,,375493,34280,34299,661100711,BISTRIŢA-NĂSĂUD,,,828,"""ȘCOALA GIMNAZIALĂ """"IACOB SI IOACHIM MUREȘANU"""" REBRIȘOARA""",SCOALA GIMNAZIALA IACOB SI IOACHIM MURESANU REBRISOARA,REBRIŞOARA,Principală,
29873429,661100869,,371526,32394,32401,661100869,BISTRIŢA-NĂSĂUD,,,11B,GRĂDINIȚA CU PROGRAM PRELUNGIT NR.6 BISTRIȚA,GRADINITA CU PROGRAM PRELUNGIT NR 6 BISTRITA,BISTRIŢA,Aleea Șieului,
28180580,661101409,,991376,34155,34164,661101409,BISTRIŢA-NĂSĂUD,,,194,"""ȘCOALA GIMNAZIALĂ """"VASILE SCURTU"""" PARVA""",SCOALA GIMNAZIALA VASILE SCURTU PARVA,PARVA,Principală,
,662103352,661101436,376148,34985,35009,662103352,BISTRIŢA-NĂSĂUD,,,58,ȘCOALA PRIMARĂ ARCHIUD,SCOALA PRIMARA ARCHIUD,ARCHIUD,Principală,
,662102455,661100028,373263,34618,34627,662102455,BISTRIŢA-NĂSĂUD,,,92,GRĂDINIȚA CU PROGRAM NORMAL NR.1 ȘANȚ,GRADINITA CU PROGRAM NORMAL NR 1 SANT,ŞANŢ,Principală,
,662103212,661100711,,34280,34299,662103212,BISTRIŢA-NĂSĂUD,,,352,ȘCOALA PRIMARĂ PODUL REBREI,SCOALA PRIMARA PODUL REBREI,REBRIŞOARA,Podul Rebrei,
,662102749,661101002,991431,34173,34182,662102749,BISTRIŢA-NĂSĂUD,,,601,ȘCOALA PRIMARĂ RETEAG-POIENI,SCOALA PRIMARA RETEAG POIENI,RETEAG,Principală,
,662102292,661103664,372702,33621,33630,662102292,BISTRIŢA-NĂSĂUD,,,876,GRĂDINIȚA CU PROGRAM NORMAL NR.3 MAIERU,GRADINITA CU PROGRAM NORMAL NR 3 MAIERU,MAIERU,Principală,
,662102568,661100982,373897,32633,32642,662102568,BISTRIŢA-NĂSĂUD,,,414,ȘCOALA GIMNAZIALĂ NR.2 BISTRIȚA BÎRGĂULUI,SCOALA GIMNAZIALA NR 2 BISTRITA BIRGAULUI,BISTRIŢA BÂRGĂULUI,Pietroasa,
,662103162,661100711,373160,34280,34299,662103162,BISTRIŢA-NĂSĂUD,,,556,GRĂDINIȚA CU PROGRAM NORMAL NR.1 REBRIȘOARA,GRADINITA CU PROGRAM NORMAL NR 1 REBRISOARA,REBRIŞOARA,Principală,
29185284,661103741,,376552,35269,35278,661103741,BISTRIŢA-NĂSĂUD,,,262,ȘCOALA GIMNAZIALĂ URIU,SCOALA GIMNAZIALA URIU,URIU,Principală,
,662103275,661100937,375807,34690,34734,662103275,BISTRIŢA-NĂSĂUD,,,166,ȘCOALA PRIMARĂ CRAINIMĂT,SCOALA PRIMARA CRAINIMAT,CRAINIMĂT,Principală,
28195913,661100842,,374891,179720,33756,661100842,BISTRIŢA-NĂSĂUD,,,412,"""ȘCOALA GIMNAZIALĂ """"SEVER POP"""" POIANA ILVEI""",SCOALA GIMNAZIALA SEVER POP POIANA ILVEI,POIANA ILVEI,Principală,
21116130,661101463,,376291,35054,35063,661101463,BISTRIŢA-NĂSĂUD,,,204B,LICEUL TEHNOLOGIC TELCIU,LICEUL TEHNOLOGIC TELCIU,TELCIU,Principală,
,662102179,661100055,373146,34235,34253,662102179,BISTRIŢA-NĂSĂUD,,,145,GRĂDINIȚA CU PROGRAM PRELUNGIT SUSENII BÎRGĂULUI,GRADINITA CU PROGRAM PRELUNGIT SUSENII BIRGAULUI,SUSENII BÂRGĂULUI,Principală,
4347330,661103637,,377166,32599,32606,661103637,BISTRIŢA-NĂSĂUD,,,40,"""LICEUL TEORETIC """"SOLOMON HALIȚĂ"""" SÎNGEORZ-BĂI""",LICEUL TEORETIC SOLOMON HALITA SINGEORZ BAI,SÂNGEORZ-BĂI,Republicii,
4426859,661103682,,1224354,32394,32401,661103682,BISTRIŢA-NĂSĂUD,,,23,"""COLEGIUL TEHNIC """"GRIGORE MOISIL"""" BISTRIȚA""",COLEGIUL TEHNIC GRIGORE MOISIL BISTRITA,BISTRIŢA,Rodnei,
,662101897,661100738,374011,32768,32786,662101897,BISTRIŢA-NĂSĂUD,,,37,ȘCOALA PRIMARĂ BUDEȘTI-FÎNAȚE,SCOALA PRIMARA BUDESTI FINATE,BUDEŞTI-FÂNAŢE,Principală,
,662102767,661101083,376980,32599,32615,662102767,BISTRIŢA-NĂSĂUD,,,131,ȘCOALA GIMNAZIALĂ CORMAIA,SCOALA GIMNAZIALA CORMAIA,CORMAIA,Principală,
29457486,661100105,,375182,33989,33998,661100105,BISTRIŢA-NĂSĂUD,,,450,ȘCOALA GIMNAZIALĂ NIMIGEA DE JOS,SCOALA GIMNAZIALA NIMIGEA DE JOS,NIMIGEA DE JOS,Principală,
,662103492,661101463,376306,35054,35081,662103492,BISTRIŢA-NĂSĂUD,,,185A,ȘCOALA GIMNAZIALĂ TELCIȘOR,SCOALA GIMNAZIALA TELCISOR,TELCIŞOR,Valea Poienii,
,662102541,661101169,371631,32394,32401,662102541,BISTRIŢA-NĂSĂUD,,,,GRĂDINIȚA CU PROGRAM NORMAL VIIȘOARA,GRADINITA CU PROGRAM NORMAL VIISOARA,BISTRIŢA,Cartie Viișoara,
,662102817,661103596,374279,33015,33042,662102817,BISTRIŢA-NĂSĂUD,,,36,ȘCOALA GIMNAZIALĂ BOZIEȘ,SCOALA GIMNAZIALA BOZIES,BOZIEŞ,Principală,
,662103144,661101332,1254880,35090,35107,662103144,BISTRIŢA-NĂSĂUD,,,289,GRĂDINIȚA CU PROGRAM NORMAL NR.2 TIHA BÎRGĂULUI,GRADINITA CU PROGRAM NORMAL NR 2 TIHA BIRGAULUI,TIHA BÂRGĂULUI,Principală,
,662102618,661100105,375194,33989,34039,662102618,BISTRIŢA-NĂSĂUD,,,106,GRĂDINIȚA CU PROGRAM NORMAL MOCOD,GRADINITA CU PROGRAM NORMAL MOCOD,MOCOD,Principală,
29017310,661100824,,375261,34075,34084,661100824,BISTRIŢA-NĂSĂUD,,,18,ȘCOALA GIMNAZIALĂ NUȘENI,SCOALA GIMNAZIALA NUSENI,NUŞENI,Principală,
,662100557,661103723,3009760,34547,34565,662100557,BISTRIŢA-NĂSĂUD,,,87,ȘCOALA PRIMARĂ HĂLMĂSĂU,SCOALA PRIMARA HALMASAU,HĂLMĂSĂU,Principală,
28278873,661101332,,376215,35090,35107,661101332,BISTRIŢA-NĂSĂUD,,,446B,ȘCOALA GIMNAZIALĂ TIHA BÎRGĂULUI,SCOALA GIMNAZIALA TIHA BIRGAULUI,TIHA BÂRGĂULUI,Principală,
26084960,661201393,,62164989,32483,32492,661201393,BISTRIŢA-NĂSĂUD,,,8,"""ȘCOALA POSTLICEALĂ """"HENRI COANDĂ"""" BECLEAN""",SCOALA POSTLICEALA HENRI COANDA BECLEAN,BECLEAN,Petru Maior,
,662102152,661101074,1190278,33248,33257,662102152,BISTRIŢA-NĂSĂUD,,,4,GRĂDINIȚA CU PROGRAM NORMAL NR.8 FELDRU,GRADINITA CU PROGRAM NORMAL NR 8 FELDRU,FELDRU,Principală,
,662100512,661101029,372025,179686,32900,662100512,BISTRIŢA-NĂSĂUD,,,43,GRĂDINIȚA CU PROGRAM NORMAL NR.2 BUDACU DE SUS,GRADINITA CU PROGRAM NORMAL NR 2 BUDACU DE SUS,BUDACU DE SUS,Principală,
29100253,661100123,,375467,34262,34271,661100123,BISTRIŢA-NĂSĂUD,,,413,ȘCOALA GIMNAZIALĂ NR.1 REBRA,SCOALA GIMNAZIALA NR 1 REBRA,REBRA,Principală,
,662102704,661101187,374839,33541,33587,662102704,BISTRIŢA-NĂSĂUD,,,7,ȘCOALA PRIMARĂ DUMBRAVA,SCOALA PRIMARA DUMBRAVA,DUMBRAVA,Principală,
,662101617,661101305,374530,33275,33300,662101617,BISTRIŢA-NĂSĂUD,,,,ȘCOALA GIMNAZIALĂ DIPȘA,SCOALA GIMNAZIALA DIPSA,DIPŞA,Principală,
,662102835,661103596,374346,33015,33079,662102835,BISTRIŢA-NĂSĂUD,,,120,ȘCOALA PRIMARĂ JIMBOR-FÎNAȚE,SCOALA PRIMARA JIMBOR FINATE,JIMBOR,Principală,
,662100394,661100928,374607,33337,33346,662100394,BISTRIŢA-NĂSĂUD,,,280,ȘCOALA PRIMARĂ ILVA MARE POIANA CĂTUNENILOR,SCOALA PRIMARA ILVA MARE POIANA CATUNENILOR,ILVA MARE,Principală,
28203285,661100806,,374140,179686,32919,661100806,BISTRIŢA-NĂSĂUD,,,150,ȘCOALA GIMNAZIALĂ DUMITRIȚA,SCOALA GIMNAZIALA DUMITRITA,DUMITRIŢA,Principală,
,662100575,661100123,373158,34262,34271,662100575,BISTRIŢA-NĂSĂUD,,,238,GRĂDINIȚA CU PROGRAM NORMAL NR.1 REBRA,GRADINITA CU PROGRAM NORMAL NR 1 REBRA,REBRA,Principală,
29261209,661101314,,375297,34075,34146,661101314,BISTRIŢA-NĂSĂUD,,,213,"""ȘCOALA GIMNAZIALĂ """"DSIDA JENO"""" VIȚA""",SCOALA GIMNAZIALA DSIDA JENO VITA,VIŢA,Principală,
,662103845,661103795,371629,32394,32456,662103845,BISTRIŢA-NĂSĂUD,,,267,GRĂDINIȚA CU PROGRAM NORMAL UNIREA,GRADINITA CU PROGRAM NORMAL UNIREA,UNIREA,Cartier Unirea,
,662103266,661100937,375821,34690,34752,662103266,BISTRIŢA-NĂSĂUD,,,27,GRĂDINIȚA CU PROGRAM NORMAL SĂRĂȚEL,GRADINITA CU PROGRAM NORMAL SARATEL,SĂRĂŢEL,Principală,
,662100186,661101359,374877,33603,33612,662100186,BISTRIŢA-NĂSĂUD,,,26,ȘCOALA PRIMARĂ NR.4 LUNCA ILVEI,SCOALA PRIMARA NR 4 LUNCA ILVEI,LUNCA ILVEI,Trandafirilor,
,662101585,661101305,374542,33275,33319,662101585,BISTRIŢA-NĂSĂUD,,,170,ȘCOALA PRIMARĂ HERINA,SCOALA PRIMARA HERINA,HERINA,Principală,
,662102722,661101187,372556,33541,33550,662102722,BISTRIŢA-NĂSĂUD,,,525,GRĂDINIȚA CU PROGRAM NORMAL NR.1 LIVEZILE,GRADINITA CU PROGRAM NORMAL NR 1 LIVEZILE,LIVEZILE,Calea Moldovei,
,662101635,661101115,371590,32394,32401,662101635,BISTRIŢA-NĂSĂUD,,,21,GRĂDINIȚA CU PROGRAM NORMAL NR 8 BISTRIȚA,GRADINITA CU PROGRAM NORMAL NR 8 BISTRITA,BISTRIŢA,Parcului,
,662102586,661101065,375625,34360,34388,662102586,BISTRIŢA-NĂSĂUD,,,19,GRĂDINIȚA CU PROGRAM NORMAL DEALU ȘTEFĂNIȚEI,GRADINITA CU PROGRAM NORMAL DEALU STEFANITEI,DEALU ŞTEFĂNIŢEI,Principală,
,662102853,661100946,1294440,32394,32401,662102853,BISTRIŢA-NĂSĂUD,,,23,GRĂDINIȚA CU PROGRAM NORMAL NR.18 BISTRIȚA,GRADINITA CU PROGRAM NORMAL NR 18 BISTRITA,BISTRIŢA,Rodnei,
,662103189,661100711,375522,34280,34315,662103189,BISTRIŢA-NĂSĂUD,,,124,ȘCOALA GIMNAZIALĂ GERSA,SCOALA GIMNAZIALA GERSA,GERSA II,Principală,
28973233,661101377,,374645,33514,33523,661101377,BISTRIŢA-NĂSĂUD,,,83,ȘCOALA GIMNAZIALĂ NR.1 LEȘU,SCOALA GIMNAZIALA NR 1 LESU,LEŞU,Principală,
20087185,661101481,,374085,32811,32857,661101481,BISTRIŢA-NĂSĂUD,,,43,ȘCOALA GIMNAZIALĂ DOBRIC,SCOALA GIMNAZIALA DOBRIC,DOBRIC,Principală,
,662102116,661101074,373312,33248,33257,662102116,BISTRIŢA-NĂSĂUD,,,562,GRĂDINIȚA CU PROGRAM NORMAL NR.3 FELDRU,GRADINITA CU PROGRAM NORMAL NR 3 FELDRU,FELDRU,Principală,
,662102446,661100028,375687,34618,34636,662102446,BISTRIŢA-NĂSĂUD,,,36,"""ȘCOALA PRIMARĂ """"LUCIAN VALEA"""" VALEA MARE""",SCOALA PRIMARA LUCIAN VALEA VALEA MARE,VALEA MARE,Principală,
,662103863,661101513,373940,32660,32697,662103863,BISTRIŢA-NĂSĂUD,,,180,GRĂDINIȚA CU PROGRAM NORMAL MĂLUȚ,GRADINITA CU PROGRAM NORMAL MALUT,MĂLUŢ,Principală,
17905659,661200112,,60066747,32394,32401,661200112,BISTRIŢA-NĂSĂUD,,,47,"""GRĂDINIȚA CU PROGRAM PRELUNGIT """"ADVENT KINDERGARTEN"""" BISTRIȚA""",GRADINITA CU PROGRAM PRELUNGIT ADVENT KINDERGARTEN BISTRITA,BISTRIŢA,Cartier Viișoara,
27909852,661103628,,376681,35429,35438,661103628,BISTRIŢA-NĂSĂUD,,,132,"""ȘCOALA GIMNAZIALĂ """"NICOLAE DRĂGANU"""" ZAGRA""",SCOALA GIMNAZIALA NICOLAE DRAGANU ZAGRA,ZAGRA,Principală,
28152254,661101201,,374358,33122,33131,661101201,BISTRIŢA-NĂSĂUD,,,14C,"""ȘCOALA GIMNAZIALĂ """"LIVIU REBREANU"""" CHIUZA""",SCOALA GIMNAZIALA LIVIU REBREANU CHIUZA,CHIUZA,Principală,
,662101834,661101038,990140,32599,32606,662101834,BISTRIŢA-NĂSĂUD,,,1A,GRĂDINIȚA CU PROGRAM NORMAL NR.4 SÎNGEORZ-BĂI,GRADINITA CU PROGRAM NORMAL NR 4 SINGEORZ BAI,SÂNGEORZ-BĂI,Privighetorii,
,662101653,661100756,372441,33382,33417,662101653,BISTRIŢA-NĂSĂUD,,,238,GRĂDINIȚA CU PROGRAM NORMAL RUSU BÎRGĂULUI,GRADINITA CU PROGRAM NORMAL RUSU BIRGAULUI,RUSU BÂRGĂULUI,Principală,
,662102871,661101386,375340,34333,34351,662102871,BISTRIŢA-NĂSĂUD,,,,ȘCOALA PRIMARĂ VALEA VINULUI,SCOALA PRIMARA VALEA VINULUI,VALEA VINULUI,Valea Vinului,
,662103474,661101463,990877,35054,35081,662103474,BISTRIŢA-NĂSĂUD,,,34,GRĂDINIȚA CU PROGRAM NORMAL TELCIȘOR,GRADINITA CU PROGRAM NORMAL TELCISOR,TELCIŞOR,Valea Luștii,
,662102306,661101427,371904,32704,32731,662102306,BISTRIŢA-NĂSĂUD,,,99,GRĂDINIȚA CU PROGRAM NORMAL JELNA,GRADINITA CU PROGRAM NORMAL JELNA,JELNA,Principală,
,662100358,661103619,374188,179659,32973,662100358,BISTRIŢA-NĂSĂUD,,,128,"""ȘCOALA GIMNAZIALĂ """"VICTOR MOTOGNA"""" BREAZA""",SCOALA GIMNAZIALA VICTOR MOTOGNA BREAZA,BREAZA,Principală,
,662100539,661103723,376057,34547,34592,662100539,BISTRIŢA-NĂSĂUD,,,101,ȘCOALA GIMNAZIALĂ SITA,SCOALA GIMNAZIALA SITA,SITA,Principală,
4426760,661101178,,849561,32394,32401,661101178,BISTRIŢA-NĂSĂUD,,,23,"""LICEUL TEHNOLOGIC SPECIAL """"SFÂNTA MARIA"""" BISTRIȚA""",LICEUL TEHNOLOGIC SPECIAL SFANTA MARIA BISTRITA,BISTRIŢA,Independenţei,
,662102681,661101115,371667,32394,32410,662102681,BISTRIŢA-NĂSĂUD,,,,GRĂDINIȚA CU PROGRAM NORMAL GHINDA,GRADINITA CU PROGRAM NORMAL GHINDA,GHINDA,Cartier Ghinda,
,662102464,661100028,1254854,34618,34627,662102464,BISTRIŢA-NĂSĂUD,,,184,GRĂDINIȚA CU PROGRAM NORMAL NR.2 ȘANȚ,GRADINITA CU PROGRAM NORMAL NR 2 SANT,ŞANŢ,Principală,
,662103221,661100937,373407,34690,34716,662103221,BISTRIŢA-NĂSĂUD,,,168,GRĂDINIȚA CU PROGRAM NORMAL ARCALIA,GRADINITA CU PROGRAM NORMAL ARCALIA,ARCALIA,Principală,
,662101816,661101038,371772,32599,32606,662101816,BISTRIŢA-NĂSĂUD,,,1,GRĂDINIȚA CU PROGRAM NORMAL NR.1 SÎNGEORZ-BĂI,GRADINITA CU PROGRAM NORMAL NR 1 SINGEORZ BAI,SÂNGEORZ-BĂI,Teilor,
,662101671,661100756,374669,33382,33417,662101671,BISTRIŢA-NĂSĂUD,,,257,"""ȘCOALA PRIMARĂ """"VASILE BOB FABIAN"""" RUSU BÎRGĂULUI""",SCOALA PRIMARA VASILE BOB FABIAN RUSU BIRGAULUI,RUSU BÂRGĂULUI,Principală,
,662102898,661101386,990786,34333,34342,662102898,BISTRIŢA-NĂSĂUD,,,1469/1,GRĂDINIȚA CU PROGRAM NORMAL NR.1 RODNA,GRADINITA CU PROGRAM NORMAL NR 1 RODNA,RODNA,Principală,
,662102093,661101481,371980,32811,32857,662102093,BISTRIŢA-NĂSĂUD,,,43,GRĂDINIȚA CU PROGRAM NORMAL DOBRIC,GRADINITA CU PROGRAM NORMAL DOBRIC,DOBRIC,Principală,
,662103411,661103741,991508,35269,35303,662103411,BISTRIŢA-NĂSĂUD,,,268,ȘCOALA GIMNAZIALĂ PREVENTORIU ILIȘUA,SCOALA GIMNAZIALA PREVENTORIU ILISUA,ILIŞUA,Principală,
,662102324,661101427,371875,32704,32713,662102324,BISTRIŢA-NĂSĂUD,,,260,GRĂDINIȚA CU PROGRAM NORMAL BUDACU DE JOS,GRADINITA CU PROGRAM NORMAL BUDACU DE JOS,BUDACU DE JOS,Principală,
22122602,661100697,,62071182,32394,32401,661100697,BISTRIŢA-NĂSĂUD,,,41,LICEUL TEHNOLOGIC DE SERVICII BISTRIȚA,LICEUL TEHNOLOGIC DE SERVICII BISTRITA,BISTRIŢA,Republicii,
4426786,661103818,,371538,32394,32401,661103818,BISTRIŢA-NĂSĂUD,,,9,"""GRĂDINIȚA CU PROGRAM PRELUNGIT """"CĂSUȚA CU POVEȘTI"""" BISTRIȚA""",GRADINITA CU PROGRAM PRELUNGIT CASUTA CU POVESTI BISTRITA,BISTRIŢA,Zimbrului,
,662100331,661103628,376708,35429,35465,662100331,BISTRIŢA-NĂSĂUD,,,200,ȘCOALA GIMNAZIALĂ POIENILE ZAGREI,SCOALA GIMNAZIALA POIENILE ZAGREI,POIENILE ZAGREI,Principală,
26112229,661201443,,6317389,32394,32401,661201443,BISTRIŢA-NĂSĂUD,,,29,"""GRĂDINIȚA SOCIALA CU PROGRAM NORMAL """"BENITA""""""",GRADINITA SOCIALA CU PROGRAM NORMAL BENITA,BISTRIŢA,Kogălniceanu Mihail,
29873453,661101115,,371473,32394,32401,661101115,BISTRIŢA-NĂSĂUD,,,2-4,"""GRĂDINIȚA CU PROGRAM SĂPTĂMÂNAL """"DUMBRAVA MINUNATĂ"""" BISTRIȚA""",GRADINITA CU PROGRAM SAPTAMANAL DUMBRAVA MINUNATA BISTRITA,BISTRIŢA,Teodoroiu Ecaterina,
