COD FISCAL,COD SIIIR,COD SIIIR SUP,COD SIRUES,SIRUTA LOC SUP,SIRUTA LOCALITATE,cod,judet,lat,lon,nr,nume,nume_ascii,oras,str,wikidata
,1352100382,1371101728,,60801,60810,1352100382,CONSTANŢA,,,43,CLUBUL COPIILOR HÂRŞOVA,CLUBUL COPIILOR HARSOVA,HÂRŞOVA,REVOLUŢIEI,
29456693,1361100057,,130452435,61559,61568,1361100057,CONSTANŢA,,,44,LICEUL TEHNOLOGIC CRUCEA,LICEUL TEHNOLOGIC CRUCEA,CRUCEA,CONSTANŢEI,
,1362102172,1361100568,,62903,62912,1362102172,CONSTANŢA,,,54,GRĂDINIŢA CU PROGRAM NORMAL SEIMENII MARI,GRADINITA CU PROGRAM NORMAL SEIMENII MARI,SEIMENI,GRĂDINIŢEI,
,1362103173,1361101239,,61826,61853,1362103173,CONSTANŢA,,,438,GRĂDINIŢA CU PROGRAM NORMAL GHINDĂREŞTI,GRADINITA CU PROGRAM NORMAL GHINDARESTI,GHINDĂREŞTI,ŞCOLII,
,1362102561,1361101221,,61069,61087,1362102561,CONSTANŢA,,,,GRĂDINIŢA CU PROGRAM NORMAL FĂUREI,GRADINITA CU PROGRAM NORMAL FAUREI,FĂUREI,,
,1362104744,1361105184,,62538,62547,1362104744,CONSTANŢA,,,38,GRĂDINIŢA CU PROGRAM NORMAL OSTROV,GRADINITA CU PROGRAM NORMAL OSTROV,OSTROV,01.mai,
,1362103286,1361101551,,62280,62299,1362103286,CONSTANŢA,,,41,GRĂDINIŢA CU PROGRAM NORMAL MIRCEA VODĂ,GRADINITA CU PROGRAM NORMAL MIRCEA VODA,MIRCEA VODĂ,PRIMĂRIEI,
,1362104812,1361105424,,63318,62324,1362104812,CONSTANŢA,,,36A,GRĂDINIŢA CU PROGRAM NORMAL SALIGNY,GRADINITA CU PROGRAM NORMAL SALIGNY,SALIGNY,ŞCOLII,
34705758,1361205598,,133404788,60419,60428,1361205598,CONSTANŢA,,,146,GRĂDINIŢA CU PROGRAM PRELUNGIT 'KIŢY BIŢY' CONSTANŢA,GRADINITA CU PROGRAM PRELUNGIT KITY BITY CONSTANTA,CONSTANŢA,Brătianu Constantin Ion,
,1362104242,1361105008,,63294,62164,1362104242,CONSTANŢA,,,235,GRĂDINIŢA CU PROGRAM NORMAL LANURILE,GRADINITA CU PROGRAM NORMAL LANURILE,LANURILE,LIBERTĂŢII,
,1362103906,1361105279,,60482,60491,1362103906,CONSTANŢA,,,42A,GRĂDINIŢA CU PROGRAM NORMAL NR. 2 MANGALIA,GRADINITA CU PROGRAM NORMAL NR 2 MANGALIA,MANGALIA,ROZELOR,
29038968,1361202021,,134124012,60419,60428,1361202021,CONSTANŢA,,,24,GRĂDINIŢA ’CĂSUŢA DIN PĂDURE’ CONSTANŢA,GRADINITA CASUTA DIN PADURE CONSTANTA,CONSTANŢA,ION URSU,
,1362103345,1361105139,,61675,61728,1362103345,CONSTANŢA,,,,ŞCOALA PRIMARĂ NR. 3 ŞIPOTE,SCOALA PRIMARA NR 3 SIPOTE,ŞIPOTELE,,
,1362102353,1361105288,,62707,62716,1362102353,CONSTANŢA,,,,GRĂDINIŢA CU PROGRAM NORMAL PEŞTERA,GRADINITA CU PROGRAM NORMAL PESTERA,PEŞTERA,,
29067041,1361101533,,131105027,60482,60491,1361101533,CONSTANŢA,,,10,ŞCOALA GIMNAZIALĂ NR. 3 MANGALIA,SCOALA GIMNAZIALA NR 3 MANGALIA,MANGALIA,ALBATROS,
29349239,1361101248,,130453489,62538,62583,1361101248,CONSTANŢA,,,12,ŞCOALA GIMNAZIALĂ NR. 1 GALIŢA,SCOALA GIMNAZIALA NR 1 GALITA,GALIŢA,01.mai,
4700902,1361100116,,130099556,60419,60428,1361100116,CONSTANŢA,,,34,LICEUL TEHNOLOGIC ’GHEORGHE DUCA’ CONSTANŢA,LICEUL TEHNOLOGIC GHEORGHE DUCA CONSTANTA,CONSTANŢA,VIFOR HAIDUCUL,
,1362103752,1361100817,,60883,60892,1362103752,CONSTANŢA,,,37,GRĂDINIŢA CU PROGRAM NORMAL ADAMCLISI,GRADINITA CU PROGRAM NORMAL ADAMCLISI,ADAMCLISI,MUZEULUI,
28020784,1361105098,,130451936,60721,60730,1361105098,CONSTANŢA,,,128,ŞCOALA GIMNAZIALĂ NR. 1 TUZLA,SCOALA GIMNAZIALA NR 1 TUZLA,TUZLA,CONSTANŢEI,
,1362104518,1361105121,,62057,62084,1362104518,CONSTANŢA,,,,GRĂDINIŢA CU PROGRAM NORMAL CARVĂN,GRADINITA CU PROGRAM NORMAL CARVAN,CARVĂN,,
,1362102995,1361101388,,63045,63054,1362102995,CONSTANŢA,,,,GRĂDINIŢA CU PROGRAM NORMAL TOPALU,GRADINITA CU PROGRAM NORMAL TOPALU,TOPALU,,
,1362103051,1361105207,,61871,61933,1362103051,CONSTANŢA,,,,GRĂDINIŢA CU PROGRAM NORMAL OLTENI,GRADINITA CU PROGRAM NORMAL OLTENI,OLTENI,,
,1362103119,1361105207,,61871,61942,1362103119,CONSTANŢA,,,,ŞCOALA PRIMARĂ NR. 4 TUFANI,SCOALA PRIMARA NR 4 TUFANI,TUFANI,,
,1362102507,1361101397,,60419,60428,1362102507,CONSTANŢA,,,6,GRĂDINIŢA CU PROGRAM NORMAL NR.34 CONSTANŢA,GRADINITA CU PROGRAM NORMAL NR 34 CONSTANTA,CONSTANŢA,Ionescu de la Brad Ion,
29273254,1361101768,,130454110,60847,60856,1361101768,CONSTANŢA,,,94,ŞCOALA GIMNAZIALĂ ’MIHAIL SADOVEANU’ MEDGIDIA,SCOALA GIMNAZIALA MIHAIL SADOVEANU MEDGIDIA,MEDGIDIA,SIRETULUI,
4515646,1361105406,,130451819,60455,60464,1361105406,CONSTANŢA,,,102,LICEUL TEORETIC ’CARMEN SYLVA’ EFORIE,LICEUL TEORETIC CARMEN SYLVA EFORIE,EFORIE SUD,NEGRU VODĂ,
27323224,1361205051,,133905744,60482,60491,1361205051,CONSTANŢA,,,20,ŞCOALA POSTLICEALĂ FEG EDUCATION MANGALIA,SCOALA POSTLICEALA FEG EDUCATION MANGALIA,MANGALIA,OITUZ,
,1362104165,1361100672,,61210,61229,1362104165,CONSTANŢA,,,16,GRĂDINIŢA CU PROGRAM NORMAL CHIRNOGENI,GRADINITA CU PROGRAM NORMAL CHIRNOGENI,CHIRNOGENI,DISPENSARULUI,
,1362102692,1361101058,,62253,62271,1362102692,CONSTANŢA,,,,ŞCOALA GIMNAZIALĂ NR. 1 SINOIE,SCOALA GIMNAZIALA NR 1 SINOIE,SINOIE,,
,1362104224,1361105406,,60455,60464,1362104224,CONSTANŢA,,,102,GRĂDINIŢA CU PROGRAM PRELUNGIT ’ALBATROS’ EFORIE SUD,GRADINITA CU PROGRAM PRELUNGIT ALBATROS EFORIE SUD,EFORIE SUD,NEGRU VODĂ,
,1362103924,1361101786,,60776,60785,1362103924,CONSTANŢA,,,10BIS,GRĂDINIŢA CU PROGRAM PRELUNGIT ’VOINICELUL’ CERNAVODĂ,GRADINITA CU PROGRAM PRELUNGIT VOINICELUL CERNAVODA,CERNAVODĂ,09.mai,
,1362104599,1361104907,,62440,62459,1362104599,CONSTANŢA,,,,ŞCOALA PRIMARĂ NR. 2 NICOLAE BĂLCESCU,SCOALA PRIMARA NR 2 NICOLAE BALCESCU,NICOLAE BĂLCESCU,,
28660465,1361205318,,134116998,60419,60428,1361205318,CONSTANŢA,,,118,GRĂDINIŢA ’MINI LONDON’ CONSTANŢA,GRADINITA MINI LONDON CONSTANTA,CONSTANŢA,MIHAI VITEAZU,
,1362102335,1361100455,,63072,61657,1362102335,CONSTANŢA,,,10,GRĂDINIŢA CU PROGRAM NORMAL POTÂRNICHEA,GRADINITA CU PROGRAM NORMAL POTARNICHEA,POTÂRNICHEA,ŞCOLII,
,1362103232,1361100202,,60776,60785,1362103232,CONSTANŢA,,,7,GRĂDINIŢA CU PROGRAM NORMAL ’PRICHINDEL’ CERNAVODĂ,GRADINITA CU PROGRAM NORMAL PRICHINDEL CERNAVODA,CERNAVODĂ,MIHAIL SADOVEANU,
29443774,1361100179,,131213630,60419,60428,1361100179,CONSTANŢA,,,12,ŞCOALA GIMNAZIALĂ NR. 38 ’DIMITRIE CANTEMIR’ CONSTANŢA,SCOALA GIMNAZIALA NR 38 DIMITRIE CANTEMIR CONSTANTA,CONSTANŢA,"""Dobrilă Eugeniu"," cpt."""
,1362104206,1361100672,,61210,61247,1362104206,CONSTANŢA,,,,ŞCOALA GIMNAZIALĂ NR. 2 PLOPENI,SCOALA GIMNAZIALA NR 2 PLOPENI,PLOPENI,,
4618226,1361100826,,130454055,60801,60810,1361100826,CONSTANŢA,,,5,ŞCOALA GIMNAZIALĂ NR. 1 HÂRŞOVA,SCOALA GIMNAZIALA NR 1 HARSOVA,HÂRŞOVA,REVOLUŢIEI,
29297563,1361100505,,130454146,60847,60856,1361100505,CONSTANŢA,,,15,ŞCOALA GIMNAZIALĂ ’MIRCEA DRAGOMIRESCU’ MEDGIDIA,SCOALA GIMNAZIALA MIRCEA DRAGOMIRESCU MEDGIDIA,MEDGIDIA,ION CREAGĂ,
,1362103137,1361101899,,61513,61522,1362103137,CONSTANŢA,,,100,GRĂDINIŢA CU PROGRAM NORMAL NR. 1 CORBU,GRADINITA CU PROGRAM NORMAL NR 1 CORBU,CORBU,PRINCIPALĂ,
,1362104789,1361105424,,63318,62342,1362104789,CONSTANŢA,,,185A,ŞCOALA PRIMARĂ NR. 3 ŞTEFAN CEL MARE,SCOALA PRIMARA NR 3 STEFAN CEL MARE,ŞTEFAN CEL MARE,NUCILOR,
29272631,1361102439,,130454598,60847,60856,1361102439,CONSTANŢA,,,10,GRĂDINIŢA CU PROGRAM PRELUNGIT ’LUCIAN GRIGORESCU’ MEDGIDIA,GRADINITA CU PROGRAM PRELUNGIT LUCIAN GRIGORESCU MEDGIDIA,MEDGIDIA,SPITALULUI,
4300884,1361101162,,131244251,60847,60856,1361101162,CONSTANŢA,,,2A,ŞCOALA GIMNAZIALĂ ’LUCIAN GRIGORESCU’ MEDGIDIA,SCOALA GIMNAZIALA LUCIAN GRIGORESCU MEDGIDIA,MEDGIDIA,TRANDAFIRILOR,
,1362104147,1361101402,,62486,62495,1362104147,CONSTANŢA,,,324,GRĂDINIŢA CU PROGRAM NORMAL OLTINA,GRADINITA CU PROGRAM NORMAL OLTINA,OLTINA,PORTULUI,
29466654,1361105424,,130453192,63318,62324,1361105424,CONSTANŢA,,,36,ŞCOALA GIMNAZIALĂ NR. 1 SALIGNY,SCOALA GIMNAZIALA NR 1 SALIGNY,SALIGNY,ŞCOLII,
,1362102665,1361100903,,63152,62244,1362102665,CONSTANŢA,,,,GRĂDINIŢA CU PROGRAM NORMAL UA SIBIOARA,GRADINITA CU PROGRAM NORMAL UA SIBIOARA,SIBIOARA,,
30892661,1361201445,,134203208,60507,60516,1361201445,CONSTANŢA,,,10,GRĂDINIŢA ’ALBĂ CA ZĂPADA’ NĂVODARI,GRADINITA ALBA CA ZAPADA NAVODARI,NĂVODARI,CABANEI,
,1362103788,1361100948,,61808,61817,1362103788,CONSTANŢA,,,3,GRĂDINIŢA CU PROGRAM NORMAL GÂRLICIU,GRADINITA CU PROGRAM NORMAL GARLICIU,GÂRLICIU,ŞCOLII,
,1362103309,1361101551,,62280,62333,1362103309,CONSTANŢA,,,39,ŞCOALA GIMNAZIALĂ NR. 2 SATU NOU,SCOALA GIMNAZIALA NR 2 SATU NOU,SATU NOU,ŞCOLII,
29296363,1361101578,,130453879,63326,63027,1361101578,CONSTANŢA,,,32,ŞCOALA GIMNAZIALĂ NR. 1 GRĂDINA,SCOALA GIMNAZIALA NR 1 GRADINA,GRĂDINA,VICTORIEI,
4514870,1361101397,,130959720,60419,60428,1361101397,CONSTANŢA,,,7,COLEGIUL TEHNIC ’VASILE PÂRVAN’ CONSTANŢA,COLEGIUL TEHNIC VASILE PARVAN CONSTANTA,CONSTANŢA,INDUSTRIALĂ,
29452438,1361100844,,131213628,60419,60428,1361100844,CONSTANŢA,,,8,ŞCOALA GIMNAZIALĂ NR. 39 ’NICOLAE TONITZA’ CONSTANŢA,SCOALA GIMNAZIALA NR 39 NICOLAE TONITZA CONSTANTA,CONSTANŢA,Solidarităţii,
,1362104414,1361101144,,62020,62048,1362104414,CONSTANŢA,,,1A,GRĂDINIŢA CU PROGRAM NORMAL NUNTAŞI,GRADINITA CU PROGRAM NORMAL NUNTASI,NUNTAŞI,BISERICII,
29443995,1361101637,,131213692,60419,60428,1361101637,CONSTANŢA,,,70,ŞCOALA GIMNAZIALĂ NR. 24 ’ION JALEA’ CONSTANŢA,SCOALA GIMNAZIALA NR 24 ION JALEA CONSTANTA,CONSTANŢA,GRIVIŢEI,
,1362100351,1361101569,,61951,62011,1362100351,CONSTANŢA,,,,ŞCOALA GIMNAZIALĂ NR. 2 VIILE,SCOALA GIMNAZIALA NR 2 VIILE,VIILE,,
34939333,1361102412,,130454641,60687,60696,1361102412,CONSTANŢA,,,60A,GRĂDINIŢA CU PROGRAM NORMAL ’LICURICI’ OVIDIU,GRADINITA CU PROGRAM NORMAL LICURICI OVIDIU,OVIDIU,NAŢIONALĂ,
29244453,1361101144,,130452887,62020,62039,1361101144,CONSTANŢA,,,15,ŞCOALA GIMNAZIALĂ NR. 1 ISTRIA,SCOALA GIMNAZIALA NR 1 ISTRIA,ISTRIA,PRIMĂRIEI,
32544272,1361201151,,133003637,60419,60428,1361201151,CONSTANŢA,,,28,GRĂDINIŢA ’LA NOUVELLE GENERATION’ CONSTANŢA,GRADINITA LA NOUVELLE GENERATION CONSTANTA,CONSTANŢA,Topraisar,
,1362103517,1361105139,,61675,61684,1362103517,CONSTANŢA,,,120,GRĂDINIŢA CU PROGRAM NORMAL DELENI,GRADINITA CU PROGRAM NORMAL DELENI,DELENI,ŞCOLII,
,1362102109,1361105252,,60687,60696,1362102109,CONSTANŢA,,,,GRĂDINIŢA CU PROGRAM NORMAL CULMEA,GRADINITA CU PROGRAM NORMAL CULMEA,OVIDIU,,
29481433,1361100455,,131104748,63072,63081,1361100455,CONSTANŢA,,,32B,LICEUL TEHNOLOGIC TOPRAISAR,LICEUL TEHNOLOGIC TOPRAISAR,TOPRAISAR,NAŢIONALĂ,
29845305,1361205603,,134164191,60419,60428,1361205603,CONSTANŢA,,,45,GRĂDINIŢA 'HELLO TEDDY' CONSTANŢA,GRADINITA HELLO TEDDY CONSTANTA,CONSTANŢA,Caragiale Ion Luca,
,1362103164,1361101899,,61513,61522,1362103164,CONSTANŢA,,,8,ŞCOALA GIMNAZIALĂ ’VASILE ALECSANDRI’ CORBU,SCOALA GIMNAZIALA VASILE ALECSANDRI CORBU,CORBU,CULTURII,
,1362102484,1361101673,,63286,60758,1362102484,CONSTANŢA,,,24,ŞCOALA PRIMARĂ ’ION CREANGĂ’ SCHITU,SCOALA PRIMARA ION CREANGA SCHITU,SCHITU,SCOLII,
25872331,1361201427,,133704401,60419,60428,1361201427,CONSTANŢA,,,40,ŞCOALA PRIMARĂ ’PETRE ISPIRESCU’ CONSTANŢA,SCOALA PRIMARA PETRE ISPIRESCU CONSTANTA,CONSTANŢA,Universităţii,
,1362104622,1361104907,,62440,62459,1362104622,CONSTANŢA,,,26,GRĂDINIŢA CU PROGRAM NORMAL ’CARUSEL’ NICOLAE BĂLCESCU,GRADINITA CU PROGRAM NORMAL CARUSEL NICOLAE BALCESCU,NICOLAE BĂLCESCU,CAROL I,
29402502,1361105121,,130453025,62057,62066,1361105121,CONSTANŢA,,,66,ŞCOALA GIMNAZIALĂ ’IOAN ATANASIU’ LIPNIŢA,SCOALA GIMNAZIALA IOAN ATANASIU LIPNITA,LIPNIŢA,MORII,
29448194,1361105451,,130454653,63125,63134,1361105451,CONSTANŢA,,,104,GRĂDINIȚA CU PROGRAM NORMAL NR. 1 VALU LUI TRAIAN,GRADINITA CU PROGRAM NORMAL NR 1 VALU LUI TRAIAN,VALU LUI TRAIAN,CALEA DOBROGEI,
,1362103006,1361100939,,62823,62850,1362103006,CONSTANŢA,,,,GRĂDINIŢA CU PROGRAM NORMAL DULGHERU,GRADINITA CU PROGRAM NORMAL DULGHERU,DULGHERU,,
4707617,1361100586,,130452679,61372,61381,1361100586,CONSTANŢA,,,36,LICEUL TEHNOLOGIC COGEALAC,LICEUL TEHNOLOGIC COGEALAC,COGEALAC,LICEULUI,
,1362104432,1361100785,,62397,62413,1362104432,CONSTANŢA,,,,ŞCOALA GIMNAZIALĂ NR. 1 DARABANI,SCOALA GIMNAZIALA NR 1 DARABANI,DARABANI,,
30691897,1361200928,,132064737,60419,60428,1361200928,CONSTANŢA,,,33,ŞCOALA PRIMARĂ ’NOUA GENERAŢIE’ CONSTANŢA,SCOALA PRIMARA NOUA GENERATIE CONSTANTA,CONSTANŢA,"""Murgescu Ioan"," viceamiral"""
,1362103535,1361105139,,61675,61693,1362103535,CONSTANŢA,,,,GRĂDINIŢA CU PROGRAM NORMAL PETROŞANI,GRADINITA CU PROGRAM NORMAL PETROSANI,PETROŞANI,,
,1362102127,1361105297,,60419,60428,1362102127,CONSTANŢA,,,39,GRĂDINIŢA CU PROGRAM NORMAL NR.37 CONSTANŢA,GRADINITA CU PROGRAM NORMAL NR 37 CONSTANTA,CONSTANŢA,Şoseaua din Vii,
,1362103458,1361100975,,61167,61201,1362103458,CONSTANŢA,,,,ŞCOALA PRIMARĂ NR. 1 VIROAGA,SCOALA PRIMARA NR 1 VIROAGA,VIROAGA,,
,1362104183,1361100672,,61210,61238,1362104183,CONSTANŢA,,,,GRĂDINIŢA CU PROGRAM NORMAL CREDINŢA,GRADINITA CU PROGRAM NORMAL CREDINTA,CREDINŢA,,
23590202,1361100473,,130451871,60507,60516,1361100473,CONSTANŢA,,,14,ŞCOALA GIMNAZIALĂ ’GRIGORE MOISIL’ NĂVODARI,SCOALA GIMNAZIALA GRIGORE MOISIL NAVODARI,NĂVODARI,PLOPILOR,
,1362103987,1361100586,,61372,61425,1362103987,CONSTANŢA,,,,GRĂDINIŢA CU PROGRAM NORMAL RÂMNICU DE JOS,GRADINITA CU PROGRAM NORMAL RAMNICU DE JOS,RÂMNICU DE JOS,,
,1362102724,1361100116,,60419,60428,1362102724,CONSTANŢA,,,1,ŞCOALA GIMNAZIALĂ ’MARIN SORESCU’ CONSTANŢA,SCOALA GIMNAZIALA MARIN SORESCU CONSTANTA,CONSTANŢA,Mihu Copilu,
,1362102466,1361104997,,60847,60856,1362102466,CONSTANŢA,,,60A,GRĂDINIŢA CU PROGRAM NORMAL NR.11 MEDGIDIA,GRADINITA CU PROGRAM NORMAL NR 11 MEDGIDIA,MEDGIDIA,REPUBLICII,
,1362104604,1361104907,,62440,62459,1362104604,CONSTANŢA,,,,GRĂDINIŢA CU PROGRAM NORMAL NICOLAE BĂLCESCU,GRADINITA CU PROGRAM NORMAL NICOLAE BALCESCU,NICOLAE BĂLCESCU,,
,1362103838,1361100107,,61737,61791,1362103838,CONSTANŢA,,,,ŞCOALA GIMNAZIALĂ NR. 1 VĂLENI,SCOALA GIMNAZIALA NR 1 VALENI,VĂLENI,,
,1362103467,1361101248,,62538,62592,1362103467,CONSTANŢA,,,,GRĂDINIŢA CU PROGRAM NORMAL GÂRLIŢA,GRADINITA CU PROGRAM NORMAL GARLITA,GÂRLIŢA,,
28052590,1361101827,,130453776,62878,62887,1361101827,CONSTANŢA,,,21,ŞCOALA GIMNAZIALĂ 'A. GHENCEA' SĂCELE,SCOALA GIMNAZIALA A GHENCEA SACELE,SĂCELE,CETATEA HISTRIEI,
29451734,1361100663,,131006374,60419,60428,1361100663,CONSTANŢA,,,2,GRĂDINIŢA CU PROGRAM PRELUNGIT ’STELUŢELE MĂRII’ CONSTANŢA,GRADINITA CU PROGRAM PRELUNGIT STELUTELE MARII CONSTANTA,CONSTANŢA,Corbului,
29273270,1361105103,,139841665,60847,60856,1361105103,CONSTANŢA,,,18,COLEGIUL NAŢIONAL ’KEMAL ATATURK’ MEDGIDIA,COLEGIUL NATIONAL KEMAL ATATURK MEDGIDIA,MEDGIDIA,LUPENI,
,1362104043,1361101171,,60945,60963,1362104043,CONSTANŢA,,,,GRĂDINIŢA CU PROGRAM NORMAL ARSA,GRADINITA CU PROGRAM NORMAL ARSA,ARSA,,
,1362104459,1361101144,,62020,62048,1362104459,CONSTANŢA,,,17,ŞCOALA GIMNAZIALĂ NR. 2 NUNTAŞI,SCOALA GIMNAZIALA NR 2 NUNTASI,NUNTAŞI,ALBATROSULUI,
,1362105496,1361105157,,60419,60428,1362105496,CONSTANŢA,,,5,GRĂDINIŢA CU PROGRAM NORMAL 'MICA SIRENĂ' CONSTANŢA,GRADINITA CU PROGRAM NORMAL MICA SIRENA CONSTANTA,CONSTANŢA,Constantinescu Paul,
,1362103087,1361105207,,61871,61906,1362103087,CONSTANŢA,,,,GRĂDINIŢA CU PROGRAM NORMAL FÂNTÂNA MARE,GRADINITA CU PROGRAM NORMAL FANTANA MARE,FÂNTÂNA MARE,,
,1362103553,1361100586,,61372,61425,1362103553,CONSTANŢA,,,,ŞCOALA GIMNAZIALĂ NR. 1 RÂMNICU DE JOS,SCOALA GIMNAZIALA NR 1 RAMNICU DE JOS,RÂMNICU DE JOS,,
,1362102145,1361100568,,62903,62930,1362102145,CONSTANŢA,,,229,ŞCOALA PRIMARĂ NR. 3 SEIMENII MICI,SCOALA PRIMARA NR 3 SEIMENII MICI,SEIMENII MICI,ŞCOLII,
4300710,1361101108,,131075789,60801,60810,1361101108,CONSTANŢA,,,1,LICEUL TEHNOLOGIC ’CARSIUM’ HÂRŞOVA,LICEUL TEHNOLOGIC CARSIUM HARSOVA,HÂRŞOVA,ALEEA I.A.S.,
,1362103431,1361100975,,61167,61185,1362103431,CONSTANŢA,,,,GRĂDINIŢA CU PROGRAM NORMAL CĂSCIOARELE,GRADINITA CU PROGRAM NORMAL CASCIOARELE,CĂSCIOARELE,,
4700899,1361104979,,130451754,60419,60428,1361104979,CONSTANŢA,,,6,LICEUL TEORETIC ’GEORGE CĂLINESCU’ CONSTANŢA,LICEUL TEORETIC GEORGE CALINESCU CONSTANTA,CONSTANŢA,CPT. DOBRILĂ EUGENIU,
,1362102706,1361101058,,62253,62262,1362102706,CONSTANŢA,,,40,GRĂDINIŢA CU PROGRAM NORMAL MIHAI VITEAZU,GRADINITA CU PROGRAM NORMAL MIHAI VITEAZU,MIHAI VITEAZU,PRINCIPALĂ,
,1362102258,1361101135,,61318,61336,1362102258,CONSTANŢA,,,138,ŞCOALA PRIMARĂ NR. 2 CONACU,SCOALA PRIMARA NR 2 CONACU,CONACU,NUFĂRULUI,
,1362102448,1361101768,,60847,60856,1362102448,CONSTANŢA,,,13,GRĂDINIŢA CU PROGRAM NORMAL NR. 9 MEDGIDIA,GRADINITA CU PROGRAM NORMAL NR 9 MEDGIDIA,MEDGIDIA,JIULUI,
,1362104667,1361100541,,60419,60428,1362104667,CONSTANŢA,,,19,GRĂDINIŢA CU PROGRAM NORMAL NR.16 CONSTANŢA,GRADINITA CU PROGRAM NORMAL NR 16 CONSTANTA,CONSTANŢA,SULMONA,
29374135,1361105347,,130452344,61620,61639,1361105347,CONSTANŢA,,,136,LICEUL TEHNOLOGIC ’NICOLAE DUMITRESCU’ CUMPĂNA,LICEUL TEHNOLOGIC NICOLAE DUMITRESCU CUMPANA,CUMPĂNA,SOS.CONSTANŢEI,
29262247,1361101845,,130452849,63278,61835,1361101845,CONSTANŢA,,,8,ŞCOALA GIMNAZIALĂ NR. 1 HORIA,SCOALA GIMNAZIALA NR 1 HORIA,HORIA,ŞCOLII,
29506147,1361105166,,130456429,63152,60703,1361105166,CONSTANŢA,,,1A,GRĂDINIŢA CU PROGRAM NORMAL ’LUMINIŢA’ LUMINA,GRADINITA CU PROGRAM NORMAL LUMINITA LUMINA,LUMINA,PELICAN,
,1362104061,1361101171,,60945,60981,1362104061,CONSTANŢA,,,,GRĂDINIŢA CU PROGRAM NORMAL COTU VĂII,GRADINITA CU PROGRAM NORMAL COTU VAII,COTU VĂII,,
,1362103571,1361100586,,61372,61443,1362103571,CONSTANŢA,,,,GRĂDINIŢA CU PROGRAM NORMAL TARIVERDE,GRADINITA CU PROGRAM NORMAL TARIVERDE,TARIVERDE,,
,1362102163,1361100568,,62903,62921,1362102163,CONSTANŢA,,,81,ŞCOALA PRIMARĂ NR. 2 DUNĂREA,SCOALA PRIMARA NR 2 DUNAREA,DUNĂREA,PROF. COSTICĂ DUDU,
13344170,1361101474,,131244237,60419,60428,1361101474,CONSTANŢA,,,03.mai,LICEUL TEORETIC ’LUCIAN BLAGA’ CONSTANŢA,LICEUL TEORETIC LUCIAN BLAGA CONSTANTA,CONSTANŢA,Mărţişorului,
,1362102579,1361101628,,63198,63090,1362102579,CONSTANŢA,,,,GRĂDINIŢA CU PROGRAM NORMAL AMZACEA,GRADINITA CU PROGRAM NORMAL AMZACEA,AMZACEA,PRINCIPALĂ,
4618447,1361100785,,130453348,62397,62404,1361100785,CONSTANŢA,,,50,LICEUL TEORETIC NEGRU VODĂ,LICEUL TEORETIC NEGRU VODA,NEGRU VODĂ,STADIONULUI,
4304711,1361105026,,130451388,60419,60428,1361105026,CONSTANŢA,,,2,LICEUL TEORETIC ’OVIDIUS’ CONSTANŢA,LICEUL TEORETIC OVIDIUS CONSTANTA,CONSTANŢA,BASARABI,
29155216,1361100437,,130453972,63125,63134,1361100437,CONSTANŢA,,,157,ŞCOALA GIMNAZIALĂ ’VICEAMIRAL IOAN MURGESCU’ VALU LUI TRAIAN,SCOALA GIMNAZIALA VICEAMIRAL IOAN MURGESCU VALU LUI TRAIAN,VALU LUI TRAIAN,MIHAI EMINESCU,
,1362102891,1361100057,,61559,61602,1362102891,CONSTANŢA,,,,ŞCOALA PRIMARĂ NR. 4 STUPINA,SCOALA PRIMARA NR 4 STUPINA,STUPINA,,
4514837,1361101705,,131181265,60419,60428,1361101705,CONSTANŢA,,,44,LICEUL TEHNOLOGIC ’C.A.ROSETTI’ CONSTANŢA,LICEUL TEHNOLOGIC C A ROSETTI CONSTANTA,CONSTANŢA,01.mai,
,1362102769,1361100197,,60687,60712,1362102769,CONSTANŢA,,,,ŞCOALA PRIMARĂ NR. 4 POIANA,SCOALA PRIMARA NR 4 POIANA,POIANA,,
,1362104391,1361101438,,61283,61309,1362104391,CONSTANŢA,,,,GRĂDINIŢA CU PROGRAM NORMAL CILACER CIOCÂRLIA,GRADINITA CU PROGRAM NORMAL CILACER CIOCARLIA,CIOCÂRLIA DE SUS,,
,1362102421,1361102412,,60687,60712,1362102421,CONSTANŢA,,,52,GRĂDINIŢA CU PROGRAM NORMAL ’POIANA’ POIANA,GRADINITA CU PROGRAM NORMAL POIANA POIANA,POIANA,ALBATROS,
,1362104649,1361100464,,60801,60829,1362104649,CONSTANŢA,,,,GRĂDINIŢA CU PROGRAM NORMAL VADU OII,GRADINITA CU PROGRAM NORMAL VADU OII,VADU OII,,
,1362103381,1361100776,,62609,62645,1362103381,CONSTANŢA,,,,ŞCOALA PRIMARĂ NR. 3 PANTELIMONU DE JOS,SCOALA PRIMARA NR 3 PANTELIMONU DE JOS,PANTELIMON DE JOS,PRINCIPALĂ,
,1362102398,1361105288,,62707,62734,1362102398,CONSTANŢA,,,6,GRĂDINIŢA CU PROGRAM NORMAL IVRINEZU MIC,GRADINITA CU PROGRAM NORMAL IVRINEZU MIC,IVRINEZU MIC,ŞCOLII,
,1362102977,1361100057,,61559,61611,1362102977,CONSTANŢA,,,,GRĂDINIŢA CU PROGRAM NORMAL ŞIRIU,GRADINITA CU PROGRAM NORMAL SIRIU,ŞIRIU,,
29444907,1361101863,,130454275,60419,60428,1361101863,CONSTANŢA,,,6,GRĂDINIŢA CU PROGRAM PRELUNGIT NR.10 CONSTANŢA,GRADINITA CU PROGRAM PRELUNGIT NR 10 CONSTANTA,CONSTANŢA,Topolog,
4300876,1361101316,,130454079,60847,60856,1361101316,CONSTANŢA,,,2,LICEUL TEORETIC ’NICOLAE BĂLCESCU’ MEDGIDIA,LICEUL TEORETIC NICOLAE BALCESCU MEDGIDIA,MEDGIDIA,SACRLAT VÂRNAV,
,1362104007,1361101031,,63170,62663,1362104007,CONSTANŢA,,,41,GRĂDINIŢA CU PROGRAM NORMAL VULTURU,GRADINITA CU PROGRAM NORMAL VULTURU,VULTURU,EROILOR,
,1362102959,1361100057,,61559,61577,1362102959,CONSTANŢA,,,,GRĂDINIŢA CU PROGRAM NORMAL BĂLTĂGEŞTI,GRADINITA CU PROGRAM NORMAL BALTAGESTI,BĂLTĂGEŞTI,,
,1362103603,1361101411,,62798,62805,1362103603,CONSTANŢA,,,41,GRĂDINIŢA CU PROGRAM NORMAL RASOVA,GRADINITA CU PROGRAM NORMAL RASOVA,RASOVA,BUCUREŞTII NOI,
28055529,1361105148,,130452291,61121,61158,1361105148,CONSTANŢA,,,9,ŞCOALA GIMNAZIALĂ ’IULIU VALAORI’ NISIPARI,SCOALA GIMNAZIALA IULIU VALAORI NISIPARI,NISIPARI,IULIU VALAHORI,
,1362105356,1361100514,,60482,60491,1362105356,CONSTANŢA,,,56,GRĂDINIŢA CU PROGRAM NORMAL NR. 4 MANGALIA,GRADINITA CU PROGRAM NORMAL NR 4 MANGALIA,MANGALIA,MATEI BASARAB,
28054302,1361101411,,130453714,62798,62805,1361101411,CONSTANŢA,,,41,ȘCOALA GIMNAZIALĂ NR. 1 RASOVA,SCOALA GIMNAZIALA NR 1 RASOVA,RASOVA,BUCUREŞTII NOI,
29287616,1361101646,,130452174,61005,61014,1361101646,CONSTANŢA,,,45,ŞCOALA GIMNAZIALĂ ’DAN SPĂTARU’ ALIMAN,SCOALA GIMNAZIALA DAN SPATARU ALIMAN,ALIMAN,PRINCIPALĂ,
4300620,1361104934,,131104683,60419,60428,1361104934,CONSTANŢA,,,48,GRĂDINIŢA CU PROGRAM PRELUNGIT NR.42 CONSTANŢA,GRADINITA CU PROGRAM PRELUNGIT NR 42 CONSTANTA,CONSTANŢA,01.mai,
,1362102742,1361101759,,60534,60543,1362102742,CONSTANŢA,,,65,GRĂDINIŢA CU PROGRAM NORMAL NR. 2 TECHIRGHIOL,GRADINITA CU PROGRAM NORMAL NR 2 TECHIRGHIOL,TECHIRGHIOL,NICOLAE BĂLCESCU,
28053218,1361100903,,130453283,62191,62208,1361100903,CONSTANŢA,,,37,LICEUL TEORETIC MIHAIL KOGĂLNICEANU,LICEUL TEORETIC MIHAIL KOGALNICEANU,MIHAIL KOGĂLNICEANU,KARA MURAT,
,1362102403,1361105288,,62707,62743,1362102403,CONSTANŢA,,,20,ŞCOALA PRIMARĂ NR. 3 IZVORU MARE,SCOALA PRIMARA NR 3 IZVORU MARE,IZVORU MARE,CIŞMELEI,
,1362104848,1361100143,,60419,60428,1362104848,CONSTANŢA,,,31,GRĂDINIŢA CU PROGRAM NORMAL NR.31 CONSTANŢA,GRADINITA CU PROGRAM NORMAL NR 31 CONSTANTA,CONSTANŢA,Bradului,
,1362103476,1361101248,,62538,62583,1362103476,CONSTANŢA,,,,GRĂDINIŢA CU PROGRAM NORMAL GALIŢA,GRADINITA CU PROGRAM NORMAL GALITA,GALIŢA,,
,1362103802,1361100107,,61737,61764,1362103802,CONSTANŢA,,,,GRĂDINIŢA CU PROGRAM NORMAL DOBROMIR-DEAL,GRADINITA CU PROGRAM NORMAL DOBROMIR DEAL,DOBROMIRU DIN DEAL,,
29513080,1361101628,,130453934,63198,63090,1361101628,CONSTANŢA,,,,ŞCOALA GIMNAZIALĂ NR. 1 AMZACEA,SCOALA GIMNAZIALA NR 1 AMZACEA,AMZACEA,PRINCIPALĂ,
,1362104025,1361101705,,60419,60428,1362104025,CONSTANŢA,,,44,GRĂDINIŢA ’ROSETTI’ CONSTANŢA,GRADINITA ROSETTI CONSTANTA,CONSTANŢA,01.mai,
29402430,1361101524,,130452681,63334,61407,1361101524,CONSTANŢA,,,83,ŞCOALA GIMNAZIALĂ NR. 1 FÂNTÂNELE,SCOALA GIMNAZIALA NR 1 FANTANELE,FÂNTÂNELE,BASARABIA,
,1362103621,1361101411,,62798,62814,1362103621,CONSTANŢA,,,36BIS,GRĂDINIŢA CU PROGRAM NORMAL COCHIRLENI,GRADINITA CU PROGRAM NORMAL COCHIRLENI,COCHIRLENI,PRINCIPALĂ,
,1362103494,1361101248,,62538,62574,1362103494,CONSTANŢA,,,,ŞCOALA PRIMARĂ NR. 3 ESECHIOI,SCOALA PRIMARA NR 3 ESECHIOI,ESECHIOI,,
14587100,1331100087,,130456613,60419,60428,1331100087,CONSTANŢA,,,17,CASA CORPULUI DIDACTIC CONSTANŢA,CASA CORPULUI DIDACTIC CONSTANTA,CONSTANŢA,Soveja,
,1362104563,1361105261,,60419,60428,1362104563,CONSTANŢA,,,128,GRĂDINIŢA CU PROGRAM NORMAL NR.38 CONSTANŢA,GRADINITA CU PROGRAM NORMAL NR 38 CONSTANTA,CONSTANŢA,MANGALIEI,
,1362103024,1361100939,,62823,62850,1362103024,CONSTANŢA,,,,ŞCOALA PRIMARĂ NR. 1 DULGHERU,SCOALA PRIMARA NR 1 DULGHERU,DULGHERU,,
,1362102213,1361101135,,61318,61336,1362102213,CONSTANŢA,,,138,GRĂDINIŢA CU PROGRAM NORMAL CONACU,GRADINITA CU PROGRAM NORMAL CONACU,CONACU,NUFĂRULUI,
29185462,1361101438,,130452497,61283,61292,1361101438,CONSTANŢA,,,53,ȘCOALA GIMNAZIALĂ NR. 1 CIOCÂRLIA,SCOALA GIMNAZIALA NR 1 CIOCARLIA,CIOCÂRLIA,01.dec,
29178210,1361101587,,130451900,60598,60605,1361101587,CONSTANŢA,,,42,ŞCOALA GIMNAZIALĂ ’GEORGE COŞBUC’ 23 AUGUST,SCOALA GIMNAZIALA GEORGE COSBUC 23 AUGUST,23.aug,GEORGE  CĂLINESCU,
15563223,1361205621,,133322320,60419,60428,1361205621,CONSTANŢA,,,4,ȘCOALA POSTLICEALĂ 'FORTUNA' CONSTANȚA,SCOALA POSTLICEALA FORTUNA CONSTANTA,CONSTANŢA,Iorga Nicolae,
29429044,1361101293,,130451481,60419,60428,1361101293,CONSTANŢA,,,3A,ŞCOALA GIMNAZIALĂ NR. 3 ’CIPRIAN PORUMBESCU’ CONSTANŢA,SCOALA GIMNAZIALA NR 3 CIPRIAN PORUMBESCU CONSTANTA,CONSTANŢA,Porumbescu Ciprian,
29015913,1361100211,,130453594,62672,62681,1361100211,CONSTANŢA,,,5,ŞCOALA GIMNAZIALĂ NR. 1 PECINEAGA,SCOALA GIMNAZIALA NR 1 PECINEAGA,PECINEAGA,ŞTEFAN CEL MARE,
,1362102317,1361100455,,63072,63107,1362102317,CONSTANŢA,,,15,ŞCOALA GIMNAZIALĂ NR. 1 BIRUINŢA,SCOALA GIMNAZIALA NR 1 BIRUINTA,BIRUINŢA,UNIRII,
29335047,1361100966,,130454005,60776,60785,1361100966,CONSTANŢA,,,6,ŞCOALA GIMNAZIALĂ NR. 1 CERNAVODĂ,SCOALA GIMNAZIALA NR 1 CERNAVODA,CERNAVODĂ,SALCIEI,
,1362104355,1361101438,,61283,61309,1362104355,CONSTANŢA,,,16,ŞCOALA GIMNAZIALĂ NR. 2 CIOCÂRLIA DE SUS,SCOALA GIMNAZIALA NR 2 CIOCARLIA DE SUS,CIOCÂRLIA DE SUS,VENUS,
,1362104685,1361100523,,60482,63205,1362104685,CONSTANŢA,,,1,ŞCOALA GIMNAZIALĂ NR. 4 NEPTUN,SCOALA GIMNAZIALA NR 4 NEPTUN,NEPTUN,PLOPILOR,
,1362104884,1361102005,,63152,62217,1362104884,CONSTANŢA,,,,GRĂDINIŢA CU PROGRAM NORMAL OITUZ,GRADINITA CU PROGRAM NORMAL OITUZ,OITUZ,,
,1362103259,1361101212,,62949,62958,1362103259,CONSTANŢA,,,,GRĂDINIŢA CU PROGRAM NORMAL SILIŞTEA,GRADINITA CU PROGRAM NORMAL SILISTEA,SILIŞTEA,,
