COD FISCAL,COD SIIIR,COD SIIIR SUP,COD SIRUES,SIRUTA LOC SUP,SIRUTA LOCALITATE,cod,judet,lat,lon,nr,nume,nume_ascii,oras,str,wikidata
,2862102714,2861100047,,127251,127260,2862102714,OLT,,,,GRADINITA CU PROGRAM NORMAL IANCA,GRADINITA CU PROGRAM NORMAL IANCA,IANCA,,
,2862100436,2861100644,991754,128711,128720,2862100436,OLT,,,,GRADINITA CU PROGRAM PRELUNGIT SCORNICESTI,GRADINITA CU PROGRAM PRELUNGIT SCORNICESTI,SCORNICEŞTI,,
25577501,2861100522,,628852,127858,127867,2861100522,OLT,,,,SCOALA GIMNAZIALA OPORELU,SCOALA GIMNAZIALA OPORELU,OPORELU,,
25330527,2861101437,,323581,130286,128070,2861101437,OLT,,,1,"""SCOALA GIMNAZIALA """"ION GRAURE"""" BALTENI""",SCOALA GIMNAZIALA ION GRAURE BALTENI,BĂLTENI,PRINCIPALA,
25323058,2861100386,,628486,127126,127135,2861100386,OLT,,,,SCOALA GIMNAZIALA GIUVARASTI,SCOALA GIMNAZIALA GIUVARASTI,GIUVĂRĂŞTI,,
,2862103778,2861104725,,126674,126709,2862103778,OLT,,,,"""GRADINITA CU PROGRAM NORMAL """"NICOLAE TRUTA"""" HOREZU""",GRADINITA CU PROGRAM NORMAL NICOLAE TRUTA HOREZU,HOREZU,,
,2862102542,2861101012,,126718,126754,2862102542,OLT,,,,GRADINITA CU PROGRAM NORMAL RESCA,GRADINITA CU PROGRAM NORMAL RESCA,REŞCA,,
,2862103059,2861100151,,130302,125686,2862103059,OLT,,,,SCOALA PRIMARA BALEASA,SCOALA PRIMARA BALEASA,BĂLEASA,,
25306227,2861100264,,627884,125490,125506,2861100264,OLT,,,147,SCOALA GIMNAZIALA DRAGHICENI,SCOALA GIMNAZIALA DRAGHICENI,DRĂGHICENI,PRINCIPALA,
,2862103163,2861101401,,125542,125551,2862103163,OLT,,,,"""GRADINITA CU PROGRAM NORMAL """"CORABIA PITICILOR"""" CORABIA""",GRADINITA CU PROGRAM NORMAL CORABIA PITICILOR CORABIA,CORABIA,,
,2862103995,2861101283,,127625,127643,2862103995,OLT,,,,GRADINITA CU PROGRAM NORMAL BARASTI,GRADINITA CU PROGRAM NORMAL BARASTI,BĂRĂŞTI,,
25565663,2861100843,,628955,128052,128061,2861100843,OLT,,,,SCOALA GIMNAZIALA PERIETI,SCOALA GIMNAZIALA PERIETI,PERIEŢI,,
25299146,2861100626,,627937,125677,125695,2861100626,OLT,,,65,SCOALA GIMNAZIALA BALDOVINESTI,SCOALA GIMNAZIALA BALDOVINESTI,BALDOVINEŞTI,PLOPULUI,
,2862102732,2861100047,,127251,127279,2862102732,OLT,,,,GRADINITA CU PROGRAM NORMAL POTELU,GRADINITA CU PROGRAM NORMAL POTELU,POTELU,,
,2862103466,2861100807,,129585,129610,2862103466,OLT,,,,SCOALA GIMNAZIALA STOBORASTI,SCOALA GIMNAZIALA STOBORASTI,STOBORĂŞTI,,
,2862102922,2861104517,,127750,127796,2862102922,OLT,,,,GRADINITA CU PROGRAM NORMAL OBIRSIA NOUA,GRADINITA CU PROGRAM NORMAL OBIRSIA NOUA,OBÂRŞIA NOUĂ,,
,2862102596,2861100228,,130124,130133,2862102596,OLT,,,,GRADINITA CU PROGRAM NORMAL VULPENI,GRADINITA CU PROGRAM NORMAL VULPENI,VULPENI,,
,2862104933,2861100698,,126825,126898,2862104933,OLT,,,10,SCOALA PRIMARA ULMET,SCOALA PRIMARA ULMET,ULMET,ULMET,
25268808,2861104621,,629337,129139,129148,2861104621,OLT,,,,SCOALA GIMNAZIALA STREJESTII DE JOS,SCOALA GIMNAZIALA STREJESTII DE JOS,STREJEŞTI,,
,2862102904,2861100133,,125418,125427,2862102904,OLT,,,32,GRADINITA CU PROGRAM NORMAL NR.2 BALS,GRADINITA CU PROGRAM NORMAL NR 2 BALS,BALŞ,N.TITULESCU,
,2862101342,2861100974,630001,125347,125356,2862101342,OLT,,,,"""GRADINITA CU PROGRAM NORMAL """"SPIRU VERGULESCU"""" SLATINA""",GRADINITA CU PROGRAM NORMAL SPIRU VERGULESCU SLATINA,SLATINA,TEIULUI,
,2862101618,2861101627,,128301,128356,2862101618,OLT,,,,SCOALA PRIMARA SEACA,SCOALA PRIMARA SEACA,SEACA,,
33873117,2861101197,,777677,125347,125356,2861101197,OLT,,,,GRADINITA CU PROGRAM PRELUNGIT NR 4 SLATINA,GRADINITA CU PROGRAM PRELUNGIT NR 4 SLATINA,SLATINA,,
,2862103611,2861104544,,129816,129843,2862103611,OLT,,,,GRADINITA CU PROGRAM NORMAL CUCUIETI,GRADINITA CU PROGRAM NORMAL CUCUIETI,CUCUEŢI,,
21320776,2861100246,,1109499,125347,125356,2861100246,OLT,,,1,"""SCOALA GIMNAZIALA """"EUGEN IONESCU"""" SLATINA""",SCOALA GIMNAZIALA EUGEN IONESCU SLATINA,SLATINA,UNIRII,
25323040,2861104811,,628084,126102,126111,2861104811,OLT,,,73,"""SCOALA GIMNAZIALA """"NICOLAE MARINEANU"""" CEZIENI""",SCOALA GIMNAZIALA NICOLAE MARINEANU CEZIENI,CEZIENI,DUMITRU CEZIANU,
25299227,2861100825,,629662,129898,129905,2861100825,OLT,,,,SCOALA GIMNAZIALA VISINA,SCOALA GIMNAZIALA VISINA,VIŞINA,,
,2862104476,2861101197,629973,125347,125356,2862104476,OLT,,,,GRADINITA CU PROGRAM NORMAL NR 4 SLATINA,GRADINITA CU PROGRAM NORMAL NR 4 SLATINA,SLATINA,,
,2862102135,2861100843,,128052,128061,2862102135,OLT,,,,GRADINITA CU PROGRAM NORMAL PERIETI,GRADINITA CU PROGRAM NORMAL PERIETI,PERIEŢI,,
,2862103403,2861101202,,128560,128579,2862103403,OLT,,,,GRADINITA CU PROGRAM NORMAL NR.1 ROTUNDA,GRADINITA CU PROGRAM NORMAL NR 1 ROTUNDA,ROTUNDA,,
,2862104033,2861100264,,125490,125524,2862104033,OLT,,,,GRADINITA CU PROGRAM NORMAL LIICENI,GRADINITA CU PROGRAM NORMAL LIICENI,LIICENI,,
,2862103638,2861104544,,129816,129825,2862103638,OLT,,,,GRADINITA CU PROGRAM NORMAL VERGULEASA,GRADINITA CU PROGRAM NORMAL VERGULEASA,VERGULEASA,,
,2862102646,2861104449,,128711,128748,2862102646,OLT,,,,GRADINITA CU PROGRAM NORMAL BIRCII,GRADINITA CU PROGRAM NORMAL BIRCII,BIRCII,,
25330543,2861104648,,629583,129656,129665,2861104648,OLT,,,,SCOALA GIMNAZIALA VALEA MARE,SCOALA GIMNAZIALA VALEA MARE,VALEA MARE,,
,2862104173,2861100721,,129987,130008,2862104173,OLT,,,,GRADINITA CU PROGRAM NORMAL BARCANESTI,GRADINITA CU PROGRAM NORMAL BARCANESTI,BĂRCĂNEŞTI,,
12938957,2861100124,,981606,125347,125356,2861100124,OLT,,,,"""SCOALA GIMNAZIALA """"NICOLAE IORGA"""" SLATINA""",SCOALA GIMNAZIALA NICOLAE IORGA SLATINA,SLATINA,,
,2862101636,2861104413,,127171,127199,2862101636,OLT,,,,SCOALA PRIMARA PETCULESTI,SCOALA PRIMARA PETCULESTI,PETCULEŞTI,,
,2862102673,2861104553,,127983,128016,2862102673,OLT,,,,GRADINITA CU PROGRAM NORMAL OSICA DE SUS,GRADINITA CU PROGRAM NORMAL OSICA DE SUS,OSICA DE SUS,,
,2862102637,2861104449,,128711,128819,2862102637,OLT,,,,"""SCOALA GIMNAZIALA """"ION POPESCU NEGRENI"""" NEGRENI""",SCOALA GIMNAZIALA ION POPESCU NEGRENI NEGRENI,NEGRENI,,
,2862103095,2861104648,,129656,129683,2862103095,OLT,,,,SCOALA GIMNAZIALA RECEA,SCOALA GIMNAZIALA RECEA,RECEA,,
,2862103353,2861104779,,125873,125944,2862103353,OLT,,,,SCOALA GIMNAZIALA LEOTESTI,SCOALA GIMNAZIALA LEOTESTI,LEOTEŞTI,,
25534128,2861101161,,628254,126585,126594,2861101161,OLT,,,108,SCOALA GIMNAZIALA DANEASA,SCOALA GIMNAZIALA DANEASA,DĂNEASA,MIHAI VITEAZUL,
,2852104607,2871100346,6308777,125542,125551,2852104607,OLT,,,73,CLUBUL ELEVILOR SI COPIILOR CORABIA,CLUBUL ELEVILOR SI COPIILOR CORABIA,CORABIA,Cuza Voda,
,2862104458,2861101197,629985,125347,125356,2862104458,OLT,,,,GRADINITA CU PROGRAM NORMAL NR 5 SLATINA,GRADINITA CU PROGRAM NORMAL NR 5 SLATINA,SLATINA,,
25299090,2861100359,,629260,129095,129102,2861100359,OLT,,,,SCOALA GIMNAZIALA STOENESTI,SCOALA GIMNAZIALA STOENESTI,STOENEŞTI,,
,2862102447,2861101256,,129184,129237,2862102447,OLT,,,,GRADINITA CU PROGRAM NORMAL STUDINITA,GRADINITA CU PROGRAM NORMAL STUDINITA,STUDINIŢA,,
,2862101794,2861100305,,125999,126004,2862101794,OLT,,,,SCOALA PRIMARA BREBENI-ROMANI,SCOALA PRIMARA BREBENI ROMANI,BREBENI,,
,2862102203,2861101306,,125347,125356,2862102203,OLT,,,,GRADINITA CU PROGRAM NORMAL NR 10 SLATINA,GRADINITA CU PROGRAM NORMAL NR 10 SLATINA,SLATINA,,
,2862103457,2861100418,,125846,125855,2862103457,OLT,,,,GRADINITA CU PROGRAM NORMAL BIRZA,GRADINITA CU PROGRAM NORMAL BIRZA,BÂRZA,,
6219086,2861104657,,844195,125542,125551,2861104657,OLT,,,29,"""COLEGIUL TEHNIC """"DANUBIUS"""" CORABIA""",COLEGIUL TEHNIC DANUBIUS CORABIA,CORABIA,BUCURESTI,
,2862103145,2861104693,,128882,128944,2862103145,OLT,,,,GRADINITA CU PROGRAM NORMAL STANULEASA,GRADINITA CU PROGRAM NORMAL STANULEASA,STĂNULEASA,,
,2862101767,2861101093,,125418,125427,2862101767,OLT,,,,GRADINITA CU PROGRAM NORMAL TEIS,GRADINITA CU PROGRAM NORMAL TEIS,BALŞ,,
,2862103421,2861101333,,127563,127572,2862103421,OLT,,,,SCOALA PRIMARA ULMI/MILCOV,SCOALA PRIMARA ULMI/MILCOV,ULMI,,
33600893,2861100748,,981656,125472,125481,2861100748,OLT,,,2,SCOALA GIMNAZIALA NR.1 CARACAL,SCOALA GIMNAZIALA NR 1 CARACAL,CARACAL,MIHAI VITEAZUL,
4395027,2861101324,,1100003,125347,125356,2861101324,OLT,,,,"""COLEGIUL TEHNIC """"ALEXE MARIN"""" SLATINA""",COLEGIUL TEHNIC ALEXE MARIN SLATINA,SLATINA,,
5102249,2861100323,,981591,125347,125356,2861100323,OLT,,,,LICEUL CU PROGRAM SPORTIV SLATINA,LICEUL CU PROGRAM SPORTIV SLATINA,SLATINA,TOAMNEI,
25552019,2861104666,,628785,127714,127723,2861104666,OLT,,,,SCOALA GIMNAZIALA NICOLAE TITULESCU,SCOALA GIMNAZIALA NICOLAE TITULESCU,NICOLAE TITULESCU,,
5102303,2861100142,,991766,128711,128720,2861100142,OLT,,,,"""LICEUL TEHNOLOGIC """"CONSTANTIN BRINCOVEANU"""" SCORNICESTI""",LICEUL TEHNOLOGIC CONSTANTIN BRINCOVEANU SCORNICESTI,SCORNICEŞTI,,
,2862102031,2861104797,,128472,128490,2862102031,OLT,,,,GRADINITA CU PROGRAM NORMAL CALINESTI,GRADINITA CU PROGRAM NORMAL CALINESTI,CĂLINEŞTI,,
,2862104119,2861101021,,125347,125356,2862104119,OLT,,,,GRADINITA CU PROGRAM NORMAL NR 13 SLATINA,GRADINITA CU PROGRAM NORMAL NR 13 SLATINA,SLATINA,,
25517321,2861100662,,628345,126772,126781,2861100662,OLT,,,68,SCOALA GIMNAZIALA DOBROTEASA,SCOALA GIMNAZIALA DOBROTEASA,DOBROTEASA,PRINCIPALA,
12961640,2861100983,,981577,125347,125356,2861100983,OLT,,,,"""SCOALA GIMNAZIALA """"STEFAN PROTOPOPESCU"""" SLATINA""",SCOALA GIMNAZIALA STEFAN PROTOPOPESCU SLATINA,SLATINA,,
,2862104259,2861100938,,127019,127028,2862104259,OLT,,,,GRADINITA CU PROGRAM NORMAL FARCASELE,GRADINITA CU PROGRAM NORMAL FARCASELE,FĂRCAŞELE,,
25299235,2861100793,,629595,129718,129736,2861100793,OLT,,,,SCOALA GIMNAZIALA VADASTRA,SCOALA GIMNAZIALA VADASTRA,VĂDASTRA,,
,2862102655,2861104553,,127983,127992,2862102655,OLT,,,,GRADINITA CU PROGRAM NORMAL VLADULENI,GRADINITA CU PROGRAM NORMAL VLADULENI,VLĂDULENI,,
,2862104309,2861100698,,126825,126861,2862104309,OLT,,,,GRADINITA CU PROGRAM NORMAL DOBRUN,GRADINITA CU PROGRAM NORMAL DOBRUN,DOBRUN,,
31045746,2861100377,,1109358,125622,125631,2861100377,OLT,,,107B,"""GRADINITA CU PROGRAM NORMAL """"DUMBRAVA MINUNATA"""" DRAGANESTI OLT""",GRADINITA CU PROGRAM NORMAL DUMBRAVA MINUNATA DRAGANESTI OLT,DRĂGĂNEŞTI-OLT,NICOLAE TITULESCU,
,2862102465,2861100395,,129380,129399,2862102465,OLT,,,,GRADINITA CU PROGRAM NORMAL TESLUI,GRADINITA CU PROGRAM NORMAL TESLUI,TESLUI,,
,2862103222,2861104562,,127812,127821,2862103222,OLT,,,,SCOALA PRIMARA OBOGA DE JOS,SCOALA PRIMARA OBOGA DE JOS,OBOGA,,
,2862101844,2861100169,,127386,127395,2862101844,OLT,,,,GRADINITA CU PROGRAM NORMAL IZVOARELE,GRADINITA CU PROGRAM NORMAL IZVOARELE,IZVOARELE,,
,2862101514,2861104399,,127368,127377,2862101514,OLT,,,,GRADINITA CU PROGRAM NORMAL IZBICENI,GRADINITA CU PROGRAM NORMAL IZBICENI,IZBICENI,,
,2862103742,2861101292,,127144,127162,2862103742,OLT,,,,SCOALA GIMNAZIALA SLAVENI,SCOALA GIMNAZIALA SLAVENI,SLĂVENI,,
21320792,2861101306,,777653,125347,125356,2861101306,OLT,,,,GRADINITA CU PROGRAM PRELUNGIT NR 1 SLATINA,GRADINITA CU PROGRAM PRELUNGIT NR 1 SLATINA,SLATINA,,
25306200,2861100305,,628046,125999,126004,2861100305,OLT,,,228 C,SCOALA GIMNAZIALA BREBENI,SCOALA GIMNAZIALA BREBENI,BREBENI,PRINCIPALĂ,
,2862104096,2861101039,,127689,127705,2862104096,OLT,,,,SCOALA GIMNAZIALA BACEA,SCOALA GIMNAZIALA BACEA,BACEA,,
25347073,2861100169,,628620,127386,127395,2861100169,OLT,,,,LICEUL TEHNOLOGIC IZVOARELE,LICEUL TEHNOLOGIC IZVOARELE,IZVOARELE,,
,2862102325,2861104734,,129460,129497,2862102325,OLT,,,,SCOALA GIMNAZIALA POTLOGENI,SCOALA GIMNAZIALA POTLOGENI,POTLOGENI,,
,2862103041,2861100151,,130302,125702,2862103041,OLT,,,,SCOALA PRIMARA BROSTENI,SCOALA PRIMARA BROSTENI,BROŞTENI,,
25306189,2861101179,,628175,126380,126399,2861101179,OLT,,,2,SCOALA GIMNAZIALA COTEANA,SCOALA GIMNAZIALA COTEANA,COTEANA,ION CONEA,
25577544,2861104526,,629478,129317,129326,2861104526,OLT,,,,SCOALA GIMNAZIALA TATULESTI,SCOALA GIMNAZIALA TATULESTI,TĂTULEŞTI,,
,2862102402,2861101274,,125472,125481,2862102402,OLT,,,,GRADINITA CU PROGRAM NORMAL NR 3 CARACAL,GRADINITA CU PROGRAM NORMAL NR 3 CARACAL,CARACAL,,
,2862103751,2861101292,,127144,127153,2862103751,OLT,,,,GRADINITA CU PROGRAM NORMAL BREZUICA,GRADINITA CU PROGRAM NORMAL BREZUICA,GOSTAVĂŢU,,
,2862103204,2861101401,,125542,125551,2862103204,OLT,,,,GRADINITA CU PROGRAM NORMAL NR 3 CORABIA,GRADINITA CU PROGRAM NORMAL NR 3 CORABIA,CORABIA,,
,2862103317,2861100359,,129095,129102,2862103317,OLT,,,,GRADINITA CU PROGRAM NORMAL STOENESTI,GRADINITA CU PROGRAM NORMAL STOENESTI,STOENEŞTI,,
,2862104675,2861100748,630013,125472,125481,2862104675,OLT,,,,GRADINITA CU PROGRAM NORMAL NR 1 CARACAL,GRADINITA CU PROGRAM NORMAL NR 1 CARACAL,CARACAL,,
4491180,2861101378,,627731,125347,125356,2861101378,OLT,,,,"""COLEGIUL NATIONAL """"ION MINULESCU"""" SLATINA""",COLEGIUL NATIONAL ION MINULESCU SLATINA,SLATINA,,
,2862103602,2861104544,,129816,129861,2862103602,OLT,,,,GRADINITA CU PROGRAM NORMAL POGANU,GRADINITA CU PROGRAM NORMAL POGANU,POGANU,,
4491156,2831100276,,1106887,125347,125356,2831100276,OLT,,,15,CASA CORPULUI DIDACTIC SLATINA,CASA CORPULUI DIDACTIC SLATINA,SLATINA,Ionascu,
,2862102985,2861100549,,128178,128203,2862102985,OLT,,,,GRADINITA CU PROGRAM NORMAL OLARI,GRADINITA CU PROGRAM NORMAL OLARI,OLARI,,
12938930,2861100368,,6306145,125347,125356,2861100368,OLT,,,,"""SCOALA GIMNAZIALA """"GEORGE POBORAN"""" SLATINA""",SCOALA GIMNAZIALA GEORGE POBORAN SLATINA,SLATINA,,
32842406,2881101189,,1109554,125472,125481,2881101189,OLT,,,3,CLUBUL SPORTIV SCOLAR CARACAL,CLUBUL SPORTIV SCOLAR CARACAL,CARACAL,Aleea Bibian,
25299081,2861100187,,628187,126406,126415,2861100187,OLT,,,109,LICEUL TEHNOLOGIC CRIMPOIA,LICEUL TEHNOLOGIC CRIMPOIA,CRÂMPOIA,PRINCIPALA,
,2862103579,2861100608,,127536,127554,2862103579,OLT,,,,GRADINITA CU PROGRAM NORMAL BUSCA,GRADINITA CU PROGRAM NORMAL BUSCA,BUŞCA,,
,2862102619,2861100228,,130124,130133,2862102619,OLT,,,44,SCOALA PRIMARA GROPSANI,SCOALA PRIMARA GROPSANI,VULPENI,BALSULUI,
,2862102343,2861104734,,129460,129488,2862102343,OLT,,,,SCOALA GIMNAZIALA DOANCA,SCOALA GIMNAZIALA DOANCA,DOANCA,,
,2862103561,2861100608,,127536,127554,2862103561,OLT,,,,SCOALA PRIMARA BUSCA,SCOALA PRIMARA BUSCA,BUŞCA,,
,2862103285,2861100576,,128659,128686,2862103285,OLT,,,,SCOALA GIMNAZIALA GRECI-SCHITU,SCOALA GIMNAZIALA GRECI SCHITU,GRECI,,
25534098,2861104725,,628307,126674,126683,2861104725,OLT,,,3,"""SCOALA GIMNAZIALA """"DECEBAL"""" DOBRETU""",SCOALA GIMNAZIALA DECEBAL DOBRETU,DOBREŢU,PRINCIPALA,
25570996,2861104544,,991974,129816,129861,2861104544,OLT,,,,SCOALA GIMNAZIALA POGANU,SCOALA GIMNAZIALA POGANU,POGANU,,
33898936,2861100644,,1272349,128711,128784,2861100644,OLT,,,,"""SCOALA GIMNAZIALA """"GHEORGHE POPESCU"""" MARGINENI SLOBOZIA""",SCOALA GIMNAZIALA GHEORGHE POPESCU MARGINENI SLOBOZIA,MĂRGINENI SLOBOZIA,,
,2862101731,2861100282,,127064,127082,2862101731,OLT,,,,GRADINITA CU PROGRAM NORMAL DRANOVATU,GRADINITA CU PROGRAM NORMAL DRANOVATU,DRANOVĂŢU,,
,2862103828,2861100106,,129914,129941,2862103828,OLT,,,,GRADINITA CU PROGRAM NORNAL DEJESTI,GRADINITA CU PROGRAM NORNAL DEJESTI,DEJEŞTI,,
,2862102275,2861104752,,125962,125980,2862102275,OLT,,,,GRADINITA CU PROGRAM NORMAL CRUSOVU,GRADINITA CU PROGRAM NORMAL CRUSOVU,CRUŞOVU,,
,2862102284,2861104761,,130311,127741,2862102284,OLT,,,,GRADINITA CU PROGRAM NORMAL GHIMPETENII-NOI,GRADINITA CU PROGRAM NORMAL GHIMPETENII NOI,GHIMPEŢENII NOI,,
,2862103484,2861100739,,125542,125551,2862103484,OLT,,,,GRADINITA CU PROGRAM NORMAL NR.2 CORABIA,GRADINITA CU PROGRAM NORMAL NR 2 CORABIA,CORABIA,,
32605086,2861101093,,630116,125418,125427,2861101093,OLT,,,181,GRADINITA CU PROGRAM NORMAL NR.1 BALS,GRADINITA CU PROGRAM NORMAL NR 1 BALS,BALŞ,NICOLAE BALCESCU,
25306243,2861104399,,628618,127368,127377,2861104399,OLT,,,,SCOALA GIMNAZIALA IZBICENI,SCOALA GIMNAZIALA IZBICENI,IZBICENI,,
,2862104286,2861100938,,127019,127037,2862104286,OLT,,,,GRADINITA CU PROGRAM NORMAL FARCASU DE JOS,GRADINITA CU PROGRAM NORMAL FARCASU DE JOS,FĂRCAŞU DE JOS,,
30962791,2861100739,,981785,125542,125551,2861100739,OLT,,,49,"""SCOALA GIMNAZIALA """"MIHAI EMINESCU"""" CORABIA""",SCOALA GIMNAZIALA MIHAI EMINESCU CORABIA,CORABIA,STEFAN CEL MARE,
,2862104137,2861100332,,128588,128597,2862104137,OLT,,,,GRADINITA CU PROGRAM NORMAL RUSANESTI,GRADINITA CU PROGRAM NORMAL RUSANESTI,RUSĂNEŞTI,,
33600923,2861101003,,981694,125472,125481,2861101003,OLT,,,7,"""SCOALA GIMNAZIALA """"GHEORGHE MAGHERU"""" CARACAL""",SCOALA GIMNAZIALA GHEORGHE MAGHERU CARACAL,CARACAL,RADU CALOMFIRESCU,
,2862101948,2861100454,,125588,125604,2862101948,OLT,,,,SCOALA GIMNAZIALA URSA,SCOALA GIMNAZIALA URSA,URSA,,
,2862103543,2861104621,,129139,129157,2862103543,OLT,,,,GRADINITA CU PROGRAM NORMAL COLIBASI,GRADINITA CU PROGRAM NORMAL COLIBASI,COLIBAŞI,,
,2862103014,2861100757,,127322,127359,2862103014,OLT,,,,SCOALA PRIMARA URSOAIA,SCOALA PRIMARA URSOAIA,URSOAIA,,
25299154,2861101283,,628747,127625,127634,2861101283,OLT,,,,SCOALA GIMNAZIALA MORUNGLAV,SCOALA GIMNAZIALA MORUNGLAV,MORUNGLAV,,
4655879,2871100346,,1106899,125347,125356,2871100346,OLT,,,,"""PALATUL COPIILOR SI ELEVILOR """"ADRIAN BARAN"""" SLATINA""",PALATUL COPIILOR SI ELEVILOR ADRIAN BARAN SLATINA,SLATINA,,
25323074,2861101134,,628917,130339,127956,2861101134,OLT,,,,SCOALA GIMNAZIALA GURA PADINII,SCOALA GIMNAZIALA GURA PADINII,GURA PADINII,,
25338822,2861100395,,629492,129380,129399,2861100395,OLT,,,,SCOALA GIMNAZIALA TESLUI,SCOALA GIMNAZIALA TESLUI,TESLUI,,
,2862102976,2861100418,,125846,125864,2862102976,OLT,,,,SCOALA GIMNAZIALA BRANET,SCOALA GIMNAZIALA BRANET,BRANEŢ,,
21331333,2861100083,,981565,125347,125356,2861100083,OLT,,,,SCOALA GIMNAZIALA NR.1 SLATINA,SCOALA GIMNAZIALA NR 1 SLATINA,SLATINA,,
25299200,2861104707,,629600,130375,129727,2861104707,OLT,,,,SCOALA GIMNAZIALA VISINA NOUA,SCOALA GIMNAZIALA VISINA NOUA,VIŞINA NOUĂ,,
25523161,2861104562,,628802,127812,127821,2861104562,OLT,,,,SCOALA GIMNAZIALA OBOGA,SCOALA GIMNAZIALA OBOGA,OBOGA,,
,2862103846,2861101161,,126585,126629,2862103846,OLT,,,,SCOALA PRIMARA PESTRA,SCOALA PRIMARA PESTRA,PESTRA,,
24206548,2861201385,,6536063,125347,125356,2861201385,OLT,,,,"""GRADINITA CU PROGRAM PRELUNGIT """"PITIC DESTEPT"""" SLATINA""",GRADINITA CU PROGRAM PRELUNGIT PITIC DESTEPT SLATINA,SLATINA,CORNISEI 13,
25589182,2861100291,,629507,129503,129512,2861100291,OLT,,,,SCOALA GIMNAZIALA TOPANA,SCOALA GIMNAZIALA TOPANA,TOPANA,,
25534071,2861101202,,629167,128560,128579,2861101202,OLT,,,,SCOALA GIMNAZIALA ROTUNDA,SCOALA GIMNAZIALA ROTUNDA,ROTUNDA,,
,2862102601,2861100228,,130124,130133,2862102601,OLT,,,44,GRADINITA CU PROGRAM NORMAL GROPSANI,GRADINITA CU PROGRAM NORMAL GROPSANI,VULPENI,BALȘULUI,
,2862102352,2861104734,,129460,129497,2862102352,OLT,,,,GRADINITA CU PROGRAM NORMAL POTLOGENI,GRADINITA CU PROGRAM NORMAL POTLOGENI,POTLOGENI,,
,2862101889,2861100617,,126077,126095,2862101889,OLT,,,,GRADINITA CU PROGRAM NORMAL BUCINISU MIC,GRADINITA CU PROGRAM NORMAL BUCINISU MIC,BUCINIŞU MIC,,
,2862101559,2861100092,,129040,129059,2862101559,OLT,,,,GRADINITA CU PROGRAM NORMAL SPRINCENATA,GRADINITA CU PROGRAM NORMAL SPRINCENATA,SPRÂNCENATA,,
25551986,2861100418,,627975,125846,125855,2861100418,OLT,,,83,SCOALA GIMNAZIALA BIRZA,SCOALA GIMNAZIALA BIRZA,BÂRZA,TEILOR,
,2862103986,2861101283,,127625,127634,2862103986,OLT,,,,GRADINITA CU PROGRAM NORMAL MORUNGLAV,GRADINITA CU PROGRAM NORMAL MORUNGLAV,MORUNGLAV,,
,2862104087,2861101039,,127689,127705,2862104087,OLT,,,,GRADINITA CU PROGRAM NORMAL BACEA,GRADINITA CU PROGRAM NORMAL BACEA,BACEA,,
,2862101482,2861100766,,126433,126488,2862101482,OLT,,,,GRADINITA CU PROGRAM NORMAL PROASPETI,GRADINITA CU PROGRAM NORMAL PROASPETI,PROASPEŢI,,
,2862103032,2861100029,,128105,128123,2862103032,OLT,,,,SCOALA PRIMARA BISTRITA,SCOALA PRIMARA BISTRITA,BISTRIŢA NOUĂ,,
,2862103525,2861104621,,129139,129148,2862103525,OLT,,,,GRADINITA CU PROGRAM NORMAL STREJESTII DE JOS,GRADINITA CU PROGRAM NORMAL STREJESTII DE JOS,STREJEŞTI,,
25288490,2861104802,,629014,130384,128212,2861104802,OLT,,,,SCOALA GIMNAZIALA SOPIRLITA,SCOALA GIMNAZIALA SOPIRLITA,ŞOPÂRLIŢA,,
,2862102809,2861100481,,126978,126987,2862102809,OLT,,,,GRADINITA CU PROGRAM NORMAL CHILII,GRADINITA CU PROGRAM NORMAL CHILII,FĂLCOIU,,
5475205,2861100106,,1272375,129914,129923,2861100106,OLT,,,,LICEUL TEHNOLOGIC VITOMIRESTI,LICEUL TEHNOLOGIC VITOMIRESTI,VITOMIREŞTI,LIBERTATII,
,2862103005,2861100549,,128178,128187,2862103005,OLT,,,,GRADINITA CU PROGRAM NORMAL PIRSCOVENI,GRADINITA CU PROGRAM NORMAL PIRSCOVENI,PÎRŞCOVENI,,
25306278,2861104761,,628797,130311,127732,2861104761,OLT,,,,SCOALA GIMNAZIALA GHIMPETENI,SCOALA GIMNAZIALA GHIMPETENI,GHIMPEŢENI,,
25554400,2861100608,,628709,127536,127545,2861100608,OLT,,,1,SCOALA GIMNAZIALA MIHAESTI,SCOALA GIMNAZIALA MIHAESTI,MIHĂEŞTI,PRINCIPALA,
,2862101776,2861100427,,125347,125356,2862101776,OLT,,,,SCOALA DE ARTA SLATINA,SCOALA DE ARTA SLATINA,SLATINA,,
,2862103733,2861100463,,125418,125427,2862103733,OLT,,,5,GRADINITA CU PROGRAM PRELUNGIT NR.1 BALS,GRADINITA CU PROGRAM PRELUNGIT NR 1 BALS,BALŞ,FRATII BUZESTI,
,2862102022,2861104797,,128472,128490,2862102022,OLT,,,,SCOALA GIMNAZIALA CALINESTI,SCOALA GIMNAZIALA CALINESTI,CĂLINEŞTI,,
,2862103199,2861101401,,125542,125551,2862103199,OLT,,,,GRADINITA CU PROGRAM NORMAL VARTOPU CORABIA,GRADINITA CU PROGRAM NORMAL VARTOPU CORABIA,CORABIA,,
,2862103276,2861100576,,128659,128695,2862103276,OLT,,,,SCOALA PRIMARA LISA,SCOALA PRIMARA LISA,LISA,,
,2862104241,2861100965,,130348,127581,2862104241,OLT,,,,GRADINITA CU PROGRAM NORMAL IPOTESTI,GRADINITA CU PROGRAM NORMAL IPOTESTI,IPOTEŞTI,,
,2862101903,2861100504,,127288,127297,2862101903,OLT,,,,GRADINITA CU PROGRAM NORMAL RUDARI,GRADINITA CU PROGRAM NORMAL RUDARI,IANCU JIANU,,
9890697,2861204881,,,125347,125356,2861204881,OLT,,,1,SCOALA POSTLICEALA F.E.G. SLATINA,SCOALA POSTLICEALA F E G SLATINA,SLATINA,ARINULUI,
,2862101966,2861100454,,125588,125604,2862101966,OLT,,,,GRADINITA CU PROGRAM NORMAL URSA,GRADINITA CU PROGRAM NORMAL URSA,URSA,,
,2862103507,2861100739,,125542,125551,2862103507,OLT,,,,GRADINITA CU PROGRAM PRELUNGIT NR 1 CORABIA,GRADINITA CU PROGRAM PRELUNGIT NR 1 CORABIA,CORABIA,,
12938949,2861100888,,1276539,125347,125356,2861100888,OLT,,,,"""SCOALA GIMNAZIALA """"CONSTANTIN BRINCOVEANU"""" SLATINA""",SCOALA GIMNAZIALA CONSTANTIN BRINCOVEANU SLATINA,SLATINA,,
,2862104942,2861100698,,126825,126870,2862104942,OLT,,,10,SCOALA GIMNAZIALA ROSIENII MARI,SCOALA GIMNAZIALA ROSIENII MARI,ROŞIENII MARI,ROŞIENII MARI,
,2862102827,2861100635,,130026,130035,2862102827,OLT,,,,GRADINITA CU PROGRAM NORMAL VLADILA CENTRU,GRADINITA CU PROGRAM NORMAL VLADILA CENTRU,VLĂDILA,,
,2862101808,2861100305,,125999,126004,2862101808,OLT,,,,GRADINITA CU PROGRAM NORMAL BREBENI ROMANI,GRADINITA CU PROGRAM NORMAL BREBENI ROMANI,BREBENI,,
25537981,2861100047,,628539,127251,127260,2861100047,OLT,,,,"""SCOALA GIMNAZIALA """"ADA UMBRA"""" IANCA""",SCOALA GIMNAZIALA ADA UMBRA IANCA,IANCA,,
5102281,2861104743,,1313571,125347,125356,2861104743,OLT,,,,SCOALA POSTLICEALA SANITARA SLATINA,SCOALA POSTLICEALA SANITARA SLATINA,SLATINA,,
,2862101066,2861101274,981503,125472,125481,2862101066,OLT,,,,GRADINITA CU PROGRAM PRELUNGIT NR 4 CARACAL,GRADINITA CU PROGRAM PRELUNGIT NR 4 CARACAL,CARACAL,,
,2862103475,2861100807,,129585,129594,2862103475,OLT,,,,GRADINITA CU PROGRAM NORMAL TUFENI,GRADINITA CU PROGRAM NORMAL TUFENI,TUFENI,,
,2862102221,2861101107,,126022,126040,2862102221,OLT,,,,"""GRADINITA CU PROGRAM NORMAL """"MATEI BASARAB"""" MARGHENI""",GRADINITA CU PROGRAM NORMAL MATEI BASARAB MARGHENI,MĂRGHENI,,
,2862102198,2861100522,,127858,127876,2862102198,OLT,,,,GRADINITA CU PROGRAM NORMAL BERIA,GRADINITA CU PROGRAM NORMAL BERIA,BERIA DE JOS,,
25284153,2861101084,,981840,130357,126834,2861101084,OLT,,,,SCOALA GIMNAZIALA OSICA DE JOS,SCOALA GIMNAZIALA OSICA DE JOS,OSICA DE JOS,,
25306260,2861100454,,627896,125588,125597,2861100454,OLT,,,,SCOALA GIMNAZIALA GIRCOV,SCOALA GIMNAZIALA GIRCOV,GÂRCOV,,
18506397,2861104485,,1272313,125472,125481,2861104485,OLT,,,13,"""SCOALA GIMNAZIALA """"NICOLAE TITULESCU"""" CARACAL""",SCOALA GIMNAZIALA NICOLAE TITULESCU CARACAL,CARACAL,General Magheru,
25347081,2861100902,,628670,127493,127509,2861100902,OLT,,,,SCOALA GIMNAZIALA MARUNTEI,SCOALA GIMNAZIALA MARUNTEI,MĂRUNŢEI,,
,2862104268,2861100938,,127019,127037,2862104268,OLT,,,,SCOALA GIMNAZIALA FARCASU DE JOS,SCOALA GIMNAZIALA FARCASU DE JOS,FĂRCAŞU DE JOS,,
,2862104996,2861104526,,129317,129335,2862104996,OLT,,,1,GRADINITA CU PROGRAM NORMAL BARBALAI,GRADINITA CU PROGRAM NORMAL BARBALAI,BĂRBĂLĂI,PRINCIPALA,
,2862101921,2861100377,,125622,125631,2862101921,OLT,,,,GRADINITA CU PROGRAM PRELUNGIT DRAGANESTI,GRADINITA CU PROGRAM PRELUNGIT DRAGANESTI,DRĂGĂNEŞTI-OLT,,
,2862102691,2861104553,,127983,128007,2862102691,OLT,,,,SCOALA GIMNAZIALA GRECI-OSICA DE SUS,SCOALA GIMNAZIALA GRECI OSICA DE SUS,GRECI,,
,2862103077,2861100151,,130302,125686,2862103077,OLT,,,,GRADINITA CU PROGRAM NORMAL BALEASA,GRADINITA CU PROGRAM NORMAL BALEASA,BĂLEASA,,
25299251,2861101265,,628888,130366,127929,2861101265,OLT,,,,"""SCOALA GIMNAZIALA """"FLORIAN DITULEASA"""" VITANESTI""",SCOALA GIMNAZIALA FLORIAN DITULEASA VITANESTI,VITĂNEŞTI,,
,2862102845,2861101351,,126647,126665,2862102845,OLT,,,,SCOALA PRIMARA COMANCA,SCOALA PRIMARA COMANCA,COMANCA,C,
4549983,2861100029,,99142,128105,128114,2861100029,OLT,,,,LICEUL TEHNOLOGIC PIATRA-OLT,LICEUL TEHNOLOGIC PIATRA OLT,PIATRA-OLT,,
,2862104856,2861104788,,128524,128533,2862104856,OLT,,,1,GRADINITA CU PROGRAM NORMAL REDEA,GRADINITA CU PROGRAM NORMAL REDEA,REDEA,P,
,2862104214,2861101437,,130286,128070,2862104214,OLT,,,,GRADINITA CU PROGRAM NORMAL BALTENI,GRADINITA CU PROGRAM NORMAL BALTENI,BĂLTENI,,
,2862102067,2861100386,,127126,127135,2862102067,OLT,,,,GRADINITA CU PROGRAM NORMAL GIUVARASTI,GRADINITA CU PROGRAM NORMAL GIUVARASTI,GIUVĂRĂŞTI,,
,2862101826,2861100169,,127386,127402,2862101826,OLT,,,,GRADINITA CU PROGRAM NORMAL ALIMANESTI,GRADINITA CU PROGRAM NORMAL ALIMANESTI,ALIMĂNEŞTI,,
25299073,2861100807,,629533,129585,129594,2861100807,OLT,,,,LICEUL TEHNOLOGIC TUFENI,LICEUL TEHNOLOGIC TUFENI,TUFENI,,
,2862100834,2861104485,6306303,125472,125481,2862100834,OLT,,,,GRADINITA CU PROGRAM PRELUNGIT NR 3 CARACAL,GRADINITA CU PROGRAM PRELUNGIT NR 3 CARACAL,CARACAL,,
