COD FISCAL,COD SIIIR,COD SIIIR SUP,COD SIRUES,SIRUTA LOC SUP,SIRUTA LOCALITATE,cod,judet,lat,lon,nr,nume,nume_ascii,oras,str,wikidata
,2862103335,2861104372,,129282,129308,2862103335,OLT,,,,GRADINITA CU PROGRAM NORMAL IANCA NOUA,GRADINITA CU PROGRAM NORMAL IANCA NOUA,IANCA NOUĂ,,
25306510,2861101039,,628761,127689,127698,2861101039,OLT,,,,SCOALA GIMNAZIALA MOVILENI,SCOALA GIMNAZIALA MOVILENI,MOVILENI,,
7954891,2861201123,,6310213,125472,125481,2861201123,OLT,,,31B,"""SCOALA POSTLICEALA SANITARA """"CAROL DAVILA"""" CARACAL""",SCOALA POSTLICEALA SANITARA CAROL DAVILA CARACAL,CARACAL,LOTRULUI,
,2862104205,2861104811,,126102,126111,2862104205,OLT,,,,GRADINITA CU PROGRAM NORMAL CEZIENI,GRADINITA CU PROGRAM NORMAL CEZIENI,CEZIENI,,
25552027,2861104639,,1272363,129763,129772,2861104639,OLT,,,,LICEUL TEHNOLOGIC VALENI,LICEUL TEHNOLOGIC VALENI,VĂLENI,,
4394870,2861100929,,953544,125418,125427,2861100929,OLT,,,25,"""LICEUL TEORETIC """"PETRE PANDREA"""" BALS""",LICEUL TEORETIC PETRE PANDREA BALS,BALŞ,NICOLAE BALCESCU,
,2862103923,2861104639,,129763,129772,2862103923,OLT,,,,GRADINITA CU PROGRAM NORMAL VALENI-OLARI,GRADINITA CU PROGRAM NORMAL VALENI OLARI,VĂLENI,,
,2862103769,2861101292,,127144,127162,2862103769,OLT,,,,GRADINITA CU PROGRAM NORMAL SLAVENI,GRADINITA CU PROGRAM NORMAL SLAVENI,SLĂVENI,,
4394722,2821100217,,627717,125347,125356,2821100217,OLT,,,64B,INSPECTORATUL SCOLAR AL JUDETULUI OLT,INSPECTORATUL SCOLAR AL JUDETULUI OLT,SLATINA,EC.TEODOROIU,
,2862102863,2861101057,,126148,126157,2862102863,OLT,,,,GRADINITA CU PROGRAM NORMAL CILIENI,GRADINITA CU PROGRAM NORMAL CILIENI,CILIENI,,
31028184,2861100011,,1109504,125622,125631,2861100011,OLT,,,308,LICEUL TEHNOLOGIC DRAGANESTI-OLT,LICEUL TEHNOLOGIC DRAGANESTI OLT,DRĂGĂNEŞTI-OLT,NICOLAE TITULESCU,
,2862102013,2861100626,,125677,125748,2862102013,OLT,,,,GRADINITA CU PROGRAM NORMAL PIETRIS,GRADINITA CU PROGRAM NORMAL PIETRIS,PIETRIŞ,,
4491075,2861100558,,627729,125347,125356,2861100558,OLT,,,,"""COLEGIUL NATIONAL """"RADU GRECEANU"""" SLATINA""",COLEGIUL NATIONAL RADU GRECEANU SLATINA,SLATINA,,
,2852101233,2871100346,6308753,125418,125427,2852101233,OLT,,,1,CLUBUL ELEVILOR SI COPIILOR BALS,CLUBUL ELEVILOR SI COPIILOR BALS,BALŞ,Ciresului,
25517313,2861104693,,629258,128882,128891,2861104693,OLT,,,,SCOALA GIMNAZIALA SIMBURESTI,SCOALA GIMNAZIALA SIMBURESTI,SÂMBUREŞTI,,
,2862104015,2861101116,,126503,126558,2862104015,OLT,,,,SCOALA PRIMARA OTESTII DE JOS,SCOALA PRIMARA OTESTII DE JOS,OTEŞTII DE JOS,,
,2862102266,2861104752,,125962,125980,2862102266,OLT,,,,SCOALA GIMNAZIALA CRUSOVU,SCOALA GIMNAZIALA CRUSOVU,CRUŞOVU,,
,2862101681,2861100897,,129567,129576,2862101681,OLT,,,,GRADINITA CU PROGRAM NORMAL TRAIAN,GRADINITA CU PROGRAM NORMAL TRAIAN,TRAIAN,,
25299138,2861101351,,628280,126647,126656,2861101351,OLT,,,65,SCOALA GIMNAZIALA DEVESELU,SCOALA GIMNAZIALA DEVESELU,DEVESELU,Maria Coloni,
33898880,2861104449,,981890,128711,128748,2861104449,OLT,,,110,SCOALA GIMNAZIALA BIRCII,SCOALA GIMNAZIALA BIRCII,BIRCII,BIRCII,
25323031,2861101012,,628321,126718,126727,2861101012,OLT,,,12,SCOALA GIMNAZIALA DOBROSLOVENI,SCOALA GIMNAZIALA DOBROSLOVENI,DOBROSLOVENI,MIHAI VITEAZUL,
25589174,2861100472,,628383,126905,126914,2861100472,OLT,,,40,SCOALA GIMNAZIALA FAGETELU,SCOALA GIMNAZIALA FAGETELU,FĂGEŢELU,PRIMARIEI,
4550023,2861100947,,627767,125472,125481,2861100947,OLT,,,39,"""COLEGIUL NATIONAL """"IONITA ASAN"""" CARACAL""",COLEGIUL NATIONAL IONITA ASAN CARACAL,CARACAL,NICOLAE TITULESCU,
25338814,2861100766,,628199,126433,126442,2861100766,OLT,,,19,SCOALA GIMNAZIALA CURTISOARA,SCOALA GIMNAZIALA CURTISOARA,CURTIŞOARA,EROILOR,
,2862101473,2861100766,,126433,126442,2862101473,OLT,,,,GRADINITA CU PROGRAM NORMAL CURTISOARA,GRADINITA CU PROGRAM NORMAL CURTISOARA,CURTIŞOARA,,
25323082,2861101211,,628527,127224,127233,2861101211,OLT,,,,SCOALA GIMNAZIALA GROJDIBODU,SCOALA GIMNAZIALA GROJDIBODU,GROJDIBODU,,
,2862102741,2861101003,,125472,125481,2862102741,OLT,,,55,GRADINITA CU PROGRAM NORNAL NR.2 CARACAL,GRADINITA CU PROGRAM NORNAL NR 2 CARACAL,CARACAL,MIRCEA VODA,
25571002,2861100576,,629222,128659,128668,2861100576,OLT,,,,SCOALA GIMNAZIALA SCHITU,SCOALA GIMNAZIALA SCHITU,SCHITU,,
,2862103905,2861100644,,128711,128775,2862103905,OLT,,,,SCOALA PRIMARA JITARU,SCOALA PRIMARA JITARU,JITARU,,
5102320,2861101315,,1323708,128374,128383,2861101315,OLT,,,,"""LICEUL """"STEFAN DIACONESCU"""" POTCOAVA""",LICEUL STEFAN DIACONESCU POTCOAVA,POTCOAVA,,
27661977,2861100689,,1182257,125472,125481,2861100689,OLT,,,4,"""COLEGIUL TEHNIC """"MATEI BASARAB"""" CARACAL""",COLEGIUL TEHNIC MATEI BASARAB CARACAL,CARACAL,Aleea 1 Decembrie 1918,
33873109,2861100409,,629832,125347,125356,2861100409,OLT,,,,GRADINITA CU PROGRAM PRELUNGIT NR 3 SLATINA,GRADINITA CU PROGRAM PRELUNGIT NR 3 SLATINA,SLATINA,,
,2862102533,2861100947,,125472,125481,2862102533,OLT,,,,GRADINITA CU PROGRAM NORMAL NR 4 CARACAL,GRADINITA CU PROGRAM NORMAL NR 4 CARACAL,CARACAL,,
,2862102248,2861101107,,126022,126031,2862102248,OLT,,,,GRADINITA CU PROGRAM NORMAL BRINCOVENI,GRADINITA CU PROGRAM NORMAL BRINCOVENI,BRÂNCOVENI,,
,2862103118,2861101075,,130320,129219,2862103118,OLT,,,,GRADINITA CU PROGRAM NORMAL GRADINILE,GRADINITA CU PROGRAM NORMAL GRADINILE,GRĂDINILE,,
,2862103371,2861101315,,128374,128392,2862103371,OLT,,,,SCOALA PRIMARA FALCOIENI,SCOALA PRIMARA FALCOIENI,POTCOAVA FĂLCOENI,,
25288457,2861104422,,628101,126166,126175,2861104422,OLT,,,111,SCOALA GIMNAZIALA CIRLOGANI,SCOALA GIMNAZIALA CIRLOGANI,CÂRLOGANI,CENTRALA,
,2862103968,2861100314,,129745,129754,2862103968,OLT,,,,GRADINITA CU PROGRAM NORMAL SAT-NOU,GRADINITA CU PROGRAM NORMAL SAT NOU,VĂDĂSTRIŢA,,
,2862101984,2861100504,,127288,127297,2862101984,OLT,,,,SCOALA GIMNAZIALA IANCU JIANU,SCOALA GIMNAZIALA IANCU JIANU,IANCU JIANU,,
,2862102189,2861100522,,127858,127867,2862102189,OLT,,,,GRADINITA CU PROGRAM NORMAL OPORELU,GRADINITA CU PROGRAM NORMAL OPORELU,OPORELU,,
,2862102768,2861101265,,130366,127929,2862102768,OLT,,,,SCOALA PRIMARA BRANISTE,SCOALA PRIMARA BRANISTE,VITĂNEŞTI,,
,2862103588,2861100608,,127536,127545,2862103588,OLT,,,,GRADINITA CU PROGRAM NORMAL MIHAESTI,GRADINITA CU PROGRAM NORMAL MIHAESTI,MIHĂEŞTI,,
,2862102913,2861104517,,127750,127769,2862102913,OLT,,,,GRADINITA CU PROGRAM NORMAL OBIRSIA,GRADINITA CU PROGRAM NORMAL OBIRSIA,OBÂRŞIA,,
,2862101577,2861100092,,129040,129068,2862101577,OLT,,,,GRADINITA CU PROGRAM NORMAL BIRSESTII DE SUS,GRADINITA CU PROGRAM NORMAL BIRSESTII DE SUS,BÂRSEŞTII DE SUS,,
,2862102515,2861100911,,128221,128249,2862102515,OLT,,,,GRADINITA CU PROGRAM NORMAL ARCESTI,GRADINITA CU PROGRAM NORMAL ARCESTI,ARCEŞTI,,
,2862103172,2861101401,,125542,125551,2862103172,OLT,,,,"""GRADINITA CU PROGRAM PRELUNGIT """"FLOARE DE TEI"""" CORABIA""",GRADINITA CU PROGRAM PRELUNGIT FLOARE DE TEI CORABIA,CORABIA,,
32841265,2851101391,,6308765,125472,125481,2851101391,OLT,,,19,"""CLUBUL COPIILOR SI ELEVILOR """"MARIUS BUNESCU"""" CARACAL""",CLUBUL COPIILOR SI ELEVILOR MARIUS BUNESCU CARACAL,CARACAL,Piata Victoriei,
18450067,2841101368,,6541458,125347,125356,2841101368,OLT,,,8B,CENTRUL JUDETEAN DE RESURSE SI DE ASISTENTA EDUCATIONALA OLT,CENTRUL JUDETEAN DE RESURSE SI DE ASISTENTA EDUCATIONALA OLT,SLATINA,EC.TEODOROIU,
,2862102085,2861100187,,126406,126424,2862102085,OLT,,,,SCOALA PRIMARA BUTA,SCOALA PRIMARA BUTA,BUTA,,
,2862103398,2861101315,,128374,128383,2862103398,OLT,,,,GRADINITA CU PROGRAM PRELUNGIT POTCOAVA,GRADINITA CU PROGRAM PRELUNGIT POTCOAVA,POTCOAVA,,
25554389,2861104797,,629105,128472,128481,2861104797,OLT,,,,SCOALA GIMNAZIALA RADOMIRESTI,SCOALA GIMNAZIALA RADOMIRESTI,RADOMIREŞTI,,
31009964,2861104404,,6536180,125347,125356,2861104404,OLT,,,,CENTRUL JUDETEAN DE EXCELENTA OLT,CENTRUL JUDETEAN DE EXCELENTA OLT,SLATINA,ARINULUI NR.1,
,2862104223,2861101437,,130286,128070,2862104223,OLT,,,,GRADINITA CU PROGRAM NORMAL BROSCARI,GRADINITA CU PROGRAM NORMAL BROSCARI,BĂLTENI,,
25571029,2861100721,,629698,129987,129996,2861100721,OLT,,,,SCOALA GIMNAZIALA VILCELE,SCOALA GIMNAZIALA VILCELE,VÂLCELE,,
,2862103941,2861104639,,129763,129781,2862103941,OLT,,,,GRADINITA CU PROGRAM NORMAL MANDRA,GRADINITA CU PROGRAM NORMAL MANDRA,MANDRA,,
,2862102162,2861100852,,130231,130240,2862102162,OLT,,,,GRADINITA CU PROGRAM NORMAL VULTURESTI,GRADINITA CU PROGRAM NORMAL VULTURESTI,VULTUREŞTI,,
,2862103715,2861100038,,130062,130106,2862103715,OLT,,,,SCOALA PRIMARA RACOVITA,SCOALA PRIMARA RACOVITA,RACOVIŢA,,
,2862101568,2861100092,,129040,129059,2862101568,OLT,,,,SCOALA PRIMARA GILMEE,SCOALA PRIMARA GILMEE,SPRÂNCENATA,,
,2862102049,2861104797,,128472,128481,2862102049,OLT,,,,GRADINITA CU PROGRAM NORMAL FRIPTI,GRADINITA CU PROGRAM NORMAL FRIPTI,RADOMIREŞTI,,
4491377,2861100531,,1323710,125472,125481,2861100531,OLT,,,1,"""LICEUL TEORETIC """"MIHAI VITEAZUL"""" CARACAL""",LICEUL TEORETIC MIHAI VITEAZUL CARACAL,CARACAL,BICAZ,
,2862102456,2861100395,,129380,129424,2862102456,OLT,,,,SCOALA GIMNAZIALA COMANITA,SCOALA GIMNAZIALA COMANITA,COMĂNIŢA,,
,2862102004,2861100816,,125622,125631,2862102004,OLT,,,,"""GRADINITA CU PROGRAM NORMAL """"ELENA FARAGO"""" DRAGANESTI-OLT""",GRADINITA CU PROGRAM NORMAL ELENA FARAGO DRAGANESTI OLT,DRĂGĂNEŞTI-OLT,,
,2862103308,2861100576,,128659,128686,2862103308,OLT,,,,GRADINITA CU PROGRAM NORMAL GRECI-SCHITU,GRADINITA CU PROGRAM NORMAL GRECI SCHITU,GRECI,,
4491105,2861104363,,629820,125347,125356,2861104363,OLT,,,,GRADINITA CU PROGRAM PRELUNGIT NR 2 SLATINA,GRADINITA CU PROGRAM PRELUNGIT NR 2 SLATINA,SLATINA,,
,2862102958,2861100291,,129503,129512,2862102958,OLT,,,,GRADINITA CU PROGRAM NORMAL TOPANA,GRADINITA CU PROGRAM NORMAL TOPANA,TOPANA,,
,2862101586,2861100092,,129040,129077,2862101586,OLT,,,,GRADINITA CU PROGRAM NORMAL FRUNZARU,GRADINITA CU PROGRAM NORMAL FRUNZARU,FRUNZARU,,
,2862103154,2861100011,,125622,125631,2862103154,OLT,,,,GRADINITA CU PROGRAM NORMAL NR.1 DRAGANEST-OLT,GRADINITA CU PROGRAM NORMAL NR 1 DRAGANEST OLT,DRĂGĂNEŞTI-OLT,,
,2862102397,2861100671,,125757,125766,2862102397,OLT,,,,GRADINITA CU PROGRAM NORMAL BARASTII DE VEDE,GRADINITA CU PROGRAM NORMAL BARASTII DE VEDE,BĂRĂŞTII DE VEDE,,
25299065,2861100255,,628151,126326,126335,2861100255,OLT,,,227,SCOALA GIMNAZIALA CORBU,SCOALA GIMNAZIALA CORBU,CORBU,PRINCIPALA,
33859600,2861100703,,1195462,125347,125356,2861100703,OLT,,,,GRADINITA CU PROGRAM PRELUNGIT NR 7 SLATINA,GRADINITA CU PROGRAM PRELUNGIT NR 7 SLATINA,SLATINA,,
,2862101419,2861101627,629090,128301,128338,2862101419,OLT,,,,SCOALA GIMNAZIALA CORNATELU,SCOALA GIMNAZIALA CORNATELU,CORNĂŢELU,,
13009419,2861100879,,1276541,125418,125427,2861100879,OLT,,,51,"""SCOALA GIMNAZIALA """"MIHAIL DRUMES"""" BALS""",SCOALA GIMNAZIALA MIHAIL DRUMES BALS,BALŞ,NICOLAE BALCESCU,
,2862102144,2861100852,,130231,130277,2862102144,OLT,,,,SCOALA PRIMARA VLANGARESTI,SCOALA PRIMARA VLANGARESTI,VLĂNGĂREŞTI,,
,2862102492,2861100911,,128221,128276,2862102492,OLT,,,,GRADINITA CU PROGRAM NORMAL DOBA,GRADINITA CU PROGRAM NORMAL DOBA,DOBA,,
,2862102723,2861100047,,127251,127279,2862102723,OLT,,,,"""SCOALA GIMNAZIALA """"GEORGE VISAN"""" POTELU""",SCOALA GIMNAZIALA GEORGE VISAN POTELU,POTELU,,
,2862104969,2861104372,,129282,129291,2862104969,OLT,,,1,GRADINITA CU PROGRAM NORMAL STEFAN CEL MARE,GRADINITA CU PROGRAM NORMAL STEFAN CEL MARE,ŞTEFAN CEL MARE,PRINCIPALA,
14070065,2881100654,,6512550,125542,125551,2881100654,OLT,,,73,CLUBUL SCOLAR SPORTIV CORABIA,CLUBUL SCOLAR SPORTIV CORABIA,CORABIA,Cuza Voda,
,2862101609,2861100092,,129040,129059,2862101609,OLT,,,,GRADINITA CU PROGRAM NORMAL VIESPESTI,GRADINITA CU PROGRAM NORMAL VIESPESTI,SPRÂNCENATA,,
,2862102818,2861100481,,126978,126987,2862102818,OLT,,,,SCOALA PRIMARA CHILII,SCOALA PRIMARA CHILII,FĂLCOIU,,
33577391,2861104612,,6536192,127171,127180,2861104612,OLT,,,,"""SCOALA GIMNAZIALA """"BUNA VESTIRE"""" GRADINARI""",SCOALA GIMNAZIALA BUNA VESTIRE GRADINARI,GRĂDINARI,,
,2862103412,2861101333,,127563,127590,2862103412,OLT,,,,GRADINITA CU PROGRAM NORMAL MILCOV-DEAL,GRADINITA CU PROGRAM NORMAL MILCOV DEAL,MILCOVU DIN DEAL,,
25589158,2861100115,,628644,127411,127420,2861100115,OLT,,,,SCOALA GIMNAZIALA LELEASCA,SCOALA GIMNAZIALA LELEASCA,LELEASCA,,
25577498,2861101116,,6307905,126503,126512,2861101116,OLT,,,48,SCOALA GIMNAZIALA CUNGREA,SCOALA GIMNAZIALA CUNGREA,CUNGREA,PRINCIPALA,
,2862102551,2861101012,,126718,126727,2862102551,OLT,,,,GRADINITA CU PROGRAM NORMAL DOBROSLOVENI,GRADINITA CU PROGRAM NORMAL DOBROSLOVENI,DOBROSLOVENI,,
25571010,2861100852,,992007,130231,130240,2861100852,OLT,,,,SCOALA GIMNAZIALA VULTURESTI,SCOALA GIMNAZIALA VULTURESTI,VULTUREŞTI,,
,2862102126,2861100843,,128052,128061,2862102126,OLT,,,,GRADINITA CU PROGRAM NORMAL PERIETII DE SUS,GRADINITA CU PROGRAM NORMAL PERIETII DE SUS,PERIEŢI,,
25577528,2861100671,,627951,125757,125766,2861100671,OLT,,,35,SCOALA GIMNAZIALA BARASTI DE VEDE,SCOALA GIMNAZIALA BARASTI DE VEDE,BĂRĂŞTII DE VEDE,PRINCIPALA,
,2862101835,2861100169,,127386,127402,2862101835,OLT,,,,SCOALA GIMNAZIALA ALIMANESTI,SCOALA GIMNAZIALA ALIMANESTI,ALIMĂNEŞTI,,
,2862103706,2861100038,,130062,130071,2862103706,OLT,,,,SCOALA GIMNAZIALA VOINEASA,SCOALA GIMNAZIALA VOINEASA,VOINEASA,,
4286534,2861101048,,1182207,125418,125427,2861101048,OLT,,,123,COLEGIUL TEHNIC BALS,COLEGIUL TEHNIC BALS,BALŞ,NICOLAE BALCESCU,
,2862103597,2861104544,,129816,129834,2862103597,OLT,,,,SCOALA PRIMARA CAZANESTI,SCOALA PRIMARA CAZANESTI,CĂZĂNEŞTI,,
31049667,2861101401,,981773,125542,125551,2861101401,OLT,,,77,"""SCOALA GIMNAZIALA """"VIRGIL MAZILESCU"""" CORABIA""",SCOALA GIMNAZIALA VIRGIL MAZILESCU CORABIA,CORABIA,TUDOR VLADIMIRESCU,
,2862104684,2861100748,1109267,125472,125481,2862104684,OLT,,,,GRADINITA CU PROGRAM PRELUNGIT NR 1 CARACAL,GRADINITA CU PROGRAM PRELUNGIT NR 1 CARACAL,CARACAL,,
12938965,2861100133,,981711,125418,125427,2861100133,OLT,,,26,SCOALA GIMNAZIALA NR.1 BALS,SCOALA GIMNAZIALA NR 1 BALS,BALŞ,CIRESULUI,
,2862103516,2861100739,,125542,125551,2862103516,OLT,,,,"""SCOALA GIMNAZIALA """"CELEIU"""" CORABIA""",SCOALA GIMNAZIALA CELEIU CORABIA,CORABIA,,
,2862103665,2861100712,,128613,128631,2862103665,OLT,,,,GRADINITA CU PROGRAM NORMAL PLAVICENI,GRADINITA CU PROGRAM NORMAL PLAVICENI,PLĂVICENI,,
,2862103086,2861100151,,130302,125720,2862103086,OLT,,,,GRADINITA CU PROGRAM NORMAL GAVANESTI,GRADINITA CU PROGRAM NORMAL GAVANESTI,GĂVĂNEŞTI,,
14070065,2881101221,,1109540,125347,125356,2881101221,OLT,,,,CLUBUL SPORTIV SCOLAR SLATINA,CLUBUL SPORTIV SCOLAR SLATINA,SLATINA,,
,2862102108,2861100843,,128052,128098,2862102108,OLT,,,,SCOALA GIMNAZIALA MIERLESTII DE SUS,SCOALA GIMNAZIALA MIERLESTII DE SUS,MIERLEŞTII DE SUS,,
,2862101817,2861100305,,125999,126004,2862101817,OLT,,,,GRADINITA CU PROGRAM NORMAL BREBENI-SIRBI,GRADINITA CU PROGRAM NORMAL BREBENI SIRBI,BREBENI,,
,2862102117,2861100843,,128052,128098,2862102117,OLT,,,,GRADINITA CU PROGRAM NORMAL MIERLESTII DE SUS,GRADINITA CU PROGRAM NORMAL MIERLESTII DE SUS,MIERLEŞTII DE SUS,,
25299197,2861100332,,629193,128588,128597,2861100332,OLT,,,,SCOALA GIMNAZIALA NR.2 RUSANESTI,SCOALA GIMNAZIALA NR 2 RUSANESTI,RUSĂNEŞTI,,
25284161,2861100481,,628400,126978,126987,2861100481,OLT,,,297,SCOALA GIMNAZIALA FALCOIU,SCOALA GIMNAZIALA FALCOIU,FĂLCOIU,PRINCIPALA,
25299162,2861100151,,627949,130302,125720,2861100151,OLT,,,,SCOALA GIMNAZIALA GAVANESTI,SCOALA GIMNAZIALA GAVANESTI,GĂVĂNEŞTI,,
,2862104146,2861100332,,128588,128604,2862104146,OLT,,,,SCOALA GIMNAZIALA JIENI,SCOALA GIMNAZIALA JIENI,JIENI,,
