COD FISCAL,COD SIIIR,COD SIIIR SUP,COD SIRUES,SIRUTA LOC SUP,SIRUTA LOCALITATE,cod,judet,lat,lon,nr,nume,nume_ascii,oras,str,wikidata,
29150626,2961107197,,641309,131620,131639,2961107197,PRAHOVA,,,2,"""GRĂDINIȚA CU PROGRAM PRELUNGIT """"CLOPOȚICA"""""," ORAȘUL URLAȚI""",GRADINITA CU PROGRAM PRELUNGIT CLOPOTICA ORASUL URLATI,URLAŢI,TUDOR VLADIMIRESCU,
,2962103216,2961101517,641153,131407,131416,2962103216,PRAHOVA,,,2,"""GRĂDINIȚA CU PROGRAM NORMAL NR. 1"," ORAȘUL MIZIL""",GRADINITA CU PROGRAM NORMAL NR 1 ORASUL MIZIL,MIZIL,BLAJULUI,
,2962103184,2961102138,641086,131274,131292,2962103184,PRAHOVA,,,364,"""GRĂDINIȚA CU PROGRAM NORMAL", SAT BOBOLIA," COMUNA POIANA CÂMPINA""",GRADINITA CU PROGRAM NORMAL SAT BOBOLIA COMUNA POIANA CAMPINA,BOBOLIA,BOBOLIA
29001489,2961102875,,639588,135501,135510,2961102875,PRAHOVA,,,129A,"""ȘCOALA GIMNAZIALĂ """"MINERVA ALEXANDRESCU"""" COMUNA ȘOIMARI""",SCOALA GIMNAZIALA MINERVA ALEXANDRESCU COMUNA SOIMARI,ŞOIMARI,PRINCIPALĂ,,
,2962100977,2961102536,1148964,133722,133740,2962100977,PRAHOVA,,,1,"""GRĂDINIȚA CU PROGRAM NORMAL", SAT MOCEȘTI ," COMUNA IORDĂCHEANU""",GRADINITA CU PROGRAM NORMAL SAT MOCESTI COMUNA IORDACHEANU,MOCEŞTI,PRINCIPALĂ
,2962100986,2961102536,996821,133722,133731,2962100986,PRAHOVA,,,8A,"""GRĂDINIȚA CU PROGRAM NORMAL"," COMUNA IORDĂCHEANU""",GRADINITA CU PROGRAM NORMAL COMUNA IORDACHEANU,IORDĂCHEANU,PRINCIPALĂ,
,2962103917,2961102649,642298,133508,133553,2962103917,PRAHOVA,,,376,"""GRĂDINIȚA CU PROGRAM NORMAL", SAT POTIGRAFU," COMUNA GORGOTA""",GRADINITA CU PROGRAM NORMAL SAT POTIGRAFU COMUNA GORGOTA,POTIGRAFU,PRINCIPALĂ
2843744,2931100288,,996869,130534,130543,2931100288,PRAHOVA,,,35,CASA CORPULUI DIDACTIC PRAHOVA,CASA CORPULUI DIDACTIC PRAHOVA,PLOIEŞTI,DEMOCRAȚIEI,,
2845419,2961102943,,635283,130534,130543,2961102943,PRAHOVA,,,98,"""COLEGIUL NAȚIONAL """"ION LUCA CARAGIALE"""""," MUNICIPIUL PLOIEȘTI""",COLEGIUL NATIONAL ION LUCA CARAGIALE MUNICIPIUL PLOIESTI,PLOIEŞTI,GHEORGHE DOJA,
,2962104244,2961101544,996625,130847,130865,2962104244,PRAHOVA,,,398,"""GRĂDINIȚA CU PROGRAM NORMAL """"CURCUBEUL MAGIC""""", SAT COCOȘEȘTI," COMUNA PĂULEȘTI""",GRADINITA CU PROGRAM NORMAL CURCUBEUL MAGIC SAT COCOSESTI COMUNA PAULESTI,COCOŞEŞTI,TÂMPLĂRIEI
2843710,2961102296,,636718,131443,131452,2961102296,PRAHOVA,,,25,"""ȘCOALA GIMNAZIALĂ """"CAROL I"""""," ORAȘUL PLOPENI""",SCOALA GIMNAZIALA CAROL I ORASUL PLOPENI,PLOPENI,REPUBLICII,
2843205,2961101802,,637530,132574,132592,2961101802,PRAHOVA,,,1,"""ȘCOALA GIMNAZIALĂ", SAT SLON," COMUNA CERAȘU""",SCOALA GIMNAZIALA SAT SLON COMUNA CERASU,SLON,PRINCIPALĂ
,2962100602,2961102432,642884,135164,135182,2962100602,PRAHOVA,,,64,"""GRĂDINIȚA CU PROGRAM NORMAL NR. 1", SAT BORDENI," COMUNA SCORȚENI""",GRADINITA CU PROGRAM NORMAL NR 1 SAT BORDENI COMUNA SCORTENI,BORDENII MARI,MIHAI VITEAZUL
,2962106133,2961100032,643187,135896,135921,2962106133,PRAHOVA,,,406,"""GRĂDINIȚA CU PROGRAM NORMAL", SAT MAGULA," COMUNA TOMȘANI""",GRADINITA CU PROGRAM NORMAL SAT MAGULA COMUNA TOMSANI,MAGULA,PRINCIPALĂ
29168798,2961103044,,635661,130534,130543,2961103044,PRAHOVA,,,76,"""ȘCOALA GIMNAZIALĂ """"RADU STANIAN"""""," MUNICIPIUL PLOIEȘTI""",SCOALA GIMNAZIALA RADU STANIAN MUNICIPIUL PLOIESTI,PLOIEŞTI,Bobâlna,
,2962104728,2961102545,641543,132075,132119,2962104728,PRAHOVA,,,14,"""GRĂDINIȚA CU PROGRAM NORMAL", SAT STOENEȘTI," COMUNA ARICEȘTII RAHTIVANI""",GRADINITA CU PROGRAM NORMAL SAT STOENESTI COMUNA ARICESTII RAHTIVANI,STOENEŞTI,PRINCIPALĂ
29168887,2961101589,,635805,130534,130543,2961101589,PRAHOVA,,,8,"""ȘCOALA GIMNAZIALĂ """"ANTON PANN"""""," MUNICIPIUL PLOIEȘTI""",SCOALA GIMNAZIALA ANTON PANN MUNICIPIUL PLOIESTI,PLOIEŞTI,LUMINISULUI,
,2962103591,2961102604,641282,131577,131586,2962103591,PRAHOVA,,,24,"""GRĂDINIȚA CU PROGRAM NORMAL NR. 1"," ORAȘUL SLĂNIC""",GRADINITA CU PROGRAM NORMAL NR 1 ORASUL SLANIC,SLĂNIC,ȘTEFAN CEL MARE,
15303533,2961300195,,871370,131103,131121,2961300195,PRAHOVA,,,13,"""LICEUL TEHNOLOGIC UCECOM """"SPIRU HARET"""" BREAZA""",LICEUL TEHNOLOGIC UCECOM SPIRU HARET BREAZA,BREAZA DE SUS,VASILE ALECSANDRI,,
29164745,2961102468,,639150,134942,134951,2961102468,PRAHOVA,,,1,"""ȘCOALA GIMNAZIALĂ"," COMUNA PUCHENII MARI""",SCOALA GIMNAZIALA COMUNA PUCHENII MARI,PUCHENII MARI,DN1,
,2962104642,2961101987,636146,130785,130810,2962104642,PRAHOVA,,,6,"""ȘCOALA GIMNAZIALĂ", SAT CHIȚORANI," COMUNA BUCOV""",SCOALA GIMNAZIALA SAT CHITORANI COMUNA BUCOV,CHIŢORANI,CHIȚORANI
,2962106834,2961101639,639966,135949,135958,2962106834,PRAHOVA,,,195,"""ȘCOALA GIMNAZIALĂ", SAT NICOVANI," COMUNA VALEA CĂLUGAREASCĂ""",SCOALA GIMNAZIALA SAT NICOVANI COMUNA VALEA CALUGAREASCA,VALEA CĂLUGĂREASCĂ,NICOVANI
,2962100665,2961106992,967961,133722,133786,2962100665,PRAHOVA,,,1,"""GRĂDINIȚA CU PROGRAM NORMAL", SAT VĂRBILA," COMUNA IORDĂCHEANU""",GRADINITA CU PROGRAM NORMAL SAT VARBILA COMUNA IORDACHEANU,VĂRBILA,PRINCIPALĂ
,2962104963,2961103089,641842,132681,132690,2962104963,PRAHOVA,,,1174 B,"""GRĂDINIȚA CU PROGRAM NORMAL", SAT CIORANII DE JOS," COMUNA CIORANI""",GRADINITA CU PROGRAM NORMAL SAT CIORANII DE JOS COMUNA CIORANI,CIORANII DE JOS,PRINCIPALĂ
,2962105566,2961107369,637932,133090,133116,2962105566,PRAHOVA,,,111,"""ȘCOALA GIMNAZIALĂ", SAT CIUPELNIȚA," COMUNA DUMBRAVA""",SCOALA GIMNAZIALA SAT CIUPELNITA COMUNA DUMBRAVA,CIUPELNIŢA,PRINCIPALĂ
,2962106956,2961102708,640185,130534,130543,2962106956,PRAHOVA,,,62B,"""GRĂDINIȚA CU PROGRAM NORMAL NR. 10"," MUNICIPIUL PLOIEȘTI""",GRADINITA CU PROGRAM NORMAL NR 10 MUNICIPIUL PLOIESTI,PLOIEŞTI,RARIȘTEI,
2843108,2961101829,,639057,134755,134764,2961101829,PRAHOVA,,,203,"""ȘCOALA GIMNAZIALĂ """"MĂNĂSTIREANU MIHAI"""""," COMUNA PREDEAL-SĂRARI""",SCOALA GIMNAZIALA MANASTIREANU MIHAI COMUNA PREDEAL SARARI,PREDEAL,PRINCIPALĂ,
2843884,2961107437,,1182233,130534,130543,2961107437,PRAHOVA,,,16,"""LICEUL TEHNOLOGIC """"1 MAI"""""," MUNICIPIUL PLOIEȘTI""",LICEUL TEHNOLOGIC 1 MAI MUNICIPIUL PLOIESTI,PLOIEŞTI,Petrolului,
,2962106332,2961101612,636407,131103,131158,2962106332,PRAHOVA,,,1,"""ȘCOALA GIMNAZIALĂ NISTOREȘTI"," ORAȘUL BREAZA""",SCOALA GIMNAZIALA NISTORESTI ORASUL BREAZA,NISTOREŞTI,DN1,
29006400,2961102147,,637281,132271,132280,2961102147,PRAHOVA,,,252,"""LICEUL TEHNOLOGIC"," COMUNA BĂLȚEȘTI""",LICEUL TEHNOLOGIC COMUNA BALTESTI,BĂLŢEŞTI,BĂLȚEȘTI,
29049592,2961102685,,637205,132164,132173,2961102685,PRAHOVA,,,355,"""ȘCOALA GIMNAZIALĂ"," COMUNA BABA ANA""",SCOALA GIMNAZIALA COMUNA BABA ANA,BABA ANA,PRINCIPALĂ,
,2962106807,2961107202,635867,130534,130543,2962106807,PRAHOVA,,,14,"""ȘCOALA PRIMARĂ NR. 22"," MUNICIPIUL PLOIEȘTI""",SCOALA PRIMARA NR 22 MUNICIPIUL PLOIESTI,PLOIEŞTI,Ciocârliei,
,2962104556,2961102961,639112,134853,134871,2962104556,PRAHOVA,,,66,"""ȘCOALA PRIMARĂ", SAT DRĂGĂNEASA," COMUNA PROVIȚA DE JOS""",SCOALA PRIMARA SAT DRAGANEASA COMUNA PROVITA DE JOS,DRĂGĂNEASA,PRINCIPALĂ
,2962105218,2961100109,643242,136134,136152,2962105218,PRAHOVA,,,32B,"""GRĂDINIȚA CU PROGRAM NORMAL", SAT COȚOFENEȘTI," COMUNA VĂRBILĂU""",GRADINITA CU PROGRAM NORMAL SAT COTOFENESTI COMUNA VARBILAU,COŢOFENEŞTI,COȚOFENEȘTI
,2962106793,2961107202,640288,130534,130543,2962106793,PRAHOVA,,,29,"""GRĂDINIȚA CU PROGRAM NORMAL NR. 20"," MUNICIPIUL PLOIEȘTI""",GRADINITA CU PROGRAM NORMAL NR 20 MUNICIPIUL PLOIESTI,PLOIEŞTI,Trestioara,
,2962100412,2961102007,637413,132404,132431,2962100412,PRAHOVA,,,1,"""ȘCOALA GIMNAZIALĂ", SAT PIETRICEAUA," COMUNA BREBU""",SCOALA GIMNAZIALA SAT PIETRICEAUA COMUNA BREBU,PIETRICEAUA,PIETRICEAUA
,2962104886,2961102744,1148926,131336,131381,2962104886,PRAHOVA,,,118,"""GRĂDINIȚA CU PROGRAM NORMAL POSADA"," ORAȘUL COMARNIC""",GRADINITA CU PROGRAM NORMAL POSADA ORASUL COMARNIC,POSADA,PODU-VÎRTOS,
,2962104131,2961107021,638259,133562,133571,2962104131,PRAHOVA,,,68,"""ȘCOALA PRIMARĂ", SAT CUIB," COMUNA GORNET""",SCOALA PRIMARA SAT CUIB COMUNA GORNET,GORNET,CUIB
,2962104081,2961100317,636029,130614,130650,2962104081,PRAHOVA,,,144B,"""ȘCOALA GIMNAZIALĂ", SAT CORLĂTEȘTI," COMUNA BERCENI""",SCOALA GIMNAZIALA SAT CORLATESTI COMUNA BERCENI,CORLĂTEŞTI,ȘCOLII
28943518,2961100163,,640068,136198,136205,2961100163,PRAHOVA,,,358,"""ȘCOALA GIMNAZIALĂ"," COMUNA VÎLCANEȘTI""",SCOALA GIMNAZIALA COMUNA VILCANESTI,VÂLCĂNEŞTI,PRINCIPALĂ,
,2962101214,2941102015,2904245,131407,131416,2962101214,PRAHOVA,,,111-113,"""CABINETUL LOGOPEDIC NR. 9 DE PE LÂNGĂ LICEUL TEORETIC """"GRIGORE TOCILESCU"""" MIZIL""",CABINETUL LOGOPEDIC NR 9 DE PE LANGA LICEUL TEORETIC GRIGORE TOCILESCU MIZIL,MIZIL,NICOLAE BĂLCESCU,,
,2962103207,2961102572,642860,135146,135155,2962103207,PRAHOVA,,,1,"""GRĂDINIȚA CU PROGRAM NORMAL"," COMUNA SĂLCIILE""",GRADINITA CU PROGRAM NORMAL COMUNA SALCIILE,SĂLCIILE,PRINCIPALĂ,
29000130,2961102441,,639370,135244,135253,2961102441,PRAHOVA,,,83,"""LICEUL TEHNOLOGIC"," COMUNA SÎNGERU""",LICEUL TEHNOLOGIC COMUNA SINGERU,SÂNGERU,PRINCIPALĂ,
2844618,2961102622,,635403,131620,131639,2961102622,PRAHOVA,,,30,"""LICEUL TEORETIC """"BRÂNCOVEANU VODĂ"""""," ORAȘUL URLAȚI""",LICEUL TEORETIC BRANCOVEANU VODA ORASUL URLATI,URLAŢI,01.mai,
,2962104158,2961107333,641218,131461,131498,2962104158,PRAHOVA,,,4,"""GRĂDINIȚA CU PROGRAM NORMAL", SAT MĂLĂIEȘTII DE JOS," COMUNA DUMBRĂVEȘTI""",GRADINITA CU PROGRAM NORMAL SAT MALAIESTII DE JOS COMUNA DUMBRAVESTI,MĂLĂEŞTII DE JOS,PRINCIPALĂ
29049711,2961102025,,638819,134390,134407,2961102025,PRAHOVA,,,138,"""ȘCOALA GIMNAZIALĂ"," COMUNA PLOPU""",SCOALA GIMNAZIALA COMUNA PLOPU,PLOPU,PRINCIPALĂ,
3197072,2961301861,,871368,130534,130543,2961301861,PRAHOVA,,,27,"""LICEUL TEHNOLOGIC UCECOM """"SPIRU HARET"""" PLOIEȘTI""",LICEUL TEHNOLOGIC UCECOM SPIRU HARET PLOIESTI,PLOIEŞTI,Ionescu Toma,,
,2962105792,2961102581,967959,133688,133704,2962105792,PRAHOVA,,,372,"""GRĂDINIȚA CU PROGRAM NORMAL", SAT PERȘUNARI," COMUNA GURA VADULUI""",GRADINITA CU PROGRAM NORMAL SAT PERSUNARI COMUNA GURA VADULUI,PERŞUNARI,PORUMBIȚEI
29001624,2961102527,,639916,135949,135985,2961102527,PRAHOVA,,,94,"""ȘCOALA GIMNAZIALĂ", SAT DÎRVARI," COMUNA VALEA CĂLUGĂREASCĂ""",SCOALA GIMNAZIALA SAT DIRVARI COMUNA VALEA CALUGAREASCA,DÂRVARI,DÂRVARI
,2962106653,2961107283,640472,130534,130543,2962106653,PRAHOVA,,,4,"""GRĂDINIȚA CU PROGRAM NORMAL NR. 39"," MUNICIPIUL PLOIEȘTI""",GRADINITA CU PROGRAM NORMAL NR 39 MUNICIPIUL PLOIESTI,PLOIEŞTI,EREMIA GRIGORESCU,
,2962106314,2961101612,375601,131103,131158,2962106314,PRAHOVA,,,1,"""GRĂDINIȚA CU PROGRAM NORMAL """"PETER PAN"""" NISTOREȘTI"," ORAȘUL BREAZA""",GRADINITA CU PROGRAM NORMAL PETER PAN NISTORESTI ORASUL BREAZA,NISTOREŞTI,DN1,
,2962105548,2961107369,637920,133090,133152,2962105548,PRAHOVA,,,242,"""ȘCOALA PRIMARĂ", SAT ZĂNOAGA," COMUNA DUMBRAVA""",SCOALA PRIMARA SAT ZANOAGA COMUNA DUMBRAVA,ZĂNOAGA,PRINCIPALA
639538,2961102165,,639538,135431,135486,2961102165,PRAHOVA,,,160,"""ȘCOALA GIMNAZIALĂ", SAT TĂRICENI," COMUNA ȘIRNA""",SCOALA GIMNAZIALA SAT TARICENI COMUNA SIRNA,TĂRICENI,PRINCIPALĂ
,2962105376,2961101811,640161,130534,130543,2962105376,PRAHOVA,,,83,"""GRĂDINIȚA CU PROGRAM NORMAL NR. 8"," MUNICIPIUL PLOIEȘTI""",GRADINITA CU PROGRAM NORMAL NR 8 MUNICIPIUL PLOIESTI,PLOIEŞTI,Traian,
2843833,2961101847,,959031,130534,130543,2961101847,PRAHOVA,,,14,"""COLEGIUL TEHNIC """"LAZĂR EDELEANU"""""," MUNICIPIUL PLOIEȘTI""",COLEGIUL TEHNIC LAZAR EDELEANU MUNICIPIUL PLOIESTI,PLOIEŞTI,PETROLULUI,
,2962106825,2961100294,642901,135226,135235,2962106825,PRAHOVA,,,19,"""GRĂDINIȚA CU PROGRAM NORMAL"," COMUNA SECĂRIA""",GRADINITA CU PROGRAM NORMAL COMUNA SECARIA,SECĂRIA,PRINCIPALA,
,2962104208,2961102301,640848,131069,131078,2962104208,PRAHOVA,,,36,"""GRĂDINIȚA CU PROGRAM NORMAL NR. 3"," ORAȘUL BOLDEȘTI-SCĂENI""",GRADINITA CU PROGRAM NORMAL NR 3 ORASUL BOLDESTI SCAENI,BOLDEŞTI-SCĂENI,MORII,
29011849,2961101458,,638027,133214,133250,2961101458,PRAHOVA,,,86,"""ȘCOALA GIMNAZIALĂ", SAT MĂRGINENII DE JOS," COMUNA FILIPEȘTII DE TÎRG""",SCOALA GIMNAZIALA SAT MARGINENII DE JOS COMUNA FILIPESTII DE TIRG,MĂRGINENII DE JOS,MĂRGINENII DE JOS
2845702,2971102283,,6606650,130534,130543,2971102283,PRAHOVA,,,239,"""PALATUL COPIILOR"," MUNICIPIUL PLOIEȘTI""",PALATUL COPIILOR MUNICIPIUL PLOIESTI,PLOIEŞTI,Mărăşeşti,
,2962104072,2961100317,636005,130614,130669,2962104072,PRAHOVA,,,106C,"""ȘCOALA PRIMARĂ", SAT MOARA NOUĂ," COMUNA BERCENI""",SCOALA PRIMARA SAT MOARA NOUA COMUNA BERCENI,MOARA NOUĂ,ȘCOLII
,2962106689,2961102364,641660,132342,132351,2962106689,PRAHOVA,,,660A,"""GRĂDINIȚA CU PROGRAM NORMAL NR. 1"," COMUNA BERTEA""",GRADINITA CU PROGRAM NORMAL NR 1 COMUNA BERTEA,BERTEA,PRINCIPALĂ,
,2962104927,2961101856,637487,132510,132556,2962104927,PRAHOVA,,,52,"""ȘCOALA GIMNAZIALĂ", SAT ROTARI," COMUNA CEPTURA""",SCOALA GIMNAZIALA SAT ROTARI COMUNA CEPTURA,ROTARI,PRINCIPALĂ
2843868,2961102129,,635477,130534,130543,2961102129,PRAHOVA,,,328,"""COLEGIUL TEHNIC """"TOMA N. SOCOLESCU"""""," MUNICIPIUL PLOIEȘTI""",COLEGIUL TEHNIC TOMA N SOCOLESCU MUNICIPIUL PLOIESTI,PLOIEŞTI,GHE GR.CANTACUZINO,
29001403,2961107324,,638273,133615,133624,2961107324,PRAHOVA,,,154,"""ȘCOALA GIMNAZIALĂ"," COMUNA GORNET-CRICOV""",SCOALA GIMNAZIALA COMUNA GORNET CRICOV,GORNET-CRICOV,GORNET-CRICOV,
29169963,2961101603,,640460,130534,130543,2961101603,PRAHOVA,,,23,"""GRĂDINIȚA CU PROGRAM PRELUNGIT NR. 38"," MUNICIPIUL PLOIEȘTI""",GRADINITA CU PROGRAM PRELUNGIT NR 38 MUNICIPIUL PLOIESTI,PLOIEŞTI,POȘTEI,
,2962105806,2961102581,375584,133688,133697,2962105806,PRAHOVA,,,361,"""GRĂDINIȚA CU PROGRAM NORMAL"," COMUNA GURA VADULUI""",GRADINITA CU PROGRAM NORMAL COMUNA GURA VADULUI,GURA VADULUI,PRINCIPALĂ,
,2962106513,2961102174,967739,131899,131906,2962106513,PRAHOVA,,,18,"""GRĂDINIȚA CU PROGRAM NORMAL """"CASTELUL PITICILOR"""""," COMUNA ADUNAȚI""",GRADINITA CU PROGRAM NORMAL CASTELUL PITICILOR COMUNA ADUNATI,ADUNAŢI,PRINCIPALA,
,2962103623,2961102183,639863,135850,135878,2962103623,PRAHOVA,,,255,"""ȘCOALA PRIMARĂ", SAT PREDEȘTI," COMUNA TINOSU""",SCOALA PRIMARA SAT PREDESTI COMUNA TINOSU,PREDEŞTI,PREDEȘTI
,2962106377,2961102527,639930,135949,135994,2962106377,PRAHOVA,,,294,"""ȘCOALA PRIMARĂ", SAT PANTAZI," COMUNA VALEA CĂLUGĂREASCĂ""",SCOALA PRIMARA SAT PANTAZI COMUNA VALEA CALUGAREASCA,PANTAZI,PANTAZI
,2962105313,2961107324,6608309,133615,133651,2962105313,PRAHOVA,,,91A,"""GRĂDINIȚA CU PROGRAM NORMAL", SAT PRISEACA," COMUNA GORNET-CRICOV""",GRADINITA CU PROGRAM NORMAL SAT PRISEACA COMUNA GORNET CRICOV,PRISEACA,PRISEACA
,2962102857,2961102563,1148938,131540,131559,2962102857,PRAHOVA,,,2,"""GRĂDINIȚA CU PROGRAM PRELUNGIT """"FLOARE DE COLȚ"""""," ORAȘUL SINAIA""",GRADINITA CU PROGRAM PRELUNGIT FLOARE DE COLT ORASUL SINAIA,SINAIA,SPITALULUI,
,2962104045,2961100317,1104102,130614,130623,2962104045,PRAHOVA,,,358A,"""GRĂDINIȚA CU PROGRAM NORMAL NR. 2"," COMUNA BERCENI""",GRADINITA CU PROGRAM NORMAL NR 2 COMUNA BERCENI,BERCENI,GRĂDINIȚEI,
14666735,2961202335,,6652051,130534,130543,2961202335,PRAHOVA,,,22,"""ȘCOALA POSTLICEALĂ SANITARĂ """"REGINA MARIA DE ROMÂNIA"""" PLOIEȘTI""",SCOALA POSTLICEALA SANITARA REGINA MARIA DE ROMANIA PLOIESTI,PLOIEŞTI,Vestului,,
,2962104262,2961102875,643046,135501,135510,2962104262,PRAHOVA,,,129,"""GRĂDINIȚA CU PROGRAM NORMAL"," COMUNA ȘOIMARI""",GRADINITA CU PROGRAM NORMAL COMUNA SOIMARI,ŞOIMARI,PRINCIPALĂ,
29165830,2961102061,,6613732,130534,130543,2961102061,PRAHOVA,,,2,"""ȘCOALA GIMNAZIALĂ """"I.A.BASSARABESCU"""""," MUNICIPIUL PLOIEȘTI""",SCOALA GIMNAZIALA I A BASSARABESCU MUNICIPIUL PLOIESTI,PLOIEŞTI,Strunga,
,2962104651,2961101987,640654,130785,130794,2962104651,PRAHOVA,,,3,"""GRĂDINIȚA CU PROGRAM NORMAL"," COMUNA BUCOV""",GRADINITA CU PROGRAM NORMAL COMUNA BUCOV,BUCOV,BUCOV,
2845494,2961101476,,639722,135681,135707,2961101476,PRAHOVA,,,95,"""ȘCOALA GIMNAZIALĂ """"PROFESOR EUGENIU CORBU""""", SAT PODGORIA," COMUNA TĂTARU""",SCOALA GIMNAZIALA PROFESOR EUGENIU CORBU SAT PODGORIA COMUNA TATARU,PODGORIA,PRINCIPALĂ
,2962101051,2961100204,643084,135725,135752,2962101051,PRAHOVA,,,147,"""GRĂDINIȚA CU PROGRAM NORMAL", SAT OLTENI," COMUNA TEIȘANI""",GRADINITA CU PROGRAM NORMAL SAT OLTENI COMUNA TEISANI,OLTENI,PRINCIPALĂ
29181398,2961106974,,640252,130534,130543,2961106974,PRAHOVA,,,97,"""GRĂDINIȚA CU PROGRAM PRELUNGIT """"SCUFIȚA ROȘIE"""""," MUNICIPIUL PLOIEȘTI""",GRADINITA CU PROGRAM PRELUNGIT SCUFITA ROSIE MUNICIPIUL PLOIESTI,PLOIEŞTI,Mircea cel Bătrân,
,2952103464,2951101679,635635,131407,131416,2952103464,PRAHOVA,,,116,"""CLUBUL COPIILOR """"MARIAN FRANGULEA"""" "," ORAȘUL MIZIL""",CLUBUL COPIILOR MARIAN FRANGULEA ORASUL MIZIL,MIZIL,TEILOR,
,2962103406,2961102667,641866,132681,132707,2962103406,PRAHOVA,,,78,"""GRĂDINIȚA CU PROGRAM NORMAL", SAT CIORANII DE SUS," COMUNA CIORANI""",GRADINITA CU PROGRAM NORMAL SAT CIORANII DE SUS COMUNA CIORANI,CIORANII DE SUS,PRINCIPALĂ
,2962106011,2961100181,642810,135020,135066,2962106011,PRAHOVA,,,167,"""GRADINIȚA CU PROGRAM NORMAL", SAT BUDA," COMUNA RÎFOV""",GRADINITA CU PROGRAM NORMAL SAT BUDA COMUNA RIFOV,BUDA,PRINCIPALĂ
,2962100914,2961101829,642688,134755,134764,2962100914,PRAHOVA,,,68,"""GRĂDINIȚA CU PROGRAM NORMAL"," COMUNA PREDEAL SĂRARI""",GRADINITA CU PROGRAM NORMAL COMUNA PREDEAL SARARI,PREDEAL,PRINCIPALĂ,
,2962100579,2961101639,1194999,135949,136009,2962100579,PRAHOVA,,,16B,"""GRĂDINIȚA CU PROGRAM NORMAL """"CĂSUȚA FERMECATĂ""""", SAT RACHIERI," COMUNA VALEA CĂLUGĂREASCĂ""",GRADINITA CU PROGRAM NORMAL CASUTA FERMECATA SAT RACHIERI COMUNA VALEA CALUGAREASCA,RACHIERI,RACHIERI
,2962105503,2961107039,642107,133161,133198,2962105503,PRAHOVA,,,1,"""GRĂDINIȚA CU PROGRAM NORMAL", SAT MINIERI," COMUNA FILIPEȘTII DE PĂDURE""",GRADINITA CU PROGRAM NORMAL SAT MINIERI COMUNA FILIPESTII DE PADURE,MINIERI,MINIER
,2962105055,2961102052,640111,130534,130543,2962105055,PRAHOVA,,,49,"""GRĂDINIȚA CU PROGRAM NORMAL NR. 3"," MUNICIPIUL PLOIEȘTI""",GRADINITA CU PROGRAM NORMAL NR 3 MUNICIPIUL PLOIESTI,PLOIEŞTI,Cantacuzino Gheorghe Grigore,
30624340,2961207417,,6917906,130847,130856,2961207417,PRAHOVA,,,1021B,"""ȘCOALA PRIMARĂ """"ANGELS"""" PĂULEȘTI""",SCOALA PRIMARA ANGELS PAULESTI,PĂULEŞTI,PRINCIPALĂ,,
,2962104909,2961102301,640836,131069,131078,2962104909,PRAHOVA,,,2A,"""GRĂDINIȚA CU PROGRAM NORMAL NR. 2"," ORAȘUL BOLDEȘTI-SCĂENI""",GRADINITA CU PROGRAM NORMAL NR 2 ORASUL BOLDESTI SCAENI,BOLDEŞTI-SCĂENI,FAGULUI,
,2962103279,2961101779,637243,132226,132262,2962103279,PRAHOVA,,,85,"""ȘCOALA GIMNAZIALĂ", SAT LACU TURCULUI," COMUNA BALTA DOAMNEI""",SCOALA GIMNAZIALA SAT LACU TURCULUI COMUNA BALTA DOAMNEI,LACU TURCULUI,PRINCIPALĂ
,2962106766,2961102269,6608232,132011,132020,2962106766,PRAHOVA,,,91,"""GRĂDINIȚA CU PROGRAM NORMAL"," COMUNA APOSTOLACHE""",GRADINITA CU PROGRAM NORMAL COMUNA APOSTOLACHE,APOSTOLACHE,AL.I.CUZA,
2844316,2961101883,,806703,130552,130561,2961101883,PRAHOVA,,,368A,"""LICEUL TEHNOLOGIC AGRICOL"," COMUNA BĂRCĂNEȘTI""",LICEUL TEHNOLOGIC AGRICOL COMUNA BARCANESTI,BĂRCĂNEŞTI,DN 1,
,2962100819,2961100077,641012,131256,131265,2962100819,PRAHOVA,,,5,"""GRĂDINITA CU PROGRAM NORMAL NR. 5"," MUNICIPIUL CÂMPINA""",GRADINITA CU PROGRAM NORMAL NR 5 MUNICIPIUL CAMPINA,CÂMPINA,NICOLAE BĂLCESCU,
,2962106427,2961100172,642652,134648,134693,2962106427,PRAHOVA,,,1,"""GRĂDINIȚA CU PROGRAM NORMAL", SAT NUCȘOARA DE JOS," COMUNA POSEȘTI""",GRADINITA CU PROGRAM NORMAL SAT NUCSOARA DE JOS COMUNA POSESTI,NUCŞOARA DE JOS,PRINCIPALĂ
,2962105991,2961100181,642834,135020,135093,2962105991,PRAHOVA,,,112,"""GRĂDINIȚA CU PROGRAM NORMAL", SAT MOARA DOMNEASCĂ," COMUNA RÎFOV""",GRADINITA CU PROGRAM NORMAL SAT MOARA DOMNEASCA COMUNA RIFOV,MOARA DOMNEASCĂ,PRINCIPALĂ
,2962101295,2961101725,640783,130981,131005,2962101295,PRAHOVA,,,104,"""GRĂDINIȚA CU PROGRAM NORMAL DÎMBU"," ORAȘUL BĂICOI""",GRADINITA CU PROGRAM NORMAL DIMBU ORASUL BAICOI,DÂMBU,DOROBANȚI,
29012348,2961107333,,636720,131461,131470,2961107333,PRAHOVA,,,70,"""ȘCOALA GIMNAZIALĂ"," COMUNA DUMBRĂVEȘTI""",SCOALA GIMNAZIALA COMUNA DUMBRAVESTI,DUMBRĂVEŞTI,DUMBRĂVEȘTI,
,2962105195,2961100109,643254,136134,136161,2962105195,PRAHOVA,,,52A,"""GRĂDINIȚA CU PROGRAM NORMAL", SAT LIVADEA," COMUNA VĂRBILĂU""",GRADINITA CU PROGRAM NORMAL SAT LIVADEA COMUNA VARBILAU,LIVADEA,LIVADEA
29038925,2961100181,,639265,135020,135066,2961100181,PRAHOVA,,,167,"""ȘCOALA GIMNAZIALĂ", SAT BUDA," COMUNA RÎFOV""",SCOALA GIMNAZIALA SAT BUDA COMUNA RIFOV,BUDA,PRINCIPALĂ
,2962105498,2961107039,1234634,133161,133170,2962105498,PRAHOVA,,,636,"""GRĂDINIȚA CU PROGRAM NORMAL NR. 1"," COMUNA FILIPEȘTII DE PĂDURE""",GRADINITA CU PROGRAM NORMAL NR 1 COMUNA FILIPESTII DE PADURE,FILIPEŞTII DE PĂDURE,GĂRII,
29006397,2961107116,,637633,132752,132761,2961107116,PRAHOVA,,,384D,"""ȘCOALA GIMNAZIALĂ"," COMUNA COLCEAG""",SCOALA GIMNAZIALA COMUNA COLCEAG,COLCEAG,PRINCIPALĂ,
2845273,2961102233,,635324,130981,130990,2961102233,PRAHOVA,,,111,"""LICEUL TEHNOLOGIC """"CONSTANTIN CANTACUZINO"""""," ORAȘUL BĂICOI""",LICEUL TEHNOLOGIC CONSTANTIN CANTACUZINO ORASUL BAICOI,BĂICOI,REPUBLICII,
,2962106861,2961107197,996728,131620,131791,2962106861,PRAHOVA,,,1,"""GRĂDINIȚA CU PROGRAM NORMAL VALEA URLOII"," ORAȘUL URLAȚI""",GRADINITA CU PROGRAM NORMAL VALEA URLOII ORASUL URLATI,VALEA URLOII,PRINCIPALĂ,
,2962106436,2961100172,639019,134648,134737,2962106436,PRAHOVA,,,1A,"""ȘCOALA PRIMARĂ", SAT VALEA SCREZII," COMUNA POSEȘTI""",SCOALA PRIMARA SAT VALEA SCREZII COMUNA POSESTI,VALEA SCREZII,PRINCIPALĂ
,2962105299,2961107324,642315,133615,133660,2962105299,PRAHOVA,,,25,"""GRĂDINIȚA CU PROGRAM NORMAL", SAT ȚĂRCULEȘTI," COMUNA GORNET-CRICOV""",GRADINITA CU PROGRAM NORMAL SAT TARCULESTI COMUNA GORNET CRICOV,ŢĂRCULEŞTI,ȚĂRCULEȘTI
,2962100552,2961107116,637669,132752,132798,2962100552,PRAHOVA,,,2,"""ȘCOALA PRIMARĂ", SAT VÎLCELELE," COMUNA COLCEAG""",SCOALA PRIMARA SAT VILCELELE COMUNA COLCEAG,VÂLCELELE,PRINCIPALĂ
,2962103926,2961102649,638211,133508,133544,2962103926,PRAHOVA,,,88,"""ȘCOALA GIMNAZIALĂ", SAT POIENARII APOSTOLI," COMUNA GORGOTA""",SCOALA GIMNAZIALA SAT POIENARII APOSTOLI COMUNA GORGOTA,POIENARII APOSTOLI,PRINCIPALĂ
,2962101268,2961107048,635984,130552,130605,2962101268,PRAHOVA,,,26D,"""ȘCOALA GIMNAZIALĂ", SAT TĂTĂRANI," COMUNA BĂRCĂNEȘTI""",SCOALA GIMNAZIALA SAT TATARANI COMUNA BARCANESTI,TĂTĂRANI,PRINCIPALĂ
29006435,2961101734,,637671,132805,132814,2961101734,PRAHOVA,,,480,"""ȘCOALA GIMNAZIALĂ """"PROFESOR CRISTEA STĂNESCU"""""," COMUNA CORNU""",SCOALA GIMNAZIALA PROFESOR CRISTEA STANESCU COMUNA CORNU,CORNU DE JOS,EROILOR,
,2952106788,2951107007,635594,130981,130990,2952106788,PRAHOVA,,,6,"""CLUBUL COPIILOR"," ORAȘUL BĂICOI""",CLUBUL COPIILOR ORASUL BAICOI,BĂICOI,UNIRII,
,2962100796,2961102405,640941,131210,131229,2962100796,PRAHOVA,,,4,"""GRĂDINIȚA CU PROGRAM NORMAL NR. 3"," ORAȘUL BUȘTENI""",GRADINITA CU PROGRAM NORMAL NR 3 ORASUL BUSTENI,BUŞTENI,URLĂTORII,
2845672,2961101779,,637255,132226,132235,2961101779,PRAHOVA,,,236,"""ȘCOALA GIMNAZIALĂ """"SFINȚII ÎMPĂRAȚI"""""," COMUNA BALTA DOAMNEI""",SCOALA GIMNAZIALA SFINTII IMPARATI COMUNA BALTA DOAMNEI,BALTA DOAMNEI,PRINCIPALĂ,
,2962106409,2961100172,639021,134648,134693,2962106409,PRAHOVA,,,1A,"""ȘCOALA GIMNAZIALĂ", SAT NUCȘOARA DE JOS," COMUNA POSEȘTI""",SCOALA GIMNAZIALA SAT NUCSOARA DE JOS COMUNA POSESTI,NUCŞOARA DE JOS,PRINCIPALĂ
9467990,2961107315,,635790,130534,130543,2961107315,PRAHOVA,,,25A,"""ȘCOALA GIMNAZIALĂ """"MIHAI EMINESCU"""""," MUNICIPIUL PLOIEȘTI""",SCOALA GIMNAZIALA MIHAI EMINESCU MUNICIPIUL PLOIESTI,PLOIEŞTI,BUCUREȘTI,
,2962100905,2961101829,642690,134755,134835,2962100905,PRAHOVA,,,39,"""GRĂDINIȚA CU PROGRAM NORMAL", SAT VITIOARA DE SUS," COMUNA PREDEAL SĂRARI""",GRADINITA CU PROGRAM NORMAL SAT VITIOARA DE SUS COMUNA PREDEAL SARARI,VITIOARA DE SUS,PRINCIPALĂ
,2962100493,2961102165,643010,135431,135477,2962100493,PRAHOVA,,,8,"""GRĂDINIȚA CU PROGRAM NORMAL", SAT HĂBUD," COMUNA ȘIRNA""",GRADINITA CU PROGRAM NORMAL SAT HABUD COMUNA SIRNA,HĂBUD,PRINCIPALĂ
,2962101345,2961101707,637877,133018,133036,2962101345,PRAHOVA,,,1,"""ȘCOALA PRIMARĂ """"LEONIDA SECREȚEANU""""", SAT BĂRĂITARU," COMUNA DRĂGĂNEȘTI""",SCOALA PRIMARA LEONIDA SECRETEANU SAT BARAITARU COMUNA DRAGANESTI,BĂRĂITARU,PRINCIPALĂ
,2962106178,2961102726,640628,130712,130730,2962106178,PRAHOVA,,,73,"""GRĂDINIȚA CU PROGRAM NORMAL", SAT BĂTEȘTI," COMUNA BRAZI""",GRADINITA CU PROGRAM NORMAL SAT BATESTI COMUNA BRAZI,BĂTEŞTI,MIHAI EMINESCU
14374579,2961101924,,640381,130534,130543,2961101924,PRAHOVA,,,25A,"""GRĂDINIȚA CU PROGRAM PRELUNGIT NR. 30"," MUNICIPIUL PLOIEȘTI""",GRADINITA CU PROGRAM PRELUNGIT NR 30 MUNICIPIUL PLOIESTI,PLOIEŞTI,BUCURESTI,
5500430,2961207272,,6614140,130534,130543,2961207272,PRAHOVA,,,28,"""ȘCOALA POSTLICEALĂ SANITARĂ """"THOMA IONESCU"""" PLOIEȘTI""",SCOALA POSTLICEALA SANITARA THOMA IONESCU PLOIESTI,PLOIEŞTI,PREDEAL,,
,2962106558,2961107134,996778,132841,132850,2962106558,PRAHOVA,,,12,"""GRĂDINIȚA CU PROGRAM NORMAL", SAT COSMINA DE JOS," COMUNA COSMINELE""",GRADINITA CU PROGRAM NORMAL SAT COSMINA DE JOS COMUNA COSMINELE,COSMINA DE JOS,PRINCIPALĂ
28977421,2961102007,,637372,132404,132413,2961102007,PRAHOVA,,,799,"""ȘCOALA GIMNAZIALĂ """"MATEI BASARAB"""""," COMUNA BREBU""",SCOALA GIMNAZIALA MATEI BASARAB COMUNA BREBU,BREBU MÂNĂSTIREI,BREBU MÂNĂSTIREI,
,2962104009,2961103062,640214,130534,130543,2962104009,PRAHOVA,,,94,"""GRĂDINIȚA CU PROGRAM NORMAL """"CHEIȚA DE AUR"""""," MUNICIPIUL PLOIEȘTI""",GRADINITA CU PROGRAM NORMAL CHEITA DE AUR MUNICIPIUL PLOIESTI,PLOIEŞTI,RUDULUI,
,2962106897,2961106983,642420,133964,134005,2962106897,PRAHOVA,,,281,"""GRĂDINIȚA CU PROGRAM NORMAL", SAT ZAMFIRA," COMUNA LIPĂNEȘTI""",GRADINITA CU PROGRAM NORMAL SAT ZAMFIRA COMUNA LIPANESTI,ZAMFIRA,PRINCIPALĂ
