COD FISCAL,COD SIIIR,COD SIIIR SUP,COD SIRUES,SIRUTA LOC SUP,SIRUTA LOCALITATE,cod,judet,lat,lon,nr,nume,nume_ascii,oras,str,wikidata,
,2962104918,2961101666,640850,131069,131087,2962104918,PRAHOVA,,,32A,"""GRĂDINIȚA CU PROGRAM NORMAL SECIU"," ORAȘUL BOLDEȘTI-SCĂENI""",GRADINITA CU PROGRAM NORMAL SECIU ORASUL BOLDESTI SCAENI,SECIU,PRINCIPALĂ,
29165406,2961101951,,641206,131443,131452,2961101951,PRAHOVA,,,20C,"""GRĂDINIȚA CU PROGRAM NORMAL ȘI PROGRAM PRELUNGIT """"FRUNZA DE STEJAR"""""," ORAȘUL PLOPENI""",GRADINITA CU PROGRAM NORMAL SI PROGRAM PRELUNGIT FRUNZA DE STEJAR ORASUL PLOPENI,PLOPENI,REPUBLICII,
14374579,2961102708,,640317,130534,130543,2961102708,PRAHOVA,,,46,"""GRĂDINIȚA CU PROGRAM PRELUNGIT NR. 23"," MUNICIPIUL PLOIEȘTI""",GRADINITA CU PROGRAM PRELUNGIT NR 23 MUNICIPIUL PLOIESTI,PLOIEŞTI,RÂȘNOVENILOR,
,2962106029,2961100181,642846,135020,135075,2962106029,PRAHOVA,,,85,"""GRĂDINIȚA CU PROGRAM NORMAL", SAT GOGA," COMUNA RÎFOV""",GRADINITA CU PROGRAM NORMAL SAT GOGA COMUNA RIFOV,GOGA,PRINCIPALA
29144683,2961107084,,636809,131620,131639,2961107084,PRAHOVA,,,1,"""ȘCOALA GIMNAZIALĂ """"CANUȚĂ IONESCU"""""," ORAȘUL URLAȚI""",SCOALA GIMNAZIALA CANUTA IONESCU ORASUL URLATI,URLAŢI,VIITOR,
29168607,2961107012,,635738,130534,130543,2961107012,PRAHOVA,,,3,"""ȘCOALA GIMNAZIALĂ """"RAREȘ VODĂ"""""," MUNICIPIUL PLOIEȘTI""",SCOALA GIMNAZIALA RARES VODA MUNICIPIUL PLOIESTI,PLOIEŞTI,VORNICUL BOLDUR,
29070594,2961100362,,639461,136278,135333,2961100362,PRAHOVA,,,93,"""ȘCOALA GIMNAZIALĂ"," COMUNA BĂTRÎNI""",SCOALA GIMNAZIALA COMUNA BATRINI,BĂTRÂNI,PRINCIPALĂ,
,2962103695,2961102925,638663,134096,134121,2962103695,PRAHOVA,,,50,"""ȘCOALA PRIMARĂ NR. 2", SAT CHICIURENI," COMUNA MĂNECIU""",SCOALA PRIMARA NR 2 SAT CHICIURENI COMUNA MANECIU,CHICIURENI,PRINCIPALA
29128262,2961101544,,636184,130847,130856,2961101544,PRAHOVA,,,116,"""ȘCOALA GIMNAZIALĂ """"TOMA T. SOCOLESCU"""""," COMUNA PĂULEȘTI""",SCOALA GIMNAZIALA TOMA T SOCOLESCU COMUNA PAULESTI,PĂULEŞTI,PRINCIPALĂ,
,2962100891,2961101829,639071,134755,134835,2962100891,PRAHOVA,,,57,"""ȘCOALA GIMNAZIALĂ", SAT VITIOARA DE SUS," COMUNA PREDEAL SĂRARI""",SCOALA GIMNAZIALA SAT VITIOARA DE SUS COMUNA PREDEAL SARARI,VITIOARA DE SUS,PRINCIPALĂ
29168941,2961102934,,635714,130534,130543,2961102934,PRAHOVA,,,25,"""ȘCOALA GIMNAZIALĂ """"CANDIANO POPESCU"""""," MUNICIPIUL PLOIEȘTI""",SCOALA GIMNAZIALA CANDIANO POPESCU MUNICIPIUL PLOIESTI,PLOIEŞTI,Nucilor,
29038860,2961107039,,642080,133161,133170,2961107039,PRAHOVA,,,635,"""GRĂDINIȚA CU PROGRAM PRELUNGIT NR. 2"," COMUNA FILIPEȘTII DE PĂDURE""",GRADINITA CU PROGRAM PRELUNGIT NR 2 COMUNA FILIPESTII DE PADURE,FILIPEŞTII DE PĂDURE,GĂRII,
2843965,2961100136,,636940,131835,131844,2961100136,PRAHOVA,,,197,"""ȘCOALA GIMNAZIALĂ"," COMUNA GURA VITIOAREI""",SCOALA GIMNAZIALA COMUNA GURA VITIOAREI,GURA VITIOAREI,PRINCIPALĂ,
,2962106929,2961107428,967703,135547,135565,2962106929,PRAHOVA,,,166,"""GRĂDINIȚA CU PROGRAM NORMAL", SAT LUNCA MARE," COMUNA ȘOTRILE""",GRADINITA CU PROGRAM NORMAL SAT LUNCA MARE COMUNA SOTRILE,LUNCA MARE,PRINCIPALĂ
,2962105964,2961100127,2903907,133795,133811,2962105964,PRAHOVA,,,40A,"""ȘCOALA PRIMARĂ", SAT CERNEȘTI," COMUNA IZVOARELE""",SCOALA PRIMARA SAT CERNESTI COMUNA IZVOARELE,CERNEŞTI,CERNEȘTI
,2962101399,2961101838,642200,133330,133385,2962101399,PRAHOVA,,,404,"""GRĂDINIȚA CU PROGRAM NORMAL", SAT NOVĂCEȘTI," COMUNA FLOREȘTI""",GRADINITA CU PROGRAM NORMAL SAT NOVACESTI COMUNA FLORESTI,NOVĂCEŞTI,PRINCIPALĂ
,2962101069,2961100204,643072,135725,135734,2962101069,PRAHOVA,,,160,"""GRĂDINIȚA CU PROGRAM NORMAL"," COMUNA TEIȘANI""",GRADINITA CU PROGRAM NORMAL COMUNA TEISANI,TEIŞANI,PRINCIPALĂ,
,2962103831,2961107265,640329,130534,130543,2962103831,PRAHOVA,,,12,"""GRĂDINIȚA CU PROGRAM NORMAL NR. 24"," MUNICIPIUL PLOIEȘTI""",GRADINITA CU PROGRAM NORMAL NR 24 MUNICIPIUL PLOIESTI,PLOIEŞTI,Radu de la Afumaţi,
,2962105783,2961102468,639198,134942,134960,2962105783,PRAHOVA,,,333,"""ȘCOALA PRIMARĂ", SAT MIROSLAVEȘTI," COMUNA PUCHENII MARI""",SCOALA PRIMARA SAT MIROSLAVESTI COMUNA PUCHENII MARI,MIROSLĂVEŞTI,MIROSLĂVEȘTI
29170984,2961101716,,635855,130534,130543,2961101716,PRAHOVA,,,19,"""ȘCOALA GIMNAZIALĂ """"SFÂNTA VINERI"""""," MUNICIPIUL PLOIEȘTI""",SCOALA GIMNAZIALA SFANTA VINERI MUNICIPIUL PLOIESTI,PLOIEŞTI,POȘTEI,
2844405,2961102405,,973001,131210,131229,2961102405,PRAHOVA,,,1,"""COLEGIUL """"ION KALINDERU"""""," ORAȘUL BUȘTENI""",COLEGIUL ION KALINDERU ORASUL BUSTENI,BUŞTENI,ALPINIȘTILOR,
,2962104434,2961101526,642535,136241,134247,2962104434,PRAHOVA,,,211,"""GRĂDINIȚA CU PROGRAM NORMAL"," COMUNA COCORĂȘTII COLȚ""",GRADINITA CU PROGRAM NORMAL COMUNA COCORASTII COLT,COCORĂŞTII COLŢ,PRINCIPALĂ,
29006346,2961102545,,637114,132075,132084,2961102545,PRAHOVA,,,96,"""ȘCOALA GIMNAZIALĂ"," COMUNA ARICEȘTII RAHTIVANI""",SCOALA GIMNAZIALA COMUNA ARICESTII RAHTIVANI,ARICEŞTII RAHTIVANI,ARICEȘTII-RAHTIVANI,
29055578,2961102893,,6607408,131443,131452,2961102893,PRAHOVA,,,08.oct,"""ȘCOALA PROFESIONALĂ SPECIALĂ"," ORAȘUL PLOPENI""",SCOALA PROFESIONALA SPECIALA ORASUL PLOPENI,PLOPENI,REPUBLICII,
2845478,2961107446,,635441,130534,130543,2961107446,PRAHOVA,,,7,"""COLEGIUL NATIONAL """"JEAN MONNET"""""," MUNICIPIUL PLOIEȘTI""",COLEGIUL NATIONAL JEAN MONNET MUNICIPIUL PLOIESTI,PLOIEŞTI,Iorga Nicolae,
,2962106002,2961100181,639277,135020,135100,2962106002,PRAHOVA,,,216,"""ȘCOALA PRIMARĂ", SAT PALANCA," COMUNA RÎFOV""",SCOALA PRIMARA SAT PALANCA COMUNA RIFOV,PALANCA,PRINCIPALĂ
28978320,2961102097,,639291,135128,135137,2961102097,PRAHOVA,,,195,"""ȘCOALA GIMNAZIALĂ"," COMUNA SALCIA""",SCOALA GIMNAZIALA COMUNA SALCIA,SALCIA,PRINCIPALA,
29044684,2961102762,,636706,131407,131416,2961102762,PRAHOVA,,,38,"""ȘCOALA GIMNAZIALĂ """"SFÎNTUL NICOLAE"""""," ORAȘUL MIZIL""",SCOALA GIMNAZIALA SFINTUL NICOLAE ORASUL MIZIL,MIZIL,TOHANI,
,2962105209,2961100109,6505569,136134,136152,2962105209,PRAHOVA,,,32A,"""ȘCOALA PRIMARĂ", SAT COȚOFENEȘTI," COMUNA VĂRBILĂU""",SCOALA PRIMARA SAT COTOFENESTI COMUNA VARBILAU,COŢOFENEŞTI,COȚOFENEȘTI
,2962104339,2961107256,636457,131210,131229,2962104339,PRAHOVA,,,18,"""ȘCOALA GIMNAZIALĂ """"CEZAR PETRESCU"""""," ORAȘUL BUȘTENI""",SCOALA GIMNAZIALA CEZAR PETRESCU ORASUL BUSTENI,BUŞTENI,ȘCOLII,
,2962105593,2961100136,641397,131835,131853,2962105593,PRAHOVA,,,69,"""GRĂDINIȚA CU PROGRAM NORMAL", SAT BUGHEA DE JOS," COMUNA GURA VITIOAREI""",GRADINITA CU PROGRAM NORMAL SAT BUGHEA DE JOS COMUNA GURA VITIOAREI,BUGHEA DE JOS,PRINCIPALĂ
,2962103641,2961102183,639851,135850,135887,2962103641,PRAHOVA,,,51,"""ȘCOALA PRIMARĂ", SAT PISCULEȘTI," COMUNA TINOSU""",SCOALA PRIMARA SAT PISCULESTI COMUNA TINOSU,PISCULEŞTI,PISCULEȘTI
,2962103311,2961101752,849731,132075,132100,2962103311,PRAHOVA,,,46,"""ȘCOALA PROFESIONALĂ SPECIALĂ", SAT NEDELEA," COMUNA ARICEȘTII RAHTIVANI""",SCOALA PROFESIONALA SPECIALA SAT NEDELEA COMUNA ARICESTII RAHTIVANI,NEDELEA,PRINCIPALĂ
16346516,2961101526,,638730,136241,134247,2961101526,PRAHOVA,,,10,"""ȘCOALA GIMNAZIALĂ"," COMUNA COCORĂȘTII COLȚ""",SCOALA GIMNAZIALA COMUNA COCORASTII COLT,COCORĂŞTII COLŢ,PRINCIPALĂ,
2843426,2961102952,,1182269,131256,131265,2961102952,PRAHOVA,,,34,"""LICEUL TEHNOLOGIC MECANIC"," MUNICIPIUL CÂMPINA""",LICEUL TEHNOLOGIC MECANIC MUNICIPIUL CAMPINA,CÂMPINA,ECATERINA TEODOROIU,
,2962105037,2961101553,640678,130785,130829,2962105037,PRAHOVA,,,317,"""GRĂDINIȚA CU PROGRAM NORMAL NR. 1", SAT PLEAȘA," COMUNA BUCOV""",GRADINITA CU PROGRAM NORMAL NR 1 SAT PLEASA COMUNA BUCOV,PLEAŞA,PLEAȘA
,2962106947,2961107428,1104138,135547,135556,2962106947,PRAHOVA,,,367,"""GRĂDINIȚA CU PROGRAM NORMAL NR. 1"," COMUNA ȘOTRILE""",GRADINITA CU PROGRAM NORMAL NR 1 COMUNA SOTRILE,ŞOTRILE,PRINCIPALĂ,
,2962105946,2961100127,638443,133795,133857,2962105946,PRAHOVA,,,118,"""ȘCOALA GIMNAZIALĂ", SAT SCHIULEȘTI," COMUNA IZVOARELE""",SCOALA GIMNAZIALA SAT SCHIULESTI COMUNA IZVOARELE,SCHIULEŞTI,PRINCIPALĂ
,2962106662,2961101458,642133,133214,133250,2962106662,PRAHOVA,,,710,"""GRĂDINIȚA CU PROGRAM NORMAL", SAT MĂRGINENII DE JOS," COMUNA FILIPEȘTII DE TÎRG""",GRADINITA CU PROGRAM NORMAL SAT MARGINENII DE JOS COMUNA FILIPESTII DE TIRG,MĂRGINENII DE JOS,MĂRGINENII DE JOS
,2962105417,2961101978,638182,136250,133447,2962105417,PRAHOVA,,,25,"""ȘCOALA PRIMARĂ", SAT FÂNARI," COMUNA OLARI""",SCOALA PRIMARA SAT FANARI COMUNA OLARI,FÂNARI,PRINCIPALĂ
,2962103858,2961102875,1104140,135501,135529,2962103858,PRAHOVA,,,133B,"""GRĂDINIȚA CU PROGRAM NORMAL", SAT LOPATNIȚA," COMUNA ȘOIMARI""",GRADINITA CU PROGRAM NORMAL SAT LOPATNITA COMUNA SOIMARI,LOPATNIŢA,PRINCIPALĂ
,2962105177,2961100109,640044,136134,136152,2962105177,PRAHOVA,,,80A,"""ȘCOALA GIMNAZIALĂ", SAT COȚOFENEȘTI," COMUNA VĂRBILĂU""",SCOALA GIMNAZIALA SAT COTOFENESTI COMUNA VARBILAU,COŢOFENEŞTI,COȚOFENEȘTI
29170402,2961107057,,640422,130534,130543,2961107057,PRAHOVA,,,34,"""GRĂDINIȚA STEP BY STEP CU PROGRAM PRELUNGIT ȘI PROGRAM NORMAL """"RAZA DE SOARE"""""," MUNICIPIUL PLOIEȘTI""",GRADINITA STEP BY STEP CU PROGRAM PRELUNGIT SI PROGRAM NORMAL RAZA DE SOARE MUNICIPIUL PLOIESTI,PLOIEŞTI,Dediţel,
29055586,2961107292,,635568,133214,133223,2961107292,PRAHOVA,,,752,"""ȘCOALA GIMNAZIALĂ SPECIALĂ"," COMUNA FILIPEȘTII DE TÎRG""",SCOALA GIMNAZIALA SPECIALA COMUNA FILIPESTII DE TIRG,FILIPEŞTII DE TÂRG,PRINCIPALĂ,
2843647,2961101996,,638912,134559,134568,2961101996,PRAHOVA,,,1,"""ȘCOALA GIMNAZIALĂ"," COMUNA POIENARII BURCHII""",SCOALA GIMNAZIALA COMUNA POIENARII BURCHII,POIENARII BURCHII,GENERAL ALEXANDRU ANGELESCU,
,2962100801,2961101725,640812,130981,131041,2962100801,PRAHOVA,,,177,"""GRĂDINIȚA CU PROGRAM NORMAL ȚINTEA"," ORAȘUL BĂICOI""",GRADINITA CU PROGRAM NORMAL TINTEA ORASUL BAICOI,ŢINTEA,INDEPENDENȚEI,
,2962103103,2961102025,996780,134390,134407,2962103103,PRAHOVA,,,271A,"""GRĂDINIȚA CU PROGRAM NORMAL"," COMUNA PLOPU""",GRADINITA CU PROGRAM NORMAL COMUNA PLOPU,PLOPU,PRINCIPALĂ,
,2962100751,2961100249,640977,131256,131265,2962100751,PRAHOVA,,,10,"""GRĂDINIȚA CU PROGRAM NORMAL NR. 1"," MUNICIPIUL CÂMPINA""",GRADINITA CU PROGRAM NORMAL NR 1 MUNICIPIUL CAMPINA,CÂMPINA,PLEVNEI,
,2962105982,2961100181,1194949,135020,135119,2962105982,PRAHOVA,,,31,"""GRĂDINIȚA CU PROGRAM NORMAL", SAT SICRITA," COMUNA RÎFOV""",GRADINITA CU PROGRAM NORMAL SAT SICRITA COMUNA RIFOV,SICRITA,PRINCIPALĂ
30651086,2961107048,,635946,130552,130561,2961107048,PRAHOVA,,,68,"""ȘCOALA GIMNAZIALĂ """"GHEORGHE LAZĂR"""""," COMUNA BĂRCĂNEȘTI""",SCOALA GIMNAZIALA GHEORGHE LAZAR COMUNA BARCANESTI,BĂRCĂNEŞTI,DN1,
,2962104868,2961102744,641139,131336,131354,2962104868,PRAHOVA,,,298,"""GRĂDINIȚA CU PROGRAM NORMAL NR. 2 GHIOȘEȘTI"," ORAȘUL COMARNIC""",GRADINITA CU PROGRAM NORMAL NR 2 GHIOSESTI ORASUL COMARNIC,GHIOŞEŞTI,GHIOȘEȘTI,
,2962104687,2961100326,638144,133429,133492,2962104687,PRAHOVA,,,16,"""ȘCOALA PRIMARĂ", SAT UNGURENI," COMUNA GHERGHIȚA""",SCOALA PRIMARA SAT UNGURENI COMUNA GHERGHITA,UNGURENI,PRINCIPALĂ
,2962103487,2961102111,643101,135789,135798,2962103487,PRAHOVA,,,832,"""GRĂDINIȚA CU PROGRAM NORMAL NR. 2"," COMUNA TELEGA""",GRADINITA CU PROGRAM NORMAL NR 2 COMUNA TELEGA,TELEGA,TELEGA,
24103313,2961202421,,1026,130534,130543,2961202421,PRAHOVA,,,14,"""ŞCOALA PRIMARĂ """"CĂSUȚA CU POVEȘTI"""" PLOIEȘTI""",SCOALA PRIMARA CASUTA CU POVESTI PLOIESTI,PLOIEŞTI,PETRE NEGULESCU,,
2843922,2961101508,,636562,131256,131265,2961101508,PRAHOVA,,,104,"""ȘCOALA GIMNAZIALĂ """"ALEXANDRU IOAN CUZA"""""," MUNICIPIUL CÂMPINA""",SCOALA GIMNAZIALA ALEXANDRU IOAN CUZA MUNICIPIUL CAMPINA,CÂMPINA,CAROL I,
29012321,2961102355,,639502,135404,135413,2961102355,PRAHOVA,,,229,"""ȘCOALA GIMNAZIALĂ"," COMUNA SURANI""",SCOALA GIMNAZIALA COMUNA SURANI,SURANI,PRINCIPALĂ,
,2962105435,2961102147,967856,132271,132306,2962105435,PRAHOVA,,,442,"""GRĂDINIȚA CU PROGRAM NORMAL", SAT PODENII VECHI," COMUNA BĂLȚEȘTI""",GRADINITA CU PROGRAM NORMAL SAT PODENII VECHI COMUNA BALTESTI,PODENII VECHI,PODENII VECHI
,2962104054,2961100317,640563,130614,130623,2962104054,PRAHOVA,,,25B,"""GRĂDINIȚA CU PROGRAM NORMAL NR. 1"," COMUNA BERCENI""",GRADINITA CU PROGRAM NORMAL NR 1 COMUNA BERCENI,BERCENI,CURCUBEULUI,
,2962106576,2961100118,638895,134443,134540,2962106576,PRAHOVA,,,108,"""ȘCOALA GIMNAZIALĂ", SAT VALEA DULCE," COMUNA PODENII NOI""",SCOALA GIMNAZIALA SAT VALEA DULCE COMUNA PODENII NOI,VALEA DULCE,PRINCIPALĂ
,2962103876,2961102875,639605,135501,135529,2962103876,PRAHOVA,,,133B,"""ȘCOALA PRIMARĂ", SAT LOPATNIȚA," COMUNA ȘOIMARI""",SCOALA PRIMARA SAT LOPATNITA COMUNA SOIMARI,LOPATNIŢA,PRINCIPALĂ
,2962103297,2961103035,1270341,131817,131826,2962103297,PRAHOVA,,,2,"""ȘCOALA PRIMARĂ NR. 2"," ORAȘUL VĂLENII DE MUNTE""",SCOALA PRIMARA NR 2 ORASUL VALENII DE MUNTE,VĂLENII DE MUNTE,DR. ISTRATE,
22640248,2961107161,,635881,130534,130543,2961107161,PRAHOVA,,,4,"""LICEUL TEHNOLOGIC DE SERVICII """"SFÂNTUL APOSTOL ANDREI"""""," MUNICIPIUL PLOIEȘTI""",LICEUL TEHNOLOGIC DE SERVICII SFANTUL APOSTOL ANDREI MUNICIPIUL PLOIESTI,PLOIEŞTI,Dediţel,
,2962105869,2961100059,642456,134050,134069,2962105869,PRAHOVA,,,981,"""GRĂDINIȚA CU PROGRAM NORMAL NR. 1"," COMUNA MĂGURENI""",GRADINITA CU PROGRAM NORMAL NR 1 COMUNA MAGURENI,MĂGURENI,PRINCIPALĂ,
,2962100968,2961107351,641971,132896,132903,2962100968,PRAHOVA,,,105,"""GRĂDINIȚA CU PROGRAM NORMAL", SAT DRAJNA DE SUS," COMUNA DRAJNA""",GRADINITA CU PROGRAM NORMAL SAT DRAJNA DE SUS COMUNA DRAJNA,DRAJNA DE SUS,NEAGOE BASARAB
2843949,2961107125,,635312,130534,130543,2961107125,PRAHOVA,,,3,"""COLEGIUL NAȚIONAL """"NICHITA STĂNESCU"""""," MUNICIPIUL PLOIEȘTI""",COLEGIUL NATIONAL NICHITA STANESCU MUNICIPIUL PLOIESTI,PLOIEŞTI,Nalbei,
,2962104113,2961107021,638261,133562,133606,2962104113,PRAHOVA,,,36,"""ȘCOALA PRIMARĂ", SAT NUCET," COMUNA GORNET""",SCOALA PRIMARA SAT NUCET COMUNA GORNET,NUCET,NUCET
28994694,2961106992,,638390,133722,133786,2961106992,PRAHOVA,,,1,"""ȘCOALA GIMNAZIALĂ", SAT VĂRBILA," COMUNA IORDĂCHEANU""",SCOALA GIMNAZIALA SAT VARBILA COMUNA IORDACHEANU,VĂRBILA,PRINCIPALĂ
29055420,2961107021,,638235,133562,133571,2961107021,PRAHOVA,,,110,"""ȘCOALA GIMNAZIALĂ"," COMUNA GORNET""",SCOALA GIMNAZIALA COMUNA GORNET,GORNET,PRINCIPALĂ,
,2962103772,2961100213,638704,134194,134327,2962103772,PRAHOVA,,,297,"""ȘCOALA PRIMARĂ", SAT ZALHANAUA," COMUNA MĂNEȘTI""",SCOALA PRIMARA SAT ZALHANAUA COMUNA MANESTI,ZALHANAUA,PRINCIPALĂ
,2962100588,2961102527,643199,135949,135958,2962100588,PRAHOVA,,,179A,"""GRĂDINIȚA CU PROGRAM NORMAL """"VOINICEL"""" COMUNA VALEA CĂLUGĂREASCĂ""",GRADINITA CU PROGRAM NORMAL VOINICEL COMUNA VALEA CALUGAREASCA,VALEA CĂLUGĂREASCĂ,VALEA POPII,,
,2962104805,2961102441,642913,135244,135253,2962104805,PRAHOVA,,,84,"""GRĂDINIȚA CU PROGRAM NORMAL"," COMUNA SÎNGERU""",GRADINITA CU PROGRAM NORMAL COMUNA SINGERU,SÂNGERU,PRINCIPALĂ,
32044790,2961207186,,6935324,130981,130990,2961207186,PRAHOVA,,,141,"""ȘCOALA PRIMARĂ """"EDEN-PARADISUL COPIILOR"""" BĂICOI""",SCOALA PRIMARA EDEN PARADISUL COPIILOR BAICOI,BĂICOI,OLTULUI,,
,2962107595,2941102015,,130534,130543,2962107595,PRAHOVA,,,145,"""CENTRUL LOGOPEDIC DE PE LÂNGĂ ȘCOALA GIMNAZIALĂ """"SFÂNTUL VASILE"""" "," MUNICIPIUL PLOIEȘTI""",CENTRUL LOGOPEDIC DE PE LANGA SCOALA GIMNAZIALA SFANTUL VASILE MUNICIPIUL PLOIESTI,PLOIEŞTI,REPUBLICII,
,2962103582,2961102604,636782,131577,131586,2962103582,PRAHOVA,,,24,"""ȘCOALA GIMNAZIALĂ NR. 1"," ORAȘUL SLĂNIC""",SCOALA GIMNAZIALA NR 1 ORASUL SLANIC,SLĂNIC,ȘTEFAN CEL MARE,
,2962100475,2961102165,1194963,135431,135459,2962100475,PRAHOVA,,,55,"""GRĂDINIȚA CU PROGRAM NORMAL", SAT BRĂTEȘTI," COMUNA ȘIRNA""",GRADINITA CU PROGRAM NORMAL SAT BRATESTI COMUNA SIRNA,BRĂTEŞTI,BRĂTEȘTI
,2962104746,2961102545,641517,132075,132084,2962104746,PRAHOVA,,,169,"""GRĂDINIȚA CU PROGRAM NORMAL"," COMUNA ARICEȘTII RAHTIVANI""",GRADINITA CU PROGRAM NORMAL COMUNA ARICESTII RAHTIVANI,ARICEŞTII RAHTIVANI,ARICEȘTII-RAHTIVANI,
,2962106237,2961102233,636263,130981,130990,2962106237,PRAHOVA,,,19,"""ȘCOALA GIMNAZIALĂ """"DUMITRU GHENOIU"""""," ORAȘUL BĂICOI""",SCOALA GIMNAZIALA DUMITRU GHENOIU ORASUL BAICOI,BĂICOI,UNIRII,
,2962106843,2961101639,639954,135949,136009,2962106843,PRAHOVA,,,16A,"""ȘCOALA GIMNAZIALĂ", SAT RACHIERI," COMUNA VALEA CĂLUGĂREASCĂ""",SCOALA GIMNAZIALA SAT RACHIERI COMUNA VALEA CALUGAREASCA,RACHIERI,RACHIERI
34086147,2961107609,,292121456,130534,130543,2961107609,PRAHOVA,,,98,CENTRUL JUDEŢEAN DE EXCELENŢĂ PRAHOVA,CENTRUL JUDETEAN DE EXCELENTA PRAHOVA,PLOIEŞTI,GHEORGHE DOJA,,
,2962103424,2961101734,641945,132805,132823,2962103424,PRAHOVA,,,217,"""GRĂDINIȚA CU PROGRAM NORMAL", SAT CORNU DE SUS," COMUNA CORNU""",GRADINITA CU PROGRAM NORMAL SAT CORNU DE SUS COMUNA CORNU,CORNU DE SUS,MIHAI VITEAZUL
,2962106038,2961100181,639253,135020,135119,2962106038,PRAHOVA,,,1,"""ȘCOALA PRIMARĂ", SAT SICRITA," COMUNA RÎFOV""",SCOALA PRIMARA SAT SICRITA COMUNA RIFOV,SICRITA,PRINCIPALĂ
29168526,2961100068,,635817,130534,130543,2961100068,PRAHOVA,,,81,"""ȘCOALA GIMNAZIALĂ """"IOAN GRIGORESCU"""""," MUNICIPIUL PLOIEȘTI""",SCOALA GIMNAZIALA IOAN GRIGORESCU MUNICIPIUL PLOIESTI,PLOIEŞTI,IZVOARELE,
2844677,2961102839,,1182245,130534,130543,2961102839,PRAHOVA,,,8,"""COLEGIUL """"SPIRU HARET"""""," MUNICIPIUL PLOIEȘTI""",COLEGIUL SPIRU HARET MUNICIPIUL PLOIESTI,PLOIEŞTI,Constructorilor,
,2962103148,2961107342,1104217,131933,131979,2962103148,PRAHOVA,,,701,"""GRĂDINIȚA CU PROGRAM NORMAL", SAT VADU PĂRULUI," COMUNA ALBEȘTI-PALEOLOGU""",GRADINITA CU PROGRAM NORMAL SAT VADU PARULUI COMUNA ALBESTI PALEOLOGU,VADU PĂRULUI,PRINCIPALĂ
,2962104027,2961101666,636354,131069,131087,2962104027,PRAHOVA,,,158,"""ȘCOALA PRIMARĂ SECIU"," ORAȘUL BOLDEȘTI-SCĂENI""",SCOALA PRIMARA SECIU ORASUL BOLDESTI SCAENI,SECIU,PRINCIPALĂ,
,2962106291,2961100059,642470,134050,134078,2962106291,PRAHOVA,,,244,"""GRĂDINIȚA CU PROGRAM NORMAL", SAT COCORAȘTII CAPLI," COMUNA MĂGURENI""",GRADINITA CU PROGRAM NORMAL SAT COCORASTII CAPLI COMUNA MAGURENI,COCORĂŞTII CAPLII,PRINCIPALĂ
,2962105688,2961107306,641787,132574,132609,2962105688,PRAHOVA,,,1,"""GRĂDINIȚA CU PROGRAM NORMAL", SAT VALEA BORULUI," COMUNA CERAȘU""",GRADINITA CU PROGRAM NORMAL SAT VALEA BORULUI COMUNA CERASU,VALEA BORULUI,PRINCIPALĂ
,2962101164,2941102015,2904119,130534,130543,2962101164,PRAHOVA,,,7,"""CABINETUL LOGOPEDIC NR. 2 DE PE LÂNGĂ COLEGIUL NAȚIONAL """"JEAN MONNET"""" PLOIEȘTI""",CABINETUL LOGOPEDIC NR 2 DE PE LANGA COLEGIUL NATIONAL JEAN MONNET PLOIESTI,PLOIEŞTI,NICOLAE IORGA,,
29188671,2961102694,,996792,130534,130543,2961102694,PRAHOVA,,,44,"""GRĂDINIȚA CU PROGRAM PRELUNGIT ȘI PROGRAM NORMAL """"CRAI NOU"""""," MUNICIPIUL PLOIEȘTI""",GRADINITA CU PROGRAM PRELUNGIT SI PROGRAM NORMAL CRAI NOU MUNICIPIUL PLOIESTI,PLOIEŞTI,Bobâlna,
,2942101181,2941102015,2904248,130534,130543,2942101181,PRAHOVA,,,26,CENTRUL JUDEȚEAN DE ASISTENȚĂ PSIHOPEDAGOGICĂ PRAHOVA,CENTRUL JUDETEAN DE ASISTENTA PSIHOPEDAGOGICA PRAHOVA,PLOIEŞTI,BOBALNA,,
,2962105227,2961100109,640020,136134,136161,2962105227,PRAHOVA,,,52A,"""ȘCOALA PRIMARĂ", SAT LIVADEA," COMUNA VĂRBILĂU""",SCOALA PRIMARA SAT LIVADEA COMUNA VARBILAU,LIVADEA,LIVADEA
,2962103442,2961101571,642987,135315,135351,2962103442,PRAHOVA,,,201,"""GRĂDINIȚA CU PROGRAM NORMAL", SAT GRESIA," COMUNA STARCHIOJD""",GRADINITA CU PROGRAM NORMAL SAT GRESIA COMUNA STARCHIOJD,GRESIA,GRESIA
,2962106522,2961102518,640604,130678,130696,2962106522,PRAHOVA,,,537,"""GRĂDINIȚA CU PROGRAM NORMAL", SAT PLOIEȘTIORI," COMUNA BLEJOI""",GRADINITA CU PROGRAM NORMAL SAT PLOIESTIORI COMUNA BLEJOI,PLOIEŞTIORI,TELEAJEN
,2962103478,2961102111,639796,135789,135798,2962103478,PRAHOVA,,,487,"""ȘCOALA GIMNAZIALĂ """"ALEXANDRU POPESCU-TELEGA"""""," COMUNA TELEGA""",SCOALA GIMNAZIALA ALEXANDRU POPESCU TELEGA COMUNA TELEGA,TELEGA,TELEGA,
30240129,2961207616,,,130534,130543,2961207616,PRAHOVA,,,76,"""ŞCOALA GIMNAZIALĂ ''EXCELSIS"""" "," MUNICIPIUL PLOIEŞTI""",SCOALA GIMNAZIALA EXCELSIS MUNICIPIUL PLOIESTI,PLOIEŞTI,BULEVARDUL BUCUREŞTI,
29075559,2961102649,,638194,133508,133553,2961102649,PRAHOVA,,,375,"""ȘCOALA GIMNAZIALĂ", SAT POTIGRAFU," COMUNA GORGOTA""",SCOALA GIMNAZIALA SAT POTIGRAFU COMUNA GORGOTA,POTIGRAFU,PRINCIPALĂ
29021001,2961102319,,639124,134899,134906,2961102319,PRAHOVA,,,369,"""ȘCOALA GIMNAZIALĂ """"MITROPOLIT PIMEN GEORGESCU"""""," COMUNA PROVIȚA DE SUS""",SCOALA GIMNAZIALA MITROPOLIT PIMEN GEORGESCU COMUNA PROVITA DE SUS,PROVIŢA DE SUS,PRINCIPALĂ,
,2962106703,2961101874,642157,136269,133321,2962106703,PRAHOVA,,,1,"""GRĂDINIȚA CU PROGRAM NORMAL"," COMUNA VADU SĂPAT""",GRADINITA CU PROGRAM NORMAL COMUNA VADU SAPAT,VADU SĂPAT,PRINCIPALĂ,
14374579,2961103062,,640367,130534,130543,2961103062,PRAHOVA,,,58,"""GRĂDINIȚA CU PROGRAM PRELUNGIT NR. 28"," MUNICIPIUL PLOIEȘTI""",GRADINITA CU PROGRAM PRELUNGIT NR 28 MUNICIPIUL PLOIESTI,PLOIEŞTI,MĂRĂȘEȘTI,
,2962104701,2961102545,637152,132075,132119,2962104701,PRAHOVA,,,330A,"""ȘCOALA GIMNAZIALĂ", SAT STOENEȘTI," COMUNA ARICEȘTII RAHTIVANI""",SCOALA GIMNAZIALA SAT STOENESTI COMUNA ARICESTII RAHTIVANI,STOENEŞTI,PRINCIPALĂ
,2962101431,2961102165,643034,135431,135440,2962101431,PRAHOVA,,,151A,"""GRĂDINIȚA CU PROGRAM NORMAL NR. 1"," COMUNA ȘIRNA""",GRADINITA CU PROGRAM NORMAL NR 1 COMUNA SIRNA,ŞIRNA,PRINCIPALĂ,
,2962106359,2961102346,641672,132379,132388,2962106359,PRAHOVA,,,26B,"""GRĂDINIȚA CU PROGRAM NORMAL", SAT BOLDEȘTI," COMUNA BOLDEȘTI-GRĂDIȘTEA""",GRADINITA CU PROGRAM NORMAL SAT BOLDESTI COMUNA BOLDESTI GRADISTEA,BOLDEŞTI,PRINCIPALĂ
,2962103166,2961107342,641440,131933,131951,2962103166,PRAHOVA,,,20,"""GRĂDINIȚA CU PROGRAM NORMAL", SAT ALBEȘTI-MURU," COMUNA ALBEȘTI-PALEOLOGU""",GRADINITA CU PROGRAM NORMAL SAT ALBESTI MURU COMUNA ALBESTI PALEOLOGU,ALBEŞTI-MURU,Principala
,2962100742,2961100249,640991,131256,131265,2962100742,PRAHOVA,,,204,"""GRĂDINIȚA CU PROGRAM NORMAL NR. 3"," MUNICIPIUL CÂMPINA""",GRADINITA CU PROGRAM NORMAL NR 3 MUNICIPIUL CAMPINA,CÂMPINA,CALEA DOFTANEI,
,2962106196,2961102079,637578,132645,132672,2962106196,PRAHOVA,,,1,"""ȘCOALA PRIMARĂ", SAT TRENU," COMUNA CHIOJDEANCA""",SCOALA PRIMARA SAT TRENU COMUNA CHIOJDEANCA,TRENU,TRENU
11442822,2961207091,,6677128,131256,131265,2961207091,PRAHOVA,,,5,"""ȘCOALA POSTLICEALĂ """"LOUIS PASTEUR"""" CÂMPINA""",SCOALA POSTLICEALA LOUIS PASTEUR CAMPINA,CÂMPINA,NICOLAE BĂLCESCU,,
29006290,2961102102,,637138,132075,132100,2961102102,PRAHOVA,,,491,"""ȘCOALA GIMNAZIALĂ", SAT NEDELEA," COMUNA ARICEȘTII RAHTIVANI""",SCOALA GIMNAZIALA SAT NEDELEA COMUNA ARICESTII RAHTIVANI,NEDELEA,NEDELEA
,2962106115,2961100032,639887,135896,135912,2962106115,PRAHOVA,,,413A,"""ȘCOALA GIMNAZIALĂ", SAT LOLOIASCA," COMUNA TOMȘANI""",SCOALA GIMNAZIALA SAT LOLOIASCA COMUNA TOMSANI,LOLOIASCA,PRINCIPALĂ
,2962103677,2961102925,1104035,134096,134103,2962103677,PRAHOVA,,,604,"""GRĂDINIȚA CU PROGRAM NORMAL NR. 3"," COMUNA MĂNECIU""",GRADINITA CU PROGRAM NORMAL NR 3 COMUNA MANECIU,MĂNECIU-UNGURENI,PRINCIPALĂ,
,2962103781,2961100213,638699,134194,134238,2962103781,PRAHOVA,,,36,"""ȘCOALA PRIMARĂ", SAT COADA IZVORULUI," COMUNA MĂNEȘTI""",SCOALA PRIMARA SAT COADA IZVORULUI COMUNA MANESTI,COADA IZVORULUI,PRINCIPALĂ
,2962105394,2961101978,6608294,136250,133483,2962105394,PRAHOVA,,,183A,"""GRĂDINIȚA CU PROGRAM NORMAL", SAT OLARII VECHI," COMUNA OLARI""",GRADINITA CU PROGRAM NORMAL SAT OLARII VECHI COMUNA OLARI,OLARII VECHI,PRINCIPALĂ
,2962105132,2961100109,1149023,136134,136143,2962105132,PRAHOVA,,,191A,"""GRĂDINIȚA CU PROGRAM NORMAL NR. 2"," COMUNA VĂRBILĂU""",GRADINITA CU PROGRAM NORMAL NR 2 COMUNA VARBILAU,VĂRBILĂU,VĂRBILĂU,
,2962100457,2961102165,1194951,135431,135495,2962100457,PRAHOVA,,,329,"""GRĂDINIȚA CU PROGRAM NORMAL", SAT VARNIȚA," COMUNA ȘIRNA""",GRADINITA CU PROGRAM NORMAL SAT VARNITA COMUNA SIRNA,VARNIŢA,PRINCIPALĂ
,2962103392,2961107247,642121,133214,133232,2962103392,PRAHOVA,,,85,"""GRĂDINIȚA CU PROGRAM NORMAL", SAT BRĂTĂȘANCA," COMUNA FILIPEȘTII DE TÎRG""",GRADINITA CU PROGRAM NORMAL SAT BRATASANCA COMUNA FILIPESTII DE TIRG,BRĂTĂŞANCA,BRĂTĂȘANCA
,2962104782,2961102441,639409,135244,135271,2962104782,PRAHOVA,,,455,"""ȘCOALA GIMNAZIALĂ", SAT MIREȘU MARE," COMUNA SÎNGERU""",SCOALA GIMNAZIALA SAT MIRESU MARE COMUNA SINGERU,MIREŞU MARE,PRINCIPALĂ
27432485,2961202041,,290635829,130534,130543,2961202041,PRAHOVA,,,4,"""ȘCOALA INTERNAȚIONALĂ """"SPECTRUM"""" PLOIEȘTI""",SCOALA INTERNATIONALA SPECTRUM PLOIESTI,PLOIEŞTI,Înfrăţirii,,
29075800,2961102667,,637592,132681,132707,2961102667,PRAHOVA,,,24,"""ȘCOALA GIMNAZIALĂ", SAT CIORANII DE SUS," COMUNA CIORANI""",SCOALA GIMNAZIALA SAT CIORANII DE SUS COMUNA CIORANI,CIORANII DE SUS,PRINCIPALĂ
,2962104357,2961107256,640939,131210,131229,2962104357,PRAHOVA,,,18,"""GRĂDINIȚA CU PROGRAM NORMAL """"CEZAR PETRESCU"""""," ORAȘUL BUȘTENI""",GRADINITA CU PROGRAM NORMAL CEZAR PETRESCU ORASUL BUSTENI,BUŞTENI,ȘCOLII,
,2962106852,2961107197,641323,131620,131675,2962106852,PRAHOVA,,,54,"""GRĂDINIȚA CU PROGRAM NORMAL JERCĂLĂI"," ORAȘUL URLAȚI""",GRADINITA CU PROGRAM NORMAL JERCALAI ORASUL URLATI,JERCĂLĂI,JERCĂLĂI,
,2962103998,2961107012,640123,130534,130543,2962103998,PRAHOVA,,,28,"""GRĂDINIȚA CU PROGRAM NORMAL NR. 4"," MUNICIPIUL PLOIEȘTI""",GRADINITA CU PROGRAM NORMAL NR 4 MUNICIPIUL PLOIESTI,PLOIEŞTI,ROȘIORI,
,2962104063,2961100317,640575,130614,130650,2962104063,PRAHOVA,,,139A,"""GRĂDINIȚA CU PROGRAM NORMAL", SAT CORLĂTEȘTI," COMUNA BERCENI""",GRADINITA CU PROGRAM NORMAL SAT CORLATESTI COMUNA BERCENI,CORLĂTEŞTI,ȘCOLII
,2962105064,2961100326,642248,133429,133465,2962105064,PRAHOVA,,,149C,"""GRĂDINIȚA CU PROGRAM NORMAL", SAT MALAMUC," COMUNA GHERGHIȚA""",GRADINITA CU PROGRAM NORMAL SAT MALAMUC COMUNA GHERGHITA,MALAMUC,PRINCIPALĂ
