COD FISCAL,COD SIIIR,COD SIIIR SUP,COD SIRUES,SIRUTA LOC SUP,SIRUTA LOCALITATE,cod,judet,lat,lon,nr,nume,nume_ascii,oras,str,wikidata
11910672,3261203769,,,143619,143628,3261203769,SIBIU,,,1,"""SCOALA POSTLICEALA """"ALMA MATER"""" MEDIAS""",SCOALA POSTLICEALA ALMA MATER MEDIAS,MEDIAŞ,Metanului,
,3262100777,3261102571,321195046,144054,144063,3262100777,SIBIU,,,,GRADINITA CU PROGRAM PRELUNGIT NR 3 AVRIG,GRADINITA CU PROGRAM PRELUNGIT NR 3 AVRIG,AVRIG,SAMUEL BRUKENTHAL NR 157,
,3262100619,3261101769,320673168,145827,145836,3262100619,SIBIU,,,,GRADINITA CU PROGRAM NORMAL TALMACIU,GRADINITA CU PROGRAM NORMAL TALMACIU,TĂLMACIU,PIETII NR 16,
7785490,3261101439,,320673297,143450,143469,3261101439,SIBIU,,,9,GRADINITA CU PROGRAM PRELUNGIT NR 17 SIBIU,GRADINITA CU PROGRAM PRELUNGIT NR 17 SIBIU,SIBIU,Rebreanu Liviu,
17924960,3261102431,,320674540,144508,144517,3261102431,SIBIU,,,238,SCOALA GIMNAZIALA CIRTA,SCOALA GIMNAZIALA CIRTA,CÂRŢA,PRINCIPALA,
,3262100569,3261102277,320674980,145104,145122,3262100569,SIBIU,,,,SCOALA PRIMARA ALMA VII,SCOALA PRIMARA ALMA VII,ALMA VII,NR. 39,
,3262103192,3261102015,320675489,145738,145756,3262103192,SIBIU,,,118,SCOALA PRIMARA SOROSTIN,SCOALA PRIMARA SOROSTIN,SOROŞTIN,,
,3262103206,3261102173,320673766,143557,143575,3262103206,SIBIU,,,0,GRADINITA CU PROGRAM NORMAL BUNGARD,GRADINITA CU PROGRAM NORMAL BUNGARD,BUNGARD,PRINCIPALA,
,3262100402,3261101891,320672059,144116,144134,3262100402,SIBIU,,,101,GRADINITA CU PROGRAM NORMAL AGIRBICIU,GRADINITA CU PROGRAM NORMAL AGIRBICIU,AGÂRBICIU,Principala,
14666514,3261201645,,323041847,143450,143469,3261201645,SIBIU,,,,"""GRADINITA CU PROGRAM PRELUNGIT """"GRADINA MARIEI"""" SIBIU""",GRADINITA CU PROGRAM PRELUNGIT GRADINA MARIEI SIBIU,SIBIU,LEBEDEI NR 16,
17954449,3261101733,,320675001,145140,145159,3261101733,SIBIU,,,157,SCOALA GIMNAZIALA NOCRICH,SCOALA GIMNAZIALA NOCRICH,NOCRICH,PRINCIPALA,
4556174,3261101656,,320673596,143450,143469,3261101656,SIBIU,,,,LICEUL DE ARTA SIBIU,LICEUL DE ARTA SIBIU,SIBIU,ALEXANDRU ODOBESCU NR 2,
,3262100795,3261101403,320674021,143806,143824,3262100795,SIBIU,,,160,SCOALA PRIMARA ERNEA,SCOALA PRIMARA ERNEA,ERNEA,Principala,
4603420,3261102404,,321195292,143450,143469,3261102404,SIBIU,,,,GRADINITA CU PROGRAM PRELUNGIT NR 5 SIBIU,GRADINITA CU PROGRAM PRELUNGIT NR 5 SIBIU,SIBIU,SIRETULUI NR. 6,
,3262102924,3261101484,3323039650,145408,145417,3262102924,SIBIU,,,202,"""SCOALA GIMNAZIALA WALDORF """"HANS SPALINGER"""" ROSIA""",SCOALA GIMNAZIALA WALDORF HANS SPALINGER ROSIA,ROŞIA,SCOLII,
,3262102978,3261101484,320672906,145408,145453,3262102978,SIBIU,,,402,GRADINITA CU PROGRAM NORMAL NOU,GRADINITA CU PROGRAM NORMAL NOU,NOU,Lambrich,
,3262103545,3261102458,320674435,144349,144367,3262103545,SIBIU,,,32,SCOALA GIMNAZIALA BUZD,SCOALA GIMNAZIALA BUZD,BUZD,Principala,
,3262100899,3261101629,320671641,143619,143628,3262100899,SIBIU,,,,GRADINITA CU PROGRAM NORMAL NR 1 MEDIAS,GRADINITA CU PROGRAM NORMAL NR 1 MEDIAS,MEDIAŞ,AZILULUI NR 1,
,3262103789,3261102087,,143450,143469,3262103789,SIBIU,,,16,"""CENTRUL DE ZI """"CASA LUMINII"""" SIBIU""",CENTRUL DE ZI CASA LUMINII SIBIU,SIBIU,Plopilor,
,3262103405,3261100135,320831277,144615,144642,3262103405,SIBIU,,,230,GRADINITA CU PROGRAM NORMAL VALCHID,GRADINITA CU PROGRAM NORMAL VALCHID,VALCHID,,
17896488,3261101362,,320675166,145355,145364,3261101362,SIBIU,,,415,SCOALA GIMNAZIALA RACOVITA,SCOALA GIMNAZIALA RACOVITA,RACOVIŢA,principala,
4678937,3261102354,,321130072,143450,143469,3261102354,SIBIU,,,,GRADINITA CU PROGRAM PRELUNGIT NR 42 SIBIU,GRADINITA CU PROGRAM PRELUNGIT NR 42 SIBIU,SIBIU,NICOLAE IORGA 56A,
17739556,3261101751,,320673625,143450,143469,3261101751,SIBIU,,,13,"""SCOALA GIMNAZIALA """"RADU SELEJAN"""" SIBIU""",SCOALA GIMNAZIALA RADU SELEJAN SIBIU,SIBIU,Şoimului,
17771336,3261101285,,320674564,144535,144544,3261101285,SIBIU,,,570,"""SCOALA GIMNAZIALA """"BADEA CIRTAN"""" CIRTISOARA""",SCOALA GIMNAZIALA BADEA CIRTAN CIRTISOARA,CÂRŢIŞOARA,PRINCIPALA,
,3262100429,3261101891,320672047,144116,144125,3262100429,SIBIU,,,107,GRADINITA CU PROGRAM NORMAL AXENTE SEVER,GRADINITA CU PROGRAM NORMAL AXENTE SEVER,AXENTE SEVER,Principala,
